{
  "address": "0x831700625F588A1F1EcD636a33f5a1C276509661",
  "abi": [
    {
      "inputs": [],
      "name": "AcceptAdminPendingAdminCheck",
      "type": "error"
    },
    {
      "inputs": [
        {
          "internalType": "uint256",
          "name": "actualAddAmount",
          "type": "uint256"
        }
      ],
      "name": "AddReservesFactorFreshCheck",
      "type": "error"
    },
    {
      "inputs": [],
      "name": "BorrowCashNotAvailable",
      "type": "error"
    },
    {
      "inputs": [
        {
          "internalType": "uint256",
          "name": "errorCode",
          "type": "uint256"
        }
      ],
      "name": "BorrowComptrollerRejection",
      "type": "error"
    },
    {
      "inputs": [],
      "name": "BorrowFreshnessCheck",
      "type": "error"
    },
    {
      "inputs": [
        {
          "internalType": "uint256",
          "name": "errorCode",
          "type": "uint256"
        }
      ],
      "name": "LiquidateAccrueBorrowInterestFailed",
      "type": "error"
    },
    {
      "inputs": [
        {
          "internalType": "uint256",
          "name": "errorCode",
          "type": "uint256"
        }
      ],
      "name": "LiquidateAccrueCollateralInterestFailed",
      "type": "error"
    },
    {
      "inputs": [],
      "name": "LiquidateCloseAmountIsUintMax",
      "type": "error"
    },
    {
      "inputs": [],
      "name": "LiquidateCloseAmountIsZero",
      "type": "error"
    },
    {
      "inputs": [],
      "name": "LiquidateCollateralFreshnessCheck",
      "type": "error"
    },
    {
      "inputs": [
        {
          "internalType": "uint256",
          "name": "errorCode",
          "type": "uint256"
        }
      ],
      "name": "LiquidateComptrollerRejection",
      "type": "error"
    },
    {
      "inputs": [],
      "name": "LiquidateFreshnessCheck",
      "type": "error"
    },
    {
      "inputs": [],
      "name": "LiquidateLiquidatorIsBorrower",
      "type": "error"
    },
    {
      "inputs": [
        {
          "internalType": "uint256",
          "name": "errorCode",
          "type": "uint256"
        }
      ],
      "name": "LiquidateRepayBorrowFreshFailed",
      "type": "error"
    },
    {
      "inputs": [
        {
          "internalType": "uint256",
          "name": "errorCode",
          "type": "uint256"
        }
      ],
      "name": "LiquidateSeizeComptrollerRejection",
      "type": "error"
    },
    {
      "inputs": [],
      "name": "LiquidateSeizeLiquidatorIsBorrower",
      "type": "error"
    },
    {
      "inputs": [
        {
          "internalType": "uint256",
          "name": "errorCode",
          "type": "uint256"
        }
      ],
      "name": "MintComptrollerRejection",
      "type": "error"
    },
    {
      "inputs": [],
      "name": "MintFreshnessCheck",
      "type": "error"
    },
    {
      "inputs": [
        {
          "internalType": "uint256",
          "name": "errorCode",
          "type": "uint256"
        }
      ],
      "name": "RedeemComptrollerRejection",
      "type": "error"
    },
    {
      "inputs": [],
      "name": "RedeemFreshnessCheck",
      "type": "error"
    },
    {
      "inputs": [],
      "name": "RedeemTransferOutNotPossible",
      "type": "error"
    },
    {
      "inputs": [],
      "name": "ReduceReservesAdminCheck",
      "type": "error"
    },
    {
      "inputs": [],
      "name": "ReduceReservesCashNotAvailable",
      "type": "error"
    },
    {
      "inputs": [],
      "name": "ReduceReservesCashValidation",
      "type": "error"
    },
    {
      "inputs": [],
      "name": "ReduceReservesFreshCheck",
      "type": "error"
    },
    {
      "inputs": [
        {
          "internalType": "uint256",
          "name": "errorCode",
          "type": "uint256"
        }
      ],
      "name": "RepayBorrowComptrollerRejection",
      "type": "error"
    },
    {
      "inputs": [],
      "name": "RepayBorrowFreshnessCheck",
      "type": "error"
    },
    {
      "inputs": [],
      "name": "SetComptrollerOwnerCheck",
      "type": "error"
    },
    {
      "inputs": [],
      "name": "SetInterestRateModelFreshCheck",
      "type": "error"
    },
    {
      "inputs": [],
      "name": "SetInterestRateModelOwnerCheck",
      "type": "error"
    },
    {
      "inputs": [],
      "name": "SetPendingAdminOwnerCheck",
      "type": "error"
    },
    {
      "inputs": [],
      "name": "SetReserveFactorAdminCheck",
      "type": "error"
    },
    {
      "inputs": [],
      "name": "SetReserveFactorBoundsCheck",
      "type": "error"
    },
    {
      "inputs": [],
      "name": "SetReserveFactorFreshCheck",
      "type": "error"
    },
    {
      "inputs": [],
      "name": "SetReserveGuardianOwnerCheck",
      "type": "error"
    },
    {
      "inputs": [
        {
          "internalType": "uint256",
          "name": "errorCode",
          "type": "uint256"
        }
      ],
      "name": "TransferComptrollerRejection",
      "type": "error"
    },
    {
      "inputs": [],
      "name": "TransferNotAllowed",
      "type": "error"
    },
    {
      "inputs": [],
      "name": "TransferNotEnough",
      "type": "error"
    },
    {
      "inputs": [],
      "name": "TransferTooMuch",
      "type": "error"
    },
    {
      "anonymous": false,
      "inputs": [
        {
          "indexed": false,
          "internalType": "uint256",
          "name": "cashPrior",
          "type": "uint256"
        },
        {
          "indexed": false,
          "internalType": "uint256",
          "name": "interestAccumulated",
          "type": "uint256"
        },
        {
          "indexed": false,
          "internalType": "uint256",
          "name": "borrowIndex",
          "type": "uint256"
        },
        {
          "indexed": false,
          "internalType": "uint256",
          "name": "totalBorrows",
          "type": "uint256"
        }
      ],
      "name": "AccrueInterest",
      "type": "event"
    },
    {
      "anonymous": false,
      "inputs": [
        {
          "indexed": true,
          "internalType": "address",
          "name": "owner",
          "type": "address"
        },
        {
          "indexed": true,
          "internalType": "address",
          "name": "spender",
          "type": "address"
        },
        {
          "indexed": false,
          "internalType": "uint256",
          "name": "amount",
          "type": "uint256"
        }
      ],
      "name": "Approval",
      "type": "event"
    },
    {
      "anonymous": false,
      "inputs": [
        {
          "indexed": false,
          "internalType": "address",
          "name": "borrower",
          "type": "address"
        },
        {
          "indexed": false,
          "internalType": "uint256",
          "name": "borrowAmount",
          "type": "uint256"
        },
        {
          "indexed": false,
          "internalType": "uint256",
          "name": "accountBorrows",
          "type": "uint256"
        },
        {
          "indexed": false,
          "internalType": "uint256",
          "name": "totalBorrows",
          "type": "uint256"
        }
      ],
      "name": "Borrow",
      "type": "event"
    },
    {
      "anonymous": false,
      "inputs": [
        {
          "indexed": false,
          "internalType": "uint8",
          "name": "version",
          "type": "uint8"
        }
      ],
      "name": "Initialized",
      "type": "event"
    },
    {
      "anonymous": false,
      "inputs": [
        {
          "indexed": false,
          "internalType": "address",
          "name": "liquidator",
          "type": "address"
        },
        {
          "indexed": false,
          "internalType": "address",
          "name": "borrower",
          "type": "address"
        },
        {
          "indexed": false,
          "internalType": "uint256",
          "name": "repayAmount",
          "type": "uint256"
        },
        {
          "indexed": false,
          "internalType": "address",
          "name": "cTokenCollateral",
          "type": "address"
        },
        {
          "indexed": false,
          "internalType": "uint256",
          "name": "seizeTokens",
          "type": "uint256"
        }
      ],
      "name": "LiquidateBorrow",
      "type": "event"
    },
    {
      "anonymous": false,
      "inputs": [
        {
          "indexed": false,
          "internalType": "address",
          "name": "minter",
          "type": "address"
        },
        {
          "indexed": false,
          "internalType": "uint256",
          "name": "mintAmount",
          "type": "uint256"
        },
        {
          "indexed": false,
          "internalType": "uint256",
          "name": "mintTokens",
          "type": "uint256"
        }
      ],
      "name": "Mint",
      "type": "event"
    },
    {
      "anonymous": false,
      "inputs": [
        {
          "indexed": false,
          "internalType": "address",
          "name": "oldAdmin",
          "type": "address"
        },
        {
          "indexed": false,
          "internalType": "address",
          "name": "newAdmin",
          "type": "address"
        }
      ],
      "name": "NewAdmin",
      "type": "event"
    },
    {
      "anonymous": false,
      "inputs": [
        {
          "indexed": false,
          "internalType": "contract ComptrollerInterface",
          "name": "oldComptroller",
          "type": "address"
        },
        {
          "indexed": false,
          "internalType": "contract ComptrollerInterface",
          "name": "newComptroller",
          "type": "address"
        }
      ],
      "name": "NewComptroller",
      "type": "event"
    },
    {
      "anonymous": false,
      "inputs": [
        {
          "indexed": false,
          "internalType": "contract InterestRateModel",
          "name": "oldInterestRateModel",
          "type": "address"
        },
        {
          "indexed": false,
          "internalType": "contract InterestRateModel",
          "name": "newInterestRateModel",
          "type": "address"
        }
      ],
      "name": "NewMarketInterestRateModel",
      "type": "event"
    },
    {
      "anonymous": false,
      "inputs": [
        {
          "indexed": false,
          "internalType": "address",
          "name": "oldPendingAdmin",
          "type": "address"
        },
        {
          "indexed": false,
          "internalType": "address",
          "name": "newPendingAdmin",
          "type": "address"
        }
      ],
      "name": "NewPendingAdmin",
      "type": "event"
    },
    {
      "anonymous": false,
      "inputs": [
        {
          "indexed": false,
          "internalType": "uint256",
          "name": "oldReserveFactorMantissa",
          "type": "uint256"
        },
        {
          "indexed": false,
          "internalType": "uint256",
          "name": "newReserveFactorMantissa",
          "type": "uint256"
        }
      ],
      "name": "NewReserveFactor",
      "type": "event"
    },
    {
      "anonymous": false,
      "inputs": [
        {
          "indexed": false,
          "internalType": "address",
          "name": "oldReserveGuardian",
          "type": "address"
        },
        {
          "indexed": false,
          "internalType": "address",
          "name": "newReserveGuardian",
          "type": "address"
        }
      ],
      "name": "NewReserveGuardian",
      "type": "event"
    },
    {
      "anonymous": false,
      "inputs": [
        {
          "indexed": false,
          "internalType": "address",
          "name": "redeemer",
          "type": "address"
        },
        {
          "indexed": false,
          "internalType": "uint256",
          "name": "redeemAmount",
          "type": "uint256"
        },
        {
          "indexed": false,
          "internalType": "uint256",
          "name": "redeemTokens",
          "type": "uint256"
        }
      ],
      "name": "Redeem",
      "type": "event"
    },
    {
      "anonymous": false,
      "inputs": [
        {
          "indexed": false,
          "internalType": "address",
          "name": "payer",
          "type": "address"
        },
        {
          "indexed": false,
          "internalType": "address",
          "name": "borrower",
          "type": "address"
        },
        {
          "indexed": false,
          "internalType": "uint256",
          "name": "repayAmount",
          "type": "uint256"
        },
        {
          "indexed": false,
          "internalType": "uint256",
          "name": "accountBorrows",
          "type": "uint256"
        },
        {
          "indexed": false,
          "internalType": "uint256",
          "name": "totalBorrows",
          "type": "uint256"
        }
      ],
      "name": "RepayBorrow",
      "type": "event"
    },
    {
      "anonymous": false,
      "inputs": [
        {
          "indexed": false,
          "internalType": "address",
          "name": "benefactor",
          "type": "address"
        },
        {
          "indexed": false,
          "internalType": "uint256",
          "name": "addAmount",
          "type": "uint256"
        },
        {
          "indexed": false,
          "internalType": "uint256",
          "name": "newTotalReserves",
          "type": "uint256"
        }
      ],
      "name": "ReservesAdded",
      "type": "event"
    },
    {
      "anonymous": false,
      "inputs": [
        {
          "indexed": false,
          "internalType": "address",
          "name": "admin",
          "type": "address"
        },
        {
          "indexed": false,
          "internalType": "uint256",
          "name": "reduceAmount",
          "type": "uint256"
        },
        {
          "indexed": false,
          "internalType": "uint256",
          "name": "newTotalReserves",
          "type": "uint256"
        }
      ],
      "name": "ReservesReduced",
      "type": "event"
    },
    {
      "anonymous": false,
      "inputs": [
        {
          "indexed": true,
          "internalType": "address",
          "name": "from",
          "type": "address"
        },
        {
          "indexed": true,
          "internalType": "address",
          "name": "to",
          "type": "address"
        },
        {
          "indexed": false,
          "internalType": "uint256",
          "name": "amount",
          "type": "uint256"
        }
      ],
      "name": "Transfer",
      "type": "event"
    },
    {
      "inputs": [],
      "name": "NO_ERROR",
      "outputs": [
        {
          "internalType": "uint256",
          "name": "",
          "type": "uint256"
        }
      ],
      "stateMutability": "view",
      "type": "function"
    },
    {
      "inputs": [],
      "name": "_acceptAdmin",
      "outputs": [
        {
          "internalType": "uint256",
          "name": "",
          "type": "uint256"
        }
      ],
      "stateMutability": "nonpayable",
      "type": "function"
    },
    {
      "inputs": [
        {
          "internalType": "uint256",
          "name": "addAmount",
          "type": "uint256"
        }
      ],
      "name": "_addReserves",
      "outputs": [
        {
          "internalType": "uint256",
          "name": "",
          "type": "uint256"
        }
      ],
      "stateMutability": "nonpayable",
      "type": "function"
    },
    {
      "inputs": [
        {
          "internalType": "address",
          "name": "compLikeDelegatee",
          "type": "address"
        }
      ],
      "name": "_delegateCompLikeTo",
      "outputs": [],
      "stateMutability": "nonpayable",
      "type": "function"
    },
    {
      "inputs": [
        {
          "internalType": "uint256",
          "name": "reduceAmount",
          "type": "uint256"
        }
      ],
      "name": "_reduceReserves",
      "outputs": [
        {
          "internalType": "uint256",
          "name": "",
          "type": "uint256"
        }
      ],
      "stateMutability": "nonpayable",
      "type": "function"
    },
    {
      "inputs": [
        {
          "internalType": "contract ComptrollerInterface",
          "name": "newComptroller",
          "type": "address"
        }
      ],
      "name": "_setComptroller",
      "outputs": [
        {
          "internalType": "uint256",
          "name": "",
          "type": "uint256"
        }
      ],
      "stateMutability": "nonpayable",
      "type": "function"
    },
    {
      "inputs": [
        {
          "internalType": "contract InterestRateModel",
          "name": "newInterestRateModel",
          "type": "address"
        }
      ],
      "name": "_setInterestRateModel",
      "outputs": [
        {
          "internalType": "uint256",
          "name": "",
          "type": "uint256"
        }
      ],
      "stateMutability": "nonpayable",
      "type": "function"
    },
    {
      "inputs": [
        {
          "internalType": "address payable",
          "name": "newPendingAdmin",
          "type": "address"
        }
      ],
      "name": "_setPendingAdmin",
      "outputs": [
        {
          "internalType": "uint256",
          "name": "",
          "type": "uint256"
        }
      ],
      "stateMutability": "nonpayable",
      "type": "function"
    },
    {
      "inputs": [
        {
          "internalType": "uint256",
          "name": "newReserveFactorMantissa",
          "type": "uint256"
        }
      ],
      "name": "_setReserveFactor",
      "outputs": [
        {
          "internalType": "uint256",
          "name": "",
          "type": "uint256"
        }
      ],
      "stateMutability": "nonpayable",
      "type": "function"
    },
    {
      "inputs": [
        {
          "internalType": "address payable",
          "name": "newReserveGuardian",
          "type": "address"
        }
      ],
      "name": "_setReserveGuardian",
      "outputs": [
        {
          "internalType": "uint256",
          "name": "",
          "type": "uint256"
        }
      ],
      "stateMutability": "nonpayable",
      "type": "function"
    },
    {
      "inputs": [],
      "name": "accrualBlockNumber",
      "outputs": [
        {
          "internalType": "uint256",
          "name": "",
          "type": "uint256"
        }
      ],
      "stateMutability": "view",
      "type": "function"
    },
    {
      "inputs": [],
      "name": "accrueInterest",
      "outputs": [
        {
          "internalType": "uint256",
          "name": "",
          "type": "uint256"
        }
      ],
      "stateMutability": "nonpayable",
      "type": "function"
    },
    {
      "inputs": [],
      "name": "admin",
      "outputs": [
        {
          "internalType": "address payable",
          "name": "",
          "type": "address"
        }
      ],
      "stateMutability": "view",
      "type": "function"
    },
    {
      "inputs": [
        {
          "internalType": "address",
          "name": "owner",
          "type": "address"
        },
        {
          "internalType": "address",
          "name": "spender",
          "type": "address"
        }
      ],
      "name": "allowance",
      "outputs": [
        {
          "internalType": "uint256",
          "name": "",
          "type": "uint256"
        }
      ],
      "stateMutability": "view",
      "type": "function"
    },
    {
      "inputs": [
        {
          "internalType": "address",
          "name": "spender",
          "type": "address"
        },
        {
          "internalType": "uint256",
          "name": "amount",
          "type": "uint256"
        }
      ],
      "name": "approve",
      "outputs": [
        {
          "internalType": "bool",
          "name": "",
          "type": "bool"
        }
      ],
      "stateMutability": "nonpayable",
      "type": "function"
    },
    {
      "inputs": [
        {
          "internalType": "address",
          "name": "owner",
          "type": "address"
        }
      ],
      "name": "balanceOf",
      "outputs": [
        {
          "internalType": "uint256",
          "name": "",
          "type": "uint256"
        }
      ],
      "stateMutability": "view",
      "type": "function"
    },
    {
      "inputs": [
        {
          "internalType": "address",
          "name": "owner",
          "type": "address"
        }
      ],
      "name": "balanceOfUnderlying",
      "outputs": [
        {
          "internalType": "uint256",
          "name": "",
          "type": "uint256"
        }
      ],
      "stateMutability": "nonpayable",
      "type": "function"
    },
    {
      "inputs": [
        {
          "internalType": "uint256",
          "name": "borrowAmount",
          "type": "uint256"
        }
      ],
      "name": "borrow",
      "outputs": [
        {
          "internalType": "uint256",
          "name": "",
          "type": "uint256"
        }
      ],
      "stateMutability": "nonpayable",
      "type": "function"
    },
    {
      "inputs": [
        {
          "internalType": "address",
          "name": "account",
          "type": "address"
        }
      ],
      "name": "borrowBalanceCurrent",
      "outputs": [
        {
          "internalType": "uint256",
          "name": "",
          "type": "uint256"
        }
      ],
      "stateMutability": "nonpayable",
      "type": "function"
    },
    {
      "inputs": [
        {
          "internalType": "address",
          "name": "account",
          "type": "address"
        }
      ],
      "name": "borrowBalanceStored",
      "outputs": [
        {
          "internalType": "uint256",
          "name": "",
          "type": "uint256"
        }
      ],
      "stateMutability": "view",
      "type": "function"
    },
    {
      "inputs": [],
      "name": "borrowIndex",
      "outputs": [
        {
          "internalType": "uint256",
          "name": "",
          "type": "uint256"
        }
      ],
      "stateMutability": "view",
      "type": "function"
    },
    {
      "inputs": [],
      "name": "borrowRatePerBlock",
      "outputs": [
        {
          "internalType": "uint256",
          "name": "",
          "type": "uint256"
        }
      ],
      "stateMutability": "view",
      "type": "function"
    },
    {
      "inputs": [],
      "name": "comptroller",
      "outputs": [
        {
          "internalType": "contract ComptrollerInterface",
          "name": "",
          "type": "address"
        }
      ],
      "stateMutability": "view",
      "type": "function"
    },
    {
      "inputs": [],
      "name": "decimals",
      "outputs": [
        {
          "internalType": "uint8",
          "name": "",
          "type": "uint8"
        }
      ],
      "stateMutability": "view",
      "type": "function"
    },
    {
      "inputs": [],
      "name": "exchangeRateCurrent",
      "outputs": [
        {
          "internalType": "uint256",
          "name": "",
          "type": "uint256"
        }
      ],
      "stateMutability": "nonpayable",
      "type": "function"
    },
    {
      "inputs": [],
      "name": "exchangeRateStored",
      "outputs": [
        {
          "internalType": "uint256",
          "name": "",
          "type": "uint256"
        }
      ],
      "stateMutability": "view",
      "type": "function"
    },
    {
      "inputs": [
        {
          "internalType": "address",
          "name": "account",
          "type": "address"
        }
      ],
      "name": "getAccountSnapshot",
      "outputs": [
        {
          "internalType": "uint256",
          "name": "",
          "type": "uint256"
        },
        {
          "internalType": "uint256",
          "name": "",
          "type": "uint256"
        },
        {
          "internalType": "uint256",
          "name": "",
          "type": "uint256"
        },
        {
          "internalType": "uint256",
          "name": "",
          "type": "uint256"
        }
      ],
      "stateMutability": "view",
      "type": "function"
    },
    {
      "inputs": [],
      "name": "getCash",
      "outputs": [
        {
          "internalType": "uint256",
          "name": "",
          "type": "uint256"
        }
      ],
      "stateMutability": "view",
      "type": "function"
    },
    {
      "inputs": [
        {
          "internalType": "address",
          "name": "underlying_",
          "type": "address"
        },
        {
          "internalType": "contract ComptrollerInterface",
          "name": "comptroller_",
          "type": "address"
        },
        {
          "internalType": "contract InterestRateModel",
          "name": "interestRateModel_",
          "type": "address"
        },
        {
          "internalType": "uint256",
          "name": "initialExchangeRateMantissa_",
          "type": "uint256"
        },
        {
          "internalType": "string",
          "name": "name_",
          "type": "string"
        },
        {
          "internalType": "string",
          "name": "symbol_",
          "type": "string"
        },
        {
          "internalType": "uint8",
          "name": "decimals_",
          "type": "uint8"
        }
      ],
      "name": "initialize",
      "outputs": [],
      "stateMutability": "nonpayable",
      "type": "function"
    },
    {
      "inputs": [
        {
          "internalType": "contract ComptrollerInterface",
          "name": "comptroller_",
          "type": "address"
        },
        {
          "internalType": "contract InterestRateModel",
          "name": "interestRateModel_",
          "type": "address"
        },
        {
          "internalType": "uint256",
          "name": "initialExchangeRateMantissa_",
          "type": "uint256"
        },
        {
          "internalType": "string",
          "name": "name_",
          "type": "string"
        },
        {
          "internalType": "string",
          "name": "symbol_",
          "type": "string"
        },
        {
          "internalType": "uint8",
          "name": "decimals_",
          "type": "uint8"
        }
      ],
      "name": "initialize",
      "outputs": [],
      "stateMutability": "nonpayable",
      "type": "function"
    },
    {
      "inputs": [],
      "name": "interestRateModel",
      "outputs": [
        {
          "internalType": "contract InterestRateModel",
          "name": "",
          "type": "address"
        }
      ],
      "stateMutability": "view",
      "type": "function"
    },
    {
      "inputs": [],
      "name": "isCToken",
      "outputs": [
        {
          "internalType": "bool",
          "name": "",
          "type": "bool"
        }
      ],
      "stateMutability": "view",
      "type": "function"
    },
    {
      "inputs": [
        {
          "internalType": "address",
          "name": "borrower",
          "type": "address"
        },
        {
          "internalType": "uint256",
          "name": "repayAmount",
          "type": "uint256"
        },
        {
          "internalType": "contract CTokenInterface",
          "name": "cTokenCollateral",
          "type": "address"
        }
      ],
      "name": "liquidateBorrow",
      "outputs": [
        {
          "internalType": "uint256",
          "name": "",
          "type": "uint256"
        }
      ],
      "stateMutability": "nonpayable",
      "type": "function"
    },
    {
      "inputs": [
        {
          "internalType": "uint256",
          "name": "mintAmount",
          "type": "uint256"
        }
      ],
      "name": "mint",
      "outputs": [
        {
          "internalType": "uint256",
          "name": "",
          "type": "uint256"
        }
      ],
      "stateMutability": "nonpayable",
      "type": "function"
    },
    {
      "inputs": [],
      "name": "name",
      "outputs": [
        {
          "internalType": "string",
          "name": "",
          "type": "string"
        }
      ],
      "stateMutability": "view",
      "type": "function"
    },
    {
      "inputs": [],
      "name": "pendingAdmin",
      "outputs": [
        {
          "internalType": "address payable",
          "name": "",
          "type": "address"
        }
      ],
      "stateMutability": "view",
      "type": "function"
    },
    {
      "inputs": [],
      "name": "protocolSeizeShareMantissa",
      "outputs": [
        {
          "internalType": "uint256",
          "name": "",
          "type": "uint256"
        }
      ],
      "stateMutability": "view",
      "type": "function"
    },
    {
      "inputs": [
        {
          "internalType": "address",
          "name": "underlying_",
          "type": "address"
        },
        {
          "internalType": "contract ComptrollerInterface",
          "name": "comptroller_",
          "type": "address"
        },
        {
          "internalType": "contract InterestRateModel",
          "name": "interestRateModel_",
          "type": "address"
        },
        {
          "internalType": "uint256",
          "name": "initialExchangeRateMantissa_",
          "type": "uint256"
        },
        {
          "internalType": "string",
          "name": "name_",
          "type": "string"
        },
        {
          "internalType": "string",
          "name": "symbol_",
          "type": "string"
        },
        {
          "internalType": "uint8",
          "name": "decimals_",
          "type": "uint8"
        },
        {
          "internalType": "address payable",
          "name": "admin_",
          "type": "address"
        }
      ],
      "name": "proxyInitialize",
      "outputs": [],
      "stateMutability": "nonpayable",
      "type": "function"
    },
    {
      "inputs": [
        {
          "internalType": "uint256",
          "name": "redeemTokens",
          "type": "uint256"
        }
      ],
      "name": "redeem",
      "outputs": [
        {
          "internalType": "uint256",
          "name": "",
          "type": "uint256"
        }
      ],
      "stateMutability": "nonpayable",
      "type": "function"
    },
    {
      "inputs": [
        {
          "internalType": "uint256",
          "name": "redeemAmount",
          "type": "uint256"
        }
      ],
      "name": "redeemUnderlying",
      "outputs": [
        {
          "internalType": "uint256",
          "name": "",
          "type": "uint256"
        }
      ],
      "stateMutability": "nonpayable",
      "type": "function"
    },
    {
      "inputs": [
        {
          "internalType": "uint256",
          "name": "repayAmount",
          "type": "uint256"
        }
      ],
      "name": "repayBorrow",
      "outputs": [
        {
          "internalType": "uint256",
          "name": "",
          "type": "uint256"
        }
      ],
      "stateMutability": "nonpayable",
      "type": "function"
    },
    {
      "inputs": [
        {
          "internalType": "address",
          "name": "borrower",
          "type": "address"
        },
        {
          "internalType": "uint256",
          "name": "repayAmount",
          "type": "uint256"
        }
      ],
      "name": "repayBorrowBehalf",
      "outputs": [
        {
          "internalType": "uint256",
          "name": "",
          "type": "uint256"
        }
      ],
      "stateMutability": "nonpayable",
      "type": "function"
    },
    {
      "inputs": [],
      "name": "reserveFactorMantissa",
      "outputs": [
        {
          "internalType": "uint256",
          "name": "",
          "type": "uint256"
        }
      ],
      "stateMutability": "view",
      "type": "function"
    },
    {
      "inputs": [],
      "name": "reserveGuardian",
      "outputs": [
        {
          "internalType": "address payable",
          "name": "",
          "type": "address"
        }
      ],
      "stateMutability": "view",
      "type": "function"
    },
    {
      "inputs": [
        {
          "internalType": "address",
          "name": "liquidator",
          "type": "address"
        },
        {
          "internalType": "address",
          "name": "borrower",
          "type": "address"
        },
        {
          "internalType": "uint256",
          "name": "seizeTokens",
          "type": "uint256"
        }
      ],
      "name": "seize",
      "outputs": [
        {
          "internalType": "uint256",
          "name": "",
          "type": "uint256"
        }
      ],
      "stateMutability": "nonpayable",
      "type": "function"
    },
    {
      "inputs": [],
      "name": "supplyRatePerBlock",
      "outputs": [
        {
          "internalType": "uint256",
          "name": "",
          "type": "uint256"
        }
      ],
      "stateMutability": "view",
      "type": "function"
    },
    {
      "inputs": [
        {
          "internalType": "contract EIP20NonStandardInterface",
          "name": "token",
          "type": "address"
        }
      ],
      "name": "sweepToken",
      "outputs": [],
      "stateMutability": "nonpayable",
      "type": "function"
    },
    {
      "inputs": [],
      "name": "symbol",
      "outputs": [
        {
          "internalType": "string",
          "name": "",
          "type": "string"
        }
      ],
      "stateMutability": "view",
      "type": "function"
    },
    {
      "inputs": [],
      "name": "totalBorrows",
      "outputs": [
        {
          "internalType": "uint256",
          "name": "",
          "type": "uint256"
        }
      ],
      "stateMutability": "view",
      "type": "function"
    },
    {
      "inputs": [],
      "name": "totalBorrowsCurrent",
      "outputs": [
        {
          "internalType": "uint256",
          "name": "",
          "type": "uint256"
        }
      ],
      "stateMutability": "nonpayable",
      "type": "function"
    },
    {
      "inputs": [],
      "name": "totalReserves",
      "outputs": [
        {
          "internalType": "uint256",
          "name": "",
          "type": "uint256"
        }
      ],
      "stateMutability": "view",
      "type": "function"
    },
    {
      "inputs": [],
      "name": "totalSupply",
      "outputs": [
        {
          "internalType": "uint256",
          "name": "",
          "type": "uint256"
        }
      ],
      "stateMutability": "view",
      "type": "function"
    },
    {
      "inputs": [
        {
          "internalType": "address",
          "name": "dst",
          "type": "address"
        },
        {
          "internalType": "uint256",
          "name": "amount",
          "type": "uint256"
        }
      ],
      "name": "transfer",
      "outputs": [
        {
          "internalType": "bool",
          "name": "",
          "type": "bool"
        }
      ],
      "stateMutability": "nonpayable",
      "type": "function"
    },
    {
      "inputs": [
        {
          "internalType": "address",
          "name": "src",
          "type": "address"
        },
        {
          "internalType": "address",
          "name": "dst",
          "type": "address"
        },
        {
          "internalType": "uint256",
          "name": "amount",
          "type": "uint256"
        }
      ],
      "name": "transferFrom",
      "outputs": [
        {
          "internalType": "bool",
          "name": "",
          "type": "bool"
        }
      ],
      "stateMutability": "nonpayable",
      "type": "function"
    },
    {
      "inputs": [],
      "name": "underlying",
      "outputs": [
        {
          "internalType": "address",
          "name": "",
          "type": "address"
        }
      ],
      "stateMutability": "view",
      "type": "function"
    }
  ],
  "transactionHash": "0x67fa058941938ae40ebdf9d5c2ecfdcbbb2cd201d7cd853f93e04a50c6ca9b2e",
  "receipt": {
    "to": null,
    "from": "0x6a39C1B89a25a8fA399fF73766417ED2213d5dEe",
    "contractAddress": "0x831700625F588A1F1EcD636a33f5a1C276509661",
    "transactionIndex": 0,
    "gasUsed": "3502971",
    "logsBloom": "0x00000000000000000000000000000000000000000000000000000000000000000000000000000000000000000000000000000000000000000000000000000000000000000000000000000000000000000000000000000000000000000000000000000000000000000000000000000000000000000000000000000000000000000000000000000000000000000000000000000000000000000000000000000000000000000000000000000000000000000000000000000000000000000000000000000000000000000000000000000000000000000000000000000000000000000000000000000000000000000000000000000000000000000000000000000000",
    "blockHash": "0x246f20bf1f0bddb2ad3afd0f95d98e269707d5fcaeb7974fd5c4f2339981675c",
    "transactionHash": "0x67fa058941938ae40ebdf9d5c2ecfdcbbb2cd201d7cd853f93e04a50c6ca9b2e",
    "logs": [],
    "blockNumber": 1295995,
    "cumulativeGasUsed": "3502971",
    "status": 1,
    "byzantium": true
  },
  "args": [],
  "numDeployments": 1,
  "solcInputHash": "24d35fea140db672f962df919b678bdd",
  "metadata": "{\"compiler\":{\"version\":\"0.8.10+commit.fc410830\"},\"language\":\"Solidity\",\"output\":{\"abi\":[{\"inputs\":[],\"name\":\"AcceptAdminPendingAdminCheck\",\"type\":\"error\"},{\"inputs\":[{\"internalType\":\"uint256\",\"name\":\"actualAddAmount\",\"type\":\"uint256\"}],\"name\":\"AddReservesFactorFreshCheck\",\"type\":\"error\"},{\"inputs\":[],\"name\":\"BorrowCashNotAvailable\",\"type\":\"error\"},{\"inputs\":[{\"internalType\":\"uint256\",\"name\":\"errorCode\",\"type\":\"uint256\"}],\"name\":\"BorrowComptrollerRejection\",\"type\":\"error\"},{\"inputs\":[],\"name\":\"BorrowFreshnessCheck\",\"type\":\"error\"},{\"inputs\":[{\"internalType\":\"uint256\",\"name\":\"errorCode\",\"type\":\"uint256\"}],\"name\":\"LiquidateAccrueBorrowInterestFailed\",\"type\":\"error\"},{\"inputs\":[{\"internalType\":\"uint256\",\"name\":\"errorCode\",\"type\":\"uint256\"}],\"name\":\"LiquidateAccrueCollateralInterestFailed\",\"type\":\"error\"},{\"inputs\":[],\"name\":\"LiquidateCloseAmountIsUintMax\",\"type\":\"error\"},{\"inputs\":[],\"name\":\"LiquidateCloseAmountIsZero\",\"type\":\"error\"},{\"inputs\":[],\"name\":\"LiquidateCollateralFreshnessCheck\",\"type\":\"error\"},{\"inputs\":[{\"internalType\":\"uint256\",\"name\":\"errorCode\",\"type\":\"uint256\"}],\"name\":\"LiquidateComptrollerRejection\",\"type\":\"error\"},{\"inputs\":[],\"name\":\"LiquidateFreshnessCheck\",\"type\":\"error\"},{\"inputs\":[],\"name\":\"LiquidateLiquidatorIsBorrower\",\"type\":\"error\"},{\"inputs\":[{\"internalType\":\"uint256\",\"name\":\"errorCode\",\"type\":\"uint256\"}],\"name\":\"LiquidateRepayBorrowFreshFailed\",\"type\":\"error\"},{\"inputs\":[{\"internalType\":\"uint256\",\"name\":\"errorCode\",\"type\":\"uint256\"}],\"name\":\"LiquidateSeizeComptrollerRejection\",\"type\":\"error\"},{\"inputs\":[],\"name\":\"LiquidateSeizeLiquidatorIsBorrower\",\"type\":\"error\"},{\"inputs\":[{\"internalType\":\"uint256\",\"name\":\"errorCode\",\"type\":\"uint256\"}],\"name\":\"MintComptrollerRejection\",\"type\":\"error\"},{\"inputs\":[],\"name\":\"MintFreshnessCheck\",\"type\":\"error\"},{\"inputs\":[{\"internalType\":\"uint256\",\"name\":\"errorCode\",\"type\":\"uint256\"}],\"name\":\"RedeemComptrollerRejection\",\"type\":\"error\"},{\"inputs\":[],\"name\":\"RedeemFreshnessCheck\",\"type\":\"error\"},{\"inputs\":[],\"name\":\"RedeemTransferOutNotPossible\",\"type\":\"error\"},{\"inputs\":[],\"name\":\"ReduceReservesAdminCheck\",\"type\":\"error\"},{\"inputs\":[],\"name\":\"ReduceReservesCashNotAvailable\",\"type\":\"error\"},{\"inputs\":[],\"name\":\"ReduceReservesCashValidation\",\"type\":\"error\"},{\"inputs\":[],\"name\":\"ReduceReservesFreshCheck\",\"type\":\"error\"},{\"inputs\":[{\"internalType\":\"uint256\",\"name\":\"errorCode\",\"type\":\"uint256\"}],\"name\":\"RepayBorrowComptrollerRejection\",\"type\":\"error\"},{\"inputs\":[],\"name\":\"RepayBorrowFreshnessCheck\",\"type\":\"error\"},{\"inputs\":[],\"name\":\"SetComptrollerOwnerCheck\",\"type\":\"error\"},{\"inputs\":[],\"name\":\"SetInterestRateModelFreshCheck\",\"type\":\"error\"},{\"inputs\":[],\"name\":\"SetInterestRateModelOwnerCheck\",\"type\":\"error\"},{\"inputs\":[],\"name\":\"SetPendingAdminOwnerCheck\",\"type\":\"error\"},{\"inputs\":[],\"name\":\"SetReserveFactorAdminCheck\",\"type\":\"error\"},{\"inputs\":[],\"name\":\"SetReserveFactorBoundsCheck\",\"type\":\"error\"},{\"inputs\":[],\"name\":\"SetReserveFactorFreshCheck\",\"type\":\"error\"},{\"inputs\":[],\"name\":\"SetReserveGuardianOwnerCheck\",\"type\":\"error\"},{\"inputs\":[{\"internalType\":\"uint256\",\"name\":\"errorCode\",\"type\":\"uint256\"}],\"name\":\"TransferComptrollerRejection\",\"type\":\"error\"},{\"inputs\":[],\"name\":\"TransferNotAllowed\",\"type\":\"error\"},{\"inputs\":[],\"name\":\"TransferNotEnough\",\"type\":\"error\"},{\"inputs\":[],\"name\":\"TransferTooMuch\",\"type\":\"error\"},{\"anonymous\":false,\"inputs\":[{\"indexed\":false,\"internalType\":\"uint256\",\"name\":\"cashPrior\",\"type\":\"uint256\"},{\"indexed\":false,\"internalType\":\"uint256\",\"name\":\"interestAccumulated\",\"type\":\"uint256\"},{\"indexed\":false,\"internalType\":\"uint256\",\"name\":\"borrowIndex\",\"type\":\"uint256\"},{\"indexed\":false,\"internalType\":\"uint256\",\"name\":\"totalBorrows\",\"type\":\"uint256\"}],\"name\":\"AccrueInterest\",\"type\":\"event\"},{\"anonymous\":false,\"inputs\":[{\"indexed\":true,\"internalType\":\"address\",\"name\":\"owner\",\"type\":\"address\"},{\"indexed\":true,\"internalType\":\"address\",\"name\":\"spender\",\"type\":\"address\"},{\"indexed\":false,\"internalType\":\"uint256\",\"name\":\"amount\",\"type\":\"uint256\"}],\"name\":\"Approval\",\"type\":\"event\"},{\"anonymous\":false,\"inputs\":[{\"indexed\":false,\"internalType\":\"address\",\"name\":\"borrower\",\"type\":\"address\"},{\"indexed\":false,\"internalType\":\"uint256\",\"name\":\"borrowAmount\",\"type\":\"uint256\"},{\"indexed\":false,\"internalType\":\"uint256\",\"name\":\"accountBorrows\",\"type\":\"uint256\"},{\"indexed\":false,\"internalType\":\"uint256\",\"name\":\"totalBorrows\",\"type\":\"uint256\"}],\"name\":\"Borrow\",\"type\":\"event\"},{\"anonymous\":false,\"inputs\":[{\"indexed\":false,\"internalType\":\"uint8\",\"name\":\"version\",\"type\":\"uint8\"}],\"name\":\"Initialized\",\"type\":\"event\"},{\"anonymous\":false,\"inputs\":[{\"indexed\":false,\"internalType\":\"address\",\"name\":\"liquidator\",\"type\":\"address\"},{\"indexed\":false,\"internalType\":\"address\",\"name\":\"borrower\",\"type\":\"address\"},{\"indexed\":false,\"internalType\":\"uint256\",\"name\":\"repayAmount\",\"type\":\"uint256\"},{\"indexed\":false,\"internalType\":\"address\",\"name\":\"cTokenCollateral\",\"type\":\"address\"},{\"indexed\":false,\"internalType\":\"uint256\",\"name\":\"seizeTokens\",\"type\":\"uint256\"}],\"name\":\"LiquidateBorrow\",\"type\":\"event\"},{\"anonymous\":false,\"inputs\":[{\"indexed\":false,\"internalType\":\"address\",\"name\":\"minter\",\"type\":\"address\"},{\"indexed\":false,\"internalType\":\"uint256\",\"name\":\"mintAmount\",\"type\":\"uint256\"},{\"indexed\":false,\"internalType\":\"uint256\",\"name\":\"mintTokens\",\"type\":\"uint256\"}],\"name\":\"Mint\",\"type\":\"event\"},{\"anonymous\":false,\"inputs\":[{\"indexed\":false,\"internalType\":\"address\",\"name\":\"oldAdmin\",\"type\":\"address\"},{\"indexed\":false,\"internalType\":\"address\",\"name\":\"newAdmin\",\"type\":\"address\"}],\"name\":\"NewAdmin\",\"type\":\"event\"},{\"anonymous\":false,\"inputs\":[{\"indexed\":false,\"internalType\":\"contract ComptrollerInterface\",\"name\":\"oldComptroller\",\"type\":\"address\"},{\"indexed\":false,\"internalType\":\"contract ComptrollerInterface\",\"name\":\"newComptroller\",\"type\":\"address\"}],\"name\":\"NewComptroller\",\"type\":\"event\"},{\"anonymous\":false,\"inputs\":[{\"indexed\":false,\"internalType\":\"contract InterestRateModel\",\"name\":\"oldInterestRateModel\",\"type\":\"address\"},{\"indexed\":false,\"internalType\":\"contract InterestRateModel\",\"name\":\"newInterestRateModel\",\"type\":\"address\"}],\"name\":\"NewMarketInterestRateModel\",\"type\":\"event\"},{\"anonymous\":false,\"inputs\":[{\"indexed\":false,\"internalType\":\"address\",\"name\":\"oldPendingAdmin\",\"type\":\"address\"},{\"indexed\":false,\"internalType\":\"address\",\"name\":\"newPendingAdmin\",\"type\":\"address\"}],\"name\":\"NewPendingAdmin\",\"type\":\"event\"},{\"anonymous\":false,\"inputs\":[{\"indexed\":false,\"internalType\":\"uint256\",\"name\":\"oldReserveFactorMantissa\",\"type\":\"uint256\"},{\"indexed\":false,\"internalType\":\"uint256\",\"name\":\"newReserveFactorMantissa\",\"type\":\"uint256\"}],\"name\":\"NewReserveFactor\",\"type\":\"event\"},{\"anonymous\":false,\"inputs\":[{\"indexed\":false,\"internalType\":\"address\",\"name\":\"oldReserveGuardian\",\"type\":\"address\"},{\"indexed\":false,\"internalType\":\"address\",\"name\":\"newReserveGuardian\",\"type\":\"address\"}],\"name\":\"NewReserveGuardian\",\"type\":\"event\"},{\"anonymous\":false,\"inputs\":[{\"indexed\":false,\"internalType\":\"address\",\"name\":\"redeemer\",\"type\":\"address\"},{\"indexed\":false,\"internalType\":\"uint256\",\"name\":\"redeemAmount\",\"type\":\"uint256\"},{\"indexed\":false,\"internalType\":\"uint256\",\"name\":\"redeemTokens\",\"type\":\"uint256\"}],\"name\":\"Redeem\",\"type\":\"event\"},{\"anonymous\":false,\"inputs\":[{\"indexed\":false,\"internalType\":\"address\",\"name\":\"payer\",\"type\":\"address\"},{\"indexed\":false,\"internalType\":\"address\",\"name\":\"borrower\",\"type\":\"address\"},{\"indexed\":false,\"internalType\":\"uint256\",\"name\":\"repayAmount\",\"type\":\"uint256\"},{\"indexed\":false,\"internalType\":\"uint256\",\"name\":\"accountBorrows\",\"type\":\"uint256\"},{\"indexed\":false,\"internalType\":\"uint256\",\"name\":\"totalBorrows\",\"type\":\"uint256\"}],\"name\":\"RepayBorrow\",\"type\":\"event\"},{\"anonymous\":false,\"inputs\":[{\"indexed\":false,\"internalType\":\"address\",\"name\":\"benefactor\",\"type\":\"address\"},{\"indexed\":false,\"internalType\":\"uint256\",\"name\":\"addAmount\",\"type\":\"uint256\"},{\"indexed\":false,\"internalType\":\"uint256\",\"name\":\"newTotalReserves\",\"type\":\"uint256\"}],\"name\":\"ReservesAdded\",\"type\":\"event\"},{\"anonymous\":false,\"inputs\":[{\"indexed\":false,\"internalType\":\"address\",\"name\":\"admin\",\"type\":\"address\"},{\"indexed\":false,\"internalType\":\"uint256\",\"name\":\"reduceAmount\",\"type\":\"uint256\"},{\"indexed\":false,\"internalType\":\"uint256\",\"name\":\"newTotalReserves\",\"type\":\"uint256\"}],\"name\":\"ReservesReduced\",\"type\":\"event\"},{\"anonymous\":false,\"inputs\":[{\"indexed\":true,\"internalType\":\"address\",\"name\":\"from\",\"type\":\"address\"},{\"indexed\":true,\"internalType\":\"address\",\"name\":\"to\",\"type\":\"address\"},{\"indexed\":false,\"internalType\":\"uint256\",\"name\":\"amount\",\"type\":\"uint256\"}],\"name\":\"Transfer\",\"type\":\"event\"},{\"inputs\":[],\"name\":\"NO_ERROR\",\"outputs\":[{\"internalType\":\"uint256\",\"name\":\"\",\"type\":\"uint256\"}],\"stateMutability\":\"view\",\"type\":\"function\"},{\"inputs\":[],\"name\":\"_acceptAdmin\",\"outputs\":[{\"internalType\":\"uint256\",\"name\":\"\",\"type\":\"uint256\"}],\"stateMutability\":\"nonpayable\",\"type\":\"function\"},{\"inputs\":[{\"internalType\":\"uint256\",\"name\":\"addAmount\",\"type\":\"uint256\"}],\"name\":\"_addReserves\",\"outputs\":[{\"internalType\":\"uint256\",\"name\":\"\",\"type\":\"uint256\"}],\"stateMutability\":\"nonpayable\",\"type\":\"function\"},{\"inputs\":[{\"internalType\":\"address\",\"name\":\"compLikeDelegatee\",\"type\":\"address\"}],\"name\":\"_delegateCompLikeTo\",\"outputs\":[],\"stateMutability\":\"nonpayable\",\"type\":\"function\"},{\"inputs\":[{\"internalType\":\"uint256\",\"name\":\"reduceAmount\",\"type\":\"uint256\"}],\"name\":\"_reduceReserves\",\"outputs\":[{\"internalType\":\"uint256\",\"name\":\"\",\"type\":\"uint256\"}],\"stateMutability\":\"nonpayable\",\"type\":\"function\"},{\"inputs\":[{\"internalType\":\"contract ComptrollerInterface\",\"name\":\"newComptroller\",\"type\":\"address\"}],\"name\":\"_setComptroller\",\"outputs\":[{\"internalType\":\"uint256\",\"name\":\"\",\"type\":\"uint256\"}],\"stateMutability\":\"nonpayable\",\"type\":\"function\"},{\"inputs\":[{\"internalType\":\"contract InterestRateModel\",\"name\":\"newInterestRateModel\",\"type\":\"address\"}],\"name\":\"_setInterestRateModel\",\"outputs\":[{\"internalType\":\"uint256\",\"name\":\"\",\"type\":\"uint256\"}],\"stateMutability\":\"nonpayable\",\"type\":\"function\"},{\"inputs\":[{\"internalType\":\"address payable\",\"name\":\"newPendingAdmin\",\"type\":\"address\"}],\"name\":\"_setPendingAdmin\",\"outputs\":[{\"internalType\":\"uint256\",\"name\":\"\",\"type\":\"uint256\"}],\"stateMutability\":\"nonpayable\",\"type\":\"function\"},{\"inputs\":[{\"internalType\":\"uint256\",\"name\":\"newReserveFactorMantissa\",\"type\":\"uint256\"}],\"name\":\"_setReserveFactor\",\"outputs\":[{\"internalType\":\"uint256\",\"name\":\"\",\"type\":\"uint256\"}],\"stateMutability\":\"nonpayable\",\"type\":\"function\"},{\"inputs\":[{\"internalType\":\"address payable\",\"name\":\"newReserveGuardian\",\"type\":\"address\"}],\"name\":\"_setReserveGuardian\",\"outputs\":[{\"internalType\":\"uint256\",\"name\":\"\",\"type\":\"uint256\"}],\"stateMutability\":\"nonpayable\",\"type\":\"function\"},{\"inputs\":[],\"name\":\"accrualBlockNumber\",\"outputs\":[{\"internalType\":\"uint256\",\"name\":\"\",\"type\":\"uint256\"}],\"stateMutability\":\"view\",\"type\":\"function\"},{\"inputs\":[],\"name\":\"accrueInterest\",\"outputs\":[{\"internalType\":\"uint256\",\"name\":\"\",\"type\":\"uint256\"}],\"stateMutability\":\"nonpayable\",\"type\":\"function\"},{\"inputs\":[],\"name\":\"admin\",\"outputs\":[{\"internalType\":\"address payable\",\"name\":\"\",\"type\":\"address\"}],\"stateMutability\":\"view\",\"type\":\"function\"},{\"inputs\":[{\"internalType\":\"address\",\"name\":\"owner\",\"type\":\"address\"},{\"internalType\":\"address\",\"name\":\"spender\",\"type\":\"address\"}],\"name\":\"allowance\",\"outputs\":[{\"internalType\":\"uint256\",\"name\":\"\",\"type\":\"uint256\"}],\"stateMutability\":\"view\",\"type\":\"function\"},{\"inputs\":[{\"internalType\":\"address\",\"name\":\"spender\",\"type\":\"address\"},{\"internalType\":\"uint256\",\"name\":\"amount\",\"type\":\"uint256\"}],\"name\":\"approve\",\"outputs\":[{\"internalType\":\"bool\",\"name\":\"\",\"type\":\"bool\"}],\"stateMutability\":\"nonpayable\",\"type\":\"function\"},{\"inputs\":[{\"internalType\":\"address\",\"name\":\"owner\",\"type\":\"address\"}],\"name\":\"balanceOf\",\"outputs\":[{\"internalType\":\"uint256\",\"name\":\"\",\"type\":\"uint256\"}],\"stateMutability\":\"view\",\"type\":\"function\"},{\"inputs\":[{\"internalType\":\"address\",\"name\":\"owner\",\"type\":\"address\"}],\"name\":\"balanceOfUnderlying\",\"outputs\":[{\"internalType\":\"uint256\",\"name\":\"\",\"type\":\"uint256\"}],\"stateMutability\":\"nonpayable\",\"type\":\"function\"},{\"inputs\":[{\"internalType\":\"uint256\",\"name\":\"borrowAmount\",\"type\":\"uint256\"}],\"name\":\"borrow\",\"outputs\":[{\"internalType\":\"uint256\",\"name\":\"\",\"type\":\"uint256\"}],\"stateMutability\":\"nonpayable\",\"type\":\"function\"},{\"inputs\":[{\"internalType\":\"address\",\"name\":\"account\",\"type\":\"address\"}],\"name\":\"borrowBalanceCurrent\",\"outputs\":[{\"internalType\":\"uint256\",\"name\":\"\",\"type\":\"uint256\"}],\"stateMutability\":\"nonpayable\",\"type\":\"function\"},{\"inputs\":[{\"internalType\":\"address\",\"name\":\"account\",\"type\":\"address\"}],\"name\":\"borrowBalanceStored\",\"outputs\":[{\"internalType\":\"uint256\",\"name\":\"\",\"type\":\"uint256\"}],\"stateMutability\":\"view\",\"type\":\"function\"},{\"inputs\":[],\"name\":\"borrowIndex\",\"outputs\":[{\"internalType\":\"uint256\",\"name\":\"\",\"type\":\"uint256\"}],\"stateMutability\":\"view\",\"type\":\"function\"},{\"inputs\":[],\"name\":\"borrowRatePerBlock\",\"outputs\":[{\"internalType\":\"uint256\",\"name\":\"\",\"type\":\"uint256\"}],\"stateMutability\":\"view\",\"type\":\"function\"},{\"inputs\":[],\"name\":\"comptroller\",\"outputs\":[{\"internalType\":\"contract ComptrollerInterface\",\"name\":\"\",\"type\":\"address\"}],\"stateMutability\":\"view\",\"type\":\"function\"},{\"inputs\":[],\"name\":\"decimals\",\"outputs\":[{\"internalType\":\"uint8\",\"name\":\"\",\"type\":\"uint8\"}],\"stateMutability\":\"view\",\"type\":\"function\"},{\"inputs\":[],\"name\":\"exchangeRateCurrent\",\"outputs\":[{\"internalType\":\"uint256\",\"name\":\"\",\"type\":\"uint256\"}],\"stateMutability\":\"nonpayable\",\"type\":\"function\"},{\"inputs\":[],\"name\":\"exchangeRateStored\",\"outputs\":[{\"internalType\":\"uint256\",\"name\":\"\",\"type\":\"uint256\"}],\"stateMutability\":\"view\",\"type\":\"function\"},{\"inputs\":[{\"internalType\":\"address\",\"name\":\"account\",\"type\":\"address\"}],\"name\":\"getAccountSnapshot\",\"outputs\":[{\"internalType\":\"uint256\",\"name\":\"\",\"type\":\"uint256\"},{\"internalType\":\"uint256\",\"name\":\"\",\"type\":\"uint256\"},{\"internalType\":\"uint256\",\"name\":\"\",\"type\":\"uint256\"},{\"internalType\":\"uint256\",\"name\":\"\",\"type\":\"uint256\"}],\"stateMutability\":\"view\",\"type\":\"function\"},{\"inputs\":[],\"name\":\"getCash\",\"outputs\":[{\"internalType\":\"uint256\",\"name\":\"\",\"type\":\"uint256\"}],\"stateMutability\":\"view\",\"type\":\"function\"},{\"inputs\":[{\"internalType\":\"address\",\"name\":\"underlying_\",\"type\":\"address\"},{\"internalType\":\"contract ComptrollerInterface\",\"name\":\"comptroller_\",\"type\":\"address\"},{\"internalType\":\"contract InterestRateModel\",\"name\":\"interestRateModel_\",\"type\":\"address\"},{\"internalType\":\"uint256\",\"name\":\"initialExchangeRateMantissa_\",\"type\":\"uint256\"},{\"internalType\":\"string\",\"name\":\"name_\",\"type\":\"string\"},{\"internalType\":\"string\",\"name\":\"symbol_\",\"type\":\"string\"},{\"internalType\":\"uint8\",\"name\":\"decimals_\",\"type\":\"uint8\"}],\"name\":\"initialize\",\"outputs\":[],\"stateMutability\":\"nonpayable\",\"type\":\"function\"},{\"inputs\":[{\"internalType\":\"contract ComptrollerInterface\",\"name\":\"comptroller_\",\"type\":\"address\"},{\"internalType\":\"contract InterestRateModel\",\"name\":\"interestRateModel_\",\"type\":\"address\"},{\"internalType\":\"uint256\",\"name\":\"initialExchangeRateMantissa_\",\"type\":\"uint256\"},{\"internalType\":\"string\",\"name\":\"name_\",\"type\":\"string\"},{\"internalType\":\"string\",\"name\":\"symbol_\",\"type\":\"string\"},{\"internalType\":\"uint8\",\"name\":\"decimals_\",\"type\":\"uint8\"}],\"name\":\"initialize\",\"outputs\":[],\"stateMutability\":\"nonpayable\",\"type\":\"function\"},{\"inputs\":[],\"name\":\"interestRateModel\",\"outputs\":[{\"internalType\":\"contract InterestRateModel\",\"name\":\"\",\"type\":\"address\"}],\"stateMutability\":\"view\",\"type\":\"function\"},{\"inputs\":[],\"name\":\"isCToken\",\"outputs\":[{\"internalType\":\"bool\",\"name\":\"\",\"type\":\"bool\"}],\"stateMutability\":\"view\",\"type\":\"function\"},{\"inputs\":[{\"internalType\":\"address\",\"name\":\"borrower\",\"type\":\"address\"},{\"internalType\":\"uint256\",\"name\":\"repayAmount\",\"type\":\"uint256\"},{\"internalType\":\"contract CTokenInterface\",\"name\":\"cTokenCollateral\",\"type\":\"address\"}],\"name\":\"liquidateBorrow\",\"outputs\":[{\"internalType\":\"uint256\",\"name\":\"\",\"type\":\"uint256\"}],\"stateMutability\":\"nonpayable\",\"type\":\"function\"},{\"inputs\":[{\"internalType\":\"uint256\",\"name\":\"mintAmount\",\"type\":\"uint256\"}],\"name\":\"mint\",\"outputs\":[{\"internalType\":\"uint256\",\"name\":\"\",\"type\":\"uint256\"}],\"stateMutability\":\"nonpayable\",\"type\":\"function\"},{\"inputs\":[],\"name\":\"name\",\"outputs\":[{\"internalType\":\"string\",\"name\":\"\",\"type\":\"string\"}],\"stateMutability\":\"view\",\"type\":\"function\"},{\"inputs\":[],\"name\":\"pendingAdmin\",\"outputs\":[{\"internalType\":\"address payable\",\"name\":\"\",\"type\":\"address\"}],\"stateMutability\":\"view\",\"type\":\"function\"},{\"inputs\":[],\"name\":\"protocolSeizeShareMantissa\",\"outputs\":[{\"internalType\":\"uint256\",\"name\":\"\",\"type\":\"uint256\"}],\"stateMutability\":\"view\",\"type\":\"function\"},{\"inputs\":[{\"internalType\":\"address\",\"name\":\"underlying_\",\"type\":\"address\"},{\"internalType\":\"contract ComptrollerInterface\",\"name\":\"comptroller_\",\"type\":\"address\"},{\"internalType\":\"contract InterestRateModel\",\"name\":\"interestRateModel_\",\"type\":\"address\"},{\"internalType\":\"uint256\",\"name\":\"initialExchangeRateMantissa_\",\"type\":\"uint256\"},{\"internalType\":\"string\",\"name\":\"name_\",\"type\":\"string\"},{\"internalType\":\"string\",\"name\":\"symbol_\",\"type\":\"string\"},{\"internalType\":\"uint8\",\"name\":\"decimals_\",\"type\":\"uint8\"},{\"internalType\":\"address payable\",\"name\":\"admin_\",\"type\":\"address\"}],\"name\":\"proxyInitialize\",\"outputs\":[],\"stateMutability\":\"nonpayable\",\"type\":\"function\"},{\"inputs\":[{\"internalType\":\"uint256\",\"name\":\"redeemTokens\",\"type\":\"uint256\"}],\"name\":\"redeem\",\"outputs\":[{\"internalType\":\"uint256\",\"name\":\"\",\"type\":\"uint256\"}],\"stateMutability\":\"nonpayable\",\"type\":\"function\"},{\"inputs\":[{\"internalType\":\"uint256\",\"name\":\"redeemAmount\",\"type\":\"uint256\"}],\"name\":\"redeemUnderlying\",\"outputs\":[{\"internalType\":\"uint256\",\"name\":\"\",\"type\":\"uint256\"}],\"stateMutability\":\"nonpayable\",\"type\":\"function\"},{\"inputs\":[{\"internalType\":\"uint256\",\"name\":\"repayAmount\",\"type\":\"uint256\"}],\"name\":\"repayBorrow\",\"outputs\":[{\"internalType\":\"uint256\",\"name\":\"\",\"type\":\"uint256\"}],\"stateMutability\":\"nonpayable\",\"type\":\"function\"},{\"inputs\":[{\"internalType\":\"address\",\"name\":\"borrower\",\"type\":\"address\"},{\"internalType\":\"uint256\",\"name\":\"repayAmount\",\"type\":\"uint256\"}],\"name\":\"repayBorrowBehalf\",\"outputs\":[{\"internalType\":\"uint256\",\"name\":\"\",\"type\":\"uint256\"}],\"stateMutability\":\"nonpayable\",\"type\":\"function\"},{\"inputs\":[],\"name\":\"reserveFactorMantissa\",\"outputs\":[{\"internalType\":\"uint256\",\"name\":\"\",\"type\":\"uint256\"}],\"stateMutability\":\"view\",\"type\":\"function\"},{\"inputs\":[],\"name\":\"reserveGuardian\",\"outputs\":[{\"internalType\":\"address payable\",\"name\":\"\",\"type\":\"address\"}],\"stateMutability\":\"view\",\"type\":\"function\"},{\"inputs\":[{\"internalType\":\"address\",\"name\":\"liquidator\",\"type\":\"address\"},{\"internalType\":\"address\",\"name\":\"borrower\",\"type\":\"address\"},{\"internalType\":\"uint256\",\"name\":\"seizeTokens\",\"type\":\"uint256\"}],\"name\":\"seize\",\"outputs\":[{\"internalType\":\"uint256\",\"name\":\"\",\"type\":\"uint256\"}],\"stateMutability\":\"nonpayable\",\"type\":\"function\"},{\"inputs\":[],\"name\":\"supplyRatePerBlock\",\"outputs\":[{\"internalType\":\"uint256\",\"name\":\"\",\"type\":\"uint256\"}],\"stateMutability\":\"view\",\"type\":\"function\"},{\"inputs\":[{\"internalType\":\"contract EIP20NonStandardInterface\",\"name\":\"token\",\"type\":\"address\"}],\"name\":\"sweepToken\",\"outputs\":[],\"stateMutability\":\"nonpayable\",\"type\":\"function\"},{\"inputs\":[],\"name\":\"symbol\",\"outputs\":[{\"internalType\":\"string\",\"name\":\"\",\"type\":\"string\"}],\"stateMutability\":\"view\",\"type\":\"function\"},{\"inputs\":[],\"name\":\"totalBorrows\",\"outputs\":[{\"internalType\":\"uint256\",\"name\":\"\",\"type\":\"uint256\"}],\"stateMutability\":\"view\",\"type\":\"function\"},{\"inputs\":[],\"name\":\"totalBorrowsCurrent\",\"outputs\":[{\"internalType\":\"uint256\",\"name\":\"\",\"type\":\"uint256\"}],\"stateMutability\":\"nonpayable\",\"type\":\"function\"},{\"inputs\":[],\"name\":\"totalReserves\",\"outputs\":[{\"internalType\":\"uint256\",\"name\":\"\",\"type\":\"uint256\"}],\"stateMutability\":\"view\",\"type\":\"function\"},{\"inputs\":[],\"name\":\"totalSupply\",\"outputs\":[{\"internalType\":\"uint256\",\"name\":\"\",\"type\":\"uint256\"}],\"stateMutability\":\"view\",\"type\":\"function\"},{\"inputs\":[{\"internalType\":\"address\",\"name\":\"dst\",\"type\":\"address\"},{\"internalType\":\"uint256\",\"name\":\"amount\",\"type\":\"uint256\"}],\"name\":\"transfer\",\"outputs\":[{\"internalType\":\"bool\",\"name\":\"\",\"type\":\"bool\"}],\"stateMutability\":\"nonpayable\",\"type\":\"function\"},{\"inputs\":[{\"internalType\":\"address\",\"name\":\"src\",\"type\":\"address\"},{\"internalType\":\"address\",\"name\":\"dst\",\"type\":\"address\"},{\"internalType\":\"uint256\",\"name\":\"amount\",\"type\":\"uint256\"}],\"name\":\"transferFrom\",\"outputs\":[{\"internalType\":\"bool\",\"name\":\"\",\"type\":\"bool\"}],\"stateMutability\":\"nonpayable\",\"type\":\"function\"},{\"inputs\":[],\"name\":\"underlying\",\"outputs\":[{\"internalType\":\"address\",\"name\":\"\",\"type\":\"address\"}],\"stateMutability\":\"view\",\"type\":\"function\"}],\"devdoc\":{\"author\":\"Compound\",\"kind\":\"dev\",\"methods\":{\"_acceptAdmin()\":{\"details\":\"Admin function for pending admin to accept role and update admin\",\"returns\":{\"_0\":\"uint 0=success, otherwise a failure (see ErrorReporter.sol for details)\"}},\"_addReserves(uint256)\":{\"params\":{\"addAmount\":\"The amount fo underlying token to add as reserves\"},\"returns\":{\"_0\":\"uint 0=success, otherwise a failure (see ErrorReporter.sol for details)\"}},\"_delegateCompLikeTo(address)\":{\"details\":\"CTokens whose underlying are not CompLike should revert here\",\"params\":{\"compLikeDelegatee\":\"The address to delegate votes to\"}},\"_reduceReserves(uint256)\":{\"params\":{\"reduceAmount\":\"Amount of reduction to reserves\"},\"returns\":{\"_0\":\"uint 0=success, otherwise a failure (see ErrorReporter.sol for details)\"}},\"_setComptroller(address)\":{\"details\":\"Admin function to set a new comptroller\",\"returns\":{\"_0\":\"uint 0=success, otherwise a failure (see ErrorReporter.sol for details)\"}},\"_setInterestRateModel(address)\":{\"details\":\"Admin function to accrue interest and update the interest rate model\",\"params\":{\"newInterestRateModel\":\"the new interest rate model to use\"},\"returns\":{\"_0\":\"uint 0=success, otherwise a failure (see ErrorReporter.sol for details)\"}},\"_setPendingAdmin(address)\":{\"details\":\"Admin function to begin change of admin. The newPendingAdmin must call `_acceptAdmin` to finalize the transfer.\",\"params\":{\"newPendingAdmin\":\"New pending admin.\"},\"returns\":{\"_0\":\"uint 0=success, otherwise a failure (see ErrorReporter.sol for details)\"}},\"_setReserveFactor(uint256)\":{\"details\":\"Admin function to accrue interest and set a new reserve factor\",\"returns\":{\"_0\":\"uint 0=success, otherwise a failure (see ErrorReporter.sol for details)\"}},\"_setReserveGuardian(address)\":{\"params\":{\"newReserveGuardian\":\"New reserve guardian address\"},\"returns\":{\"_0\":\"uint 0=success, otherwise a failure (see ErrorReporter.sol for details)\"}},\"accrueInterest()\":{\"details\":\"This calculates interest accrued from the last checkpointed block   up to the current block and writes new checkpoint to storage.\"},\"allowance(address,address)\":{\"params\":{\"owner\":\"The address of the account which owns the tokens to be spent\",\"spender\":\"The address of the account which may transfer tokens\"},\"returns\":{\"_0\":\"The number of tokens allowed to be spent (-1 means infinite)\"}},\"approve(address,uint256)\":{\"details\":\"This will overwrite the approval amount for `spender`  and is subject to issues noted [here](https://eips.ethereum.org/EIPS/eip-20#approve)\",\"params\":{\"amount\":\"The number of tokens that are approved (uint256.max means infinite)\",\"spender\":\"The address of the account which may transfer tokens\"},\"returns\":{\"_0\":\"Whether or not the approval succeeded\"}},\"balanceOf(address)\":{\"params\":{\"owner\":\"The address of the account to query\"},\"returns\":{\"_0\":\"The number of tokens owned by `owner`\"}},\"balanceOfUnderlying(address)\":{\"details\":\"This also accrues interest in a transaction\",\"params\":{\"owner\":\"The address of the account to query\"},\"returns\":{\"_0\":\"The amount of underlying owned by `owner`\"}},\"borrow(uint256)\":{\"params\":{\"borrowAmount\":\"The amount of the underlying asset to borrow\"},\"returns\":{\"_0\":\"uint 0=success, otherwise a failure (see ErrorReporter.sol for details)\"}},\"borrowBalanceCurrent(address)\":{\"params\":{\"account\":\"The address whose balance should be calculated after updating borrowIndex\"},\"returns\":{\"_0\":\"The calculated balance\"}},\"borrowBalanceStored(address)\":{\"params\":{\"account\":\"The address whose balance should be calculated\"},\"returns\":{\"_0\":\"The calculated balance\"}},\"borrowRatePerBlock()\":{\"returns\":{\"_0\":\"The borrow interest rate per block, scaled by 1e18\"}},\"exchangeRateCurrent()\":{\"returns\":{\"_0\":\"Calculated exchange rate scaled by 1e18\"}},\"exchangeRateStored()\":{\"details\":\"This function does not accrue interest before calculating the exchange rate\",\"returns\":{\"_0\":\"Calculated exchange rate scaled by 1e18\"}},\"getAccountSnapshot(address)\":{\"details\":\"This is used by comptroller to more efficiently perform liquidity checks.\",\"params\":{\"account\":\"Address of the account to snapshot\"},\"returns\":{\"_0\":\"(possible error, token balance, borrow balance, exchange rate mantissa)\"}},\"getCash()\":{\"returns\":{\"_0\":\"The quantity of underlying asset owned by this contract\"}},\"initialize(address,address,address,uint256,string,string,uint8)\":{\"params\":{\"comptroller_\":\"The address of the Comptroller\",\"decimals_\":\"ERC-20 decimal precision of this token\",\"initialExchangeRateMantissa_\":\"The initial exchange rate, scaled by 1e18\",\"interestRateModel_\":\"The address of the interest rate model\",\"name_\":\"ERC-20 name of this token\",\"symbol_\":\"ERC-20 symbol of this token\",\"underlying_\":\"The address of the underlying asset\"}},\"initialize(address,address,uint256,string,string,uint8)\":{\"params\":{\"comptroller_\":\"The address of the Comptroller\",\"decimals_\":\"EIP-20 decimal precision of this token\",\"initialExchangeRateMantissa_\":\"The initial exchange rate, scaled by 1e18\",\"interestRateModel_\":\"The address of the interest rate model\",\"name_\":\"EIP-20 name of this token\",\"symbol_\":\"EIP-20 symbol of this token\"}},\"liquidateBorrow(address,uint256,address)\":{\"params\":{\"borrower\":\"The borrower of this cToken to be liquidated\",\"cTokenCollateral\":\"The market in which to seize collateral from the borrower\",\"repayAmount\":\"The amount of the underlying borrowed asset to repay\"},\"returns\":{\"_0\":\"uint 0=success, otherwise a failure (see ErrorReporter.sol for details)\"}},\"mint(uint256)\":{\"details\":\"Accrues interest whether or not the operation succeeds, unless reverted\",\"params\":{\"mintAmount\":\"The amount of the underlying asset to supply\"},\"returns\":{\"_0\":\"uint 0=success, otherwise a failure (see ErrorReporter.sol for details)\"}},\"proxyInitialize(address,address,address,uint256,string,string,uint8,address)\":{\"params\":{\"comptroller_\":\"The address of the Comptroller\",\"decimals_\":\"ERC-20 decimal precision of this token\",\"initialExchangeRateMantissa_\":\"The initial exchange rate, scaled by 1e18\",\"interestRateModel_\":\"The address of the interest rate model\",\"name_\":\"ERC-20 name of this token\",\"symbol_\":\"ERC-20 symbol of this token\",\"underlying_\":\"The address of the underlying asset\"}},\"redeem(uint256)\":{\"details\":\"Accrues interest whether or not the operation succeeds, unless reverted\",\"params\":{\"redeemTokens\":\"The number of cTokens to redeem into underlying\"},\"returns\":{\"_0\":\"uint 0=success, otherwise a failure (see ErrorReporter.sol for details)\"}},\"redeemUnderlying(uint256)\":{\"details\":\"Accrues interest whether or not the operation succeeds, unless reverted\",\"params\":{\"redeemAmount\":\"The amount of underlying to redeem\"},\"returns\":{\"_0\":\"uint 0=success, otherwise a failure (see ErrorReporter.sol for details)\"}},\"repayBorrow(uint256)\":{\"params\":{\"repayAmount\":\"The amount to repay, or -1 for the full outstanding amount\"},\"returns\":{\"_0\":\"uint 0=success, otherwise a failure (see ErrorReporter.sol for details)\"}},\"repayBorrowBehalf(address,uint256)\":{\"params\":{\"borrower\":\"the account with the debt being payed off\",\"repayAmount\":\"The amount to repay, or -1 for the full outstanding amount\"},\"returns\":{\"_0\":\"uint 0=success, otherwise a failure (see ErrorReporter.sol for details)\"}},\"seize(address,address,uint256)\":{\"details\":\"Will fail unless called by another cToken during the process of liquidation.  Its absolutely critical to use msg.sender as the borrowed cToken and not a parameter.\",\"params\":{\"borrower\":\"The account having collateral seized\",\"liquidator\":\"The account receiving seized collateral\",\"seizeTokens\":\"The number of cTokens to seize\"},\"returns\":{\"_0\":\"uint 0=success, otherwise a failure (see ErrorReporter.sol for details)\"}},\"supplyRatePerBlock()\":{\"returns\":{\"_0\":\"The supply interest rate per block, scaled by 1e18\"}},\"sweepToken(address)\":{\"params\":{\"token\":\"The address of the ERC-20 token to sweep\"}},\"totalBorrowsCurrent()\":{\"returns\":{\"_0\":\"The total borrows with interest\"}},\"transfer(address,uint256)\":{\"params\":{\"amount\":\"The number of tokens to transfer\",\"dst\":\"The address of the destination account\"},\"returns\":{\"_0\":\"Whether or not the transfer succeeded\"}},\"transferFrom(address,address,uint256)\":{\"params\":{\"amount\":\"The number of tokens to transfer\",\"dst\":\"The address of the destination account\",\"src\":\"The address of the source account\"},\"returns\":{\"_0\":\"Whether or not the transfer succeeded\"}}},\"title\":\"Compound's CErc20Immutable Contract\",\"version\":1},\"userdoc\":{\"events\":{\"AccrueInterest(uint256,uint256,uint256,uint256)\":{\"notice\":\"Event emitted when interest is accrued\"},\"Approval(address,address,uint256)\":{\"notice\":\"EIP20 Approval event\"},\"Borrow(address,uint256,uint256,uint256)\":{\"notice\":\"Event emitted when underlying is borrowed\"},\"LiquidateBorrow(address,address,uint256,address,uint256)\":{\"notice\":\"Event emitted when a borrow is liquidated\"},\"Mint(address,uint256,uint256)\":{\"notice\":\"Event emitted when tokens are minted\"},\"NewAdmin(address,address)\":{\"notice\":\"Event emitted when pendingAdmin is accepted, which means admin is updated\"},\"NewComptroller(address,address)\":{\"notice\":\"Event emitted when comptroller is changed\"},\"NewMarketInterestRateModel(address,address)\":{\"notice\":\"Event emitted when interestRateModel is changed\"},\"NewPendingAdmin(address,address)\":{\"notice\":\"Event emitted when pendingAdmin is changed\"},\"NewReserveFactor(uint256,uint256)\":{\"notice\":\"Event emitted when the reserve factor is changed\"},\"NewReserveGuardian(address,address)\":{\"notice\":\"Event emitted when reserve guardian is changed\"},\"Redeem(address,uint256,uint256)\":{\"notice\":\"Event emitted when tokens are redeemed\"},\"RepayBorrow(address,address,uint256,uint256,uint256)\":{\"notice\":\"Event emitted when a borrow is repaid\"},\"ReservesAdded(address,uint256,uint256)\":{\"notice\":\"Event emitted when the reserves are added\"},\"ReservesReduced(address,uint256,uint256)\":{\"notice\":\"Event emitted when the reserves are reduced\"},\"Transfer(address,address,uint256)\":{\"notice\":\"EIP20 Transfer event\"}},\"kind\":\"user\",\"methods\":{\"_acceptAdmin()\":{\"notice\":\"Accepts transfer of admin rights. msg.sender must be pendingAdmin\"},\"_addReserves(uint256)\":{\"notice\":\"The sender adds to reserves.\"},\"_delegateCompLikeTo(address)\":{\"notice\":\"Admin call to delegate the votes of the COMP-like underlying\"},\"_reduceReserves(uint256)\":{\"notice\":\"Accrues interest and reduces reserves by transferring to admin\"},\"_setComptroller(address)\":{\"notice\":\"Sets a new comptroller for the market\"},\"_setInterestRateModel(address)\":{\"notice\":\"accrues interest and updates the interest rate model using _setInterestRateModelFresh\"},\"_setPendingAdmin(address)\":{\"notice\":\"Begins transfer of admin rights. The newPendingAdmin must call `_acceptAdmin` to finalize the transfer.\"},\"_setReserveFactor(uint256)\":{\"notice\":\"accrues interest and sets a new reserve factor for the protocol using _setReserveFactorFresh\"},\"_setReserveGuardian(address)\":{\"notice\":\"Admin function to set new reserve guardian\"},\"accrualBlockNumber()\":{\"notice\":\"Block number that interest was last accrued at\"},\"accrueInterest()\":{\"notice\":\"Applies accrued interest to total borrows and reserves\"},\"admin()\":{\"notice\":\"Administrator for this contract\"},\"allowance(address,address)\":{\"notice\":\"Get the current allowance from `owner` for `spender`\"},\"approve(address,uint256)\":{\"notice\":\"Approve `spender` to transfer up to `amount` from `src`\"},\"balanceOf(address)\":{\"notice\":\"Get the token balance of the `owner`\"},\"balanceOfUnderlying(address)\":{\"notice\":\"Get the underlying balance of the `owner`\"},\"borrow(uint256)\":{\"notice\":\"Sender borrows assets from the protocol to their own address\"},\"borrowBalanceCurrent(address)\":{\"notice\":\"Accrue interest to updated borrowIndex and then calculate account's borrow balance using the updated borrowIndex\"},\"borrowBalanceStored(address)\":{\"notice\":\"Return the borrow balance of account based on stored data\"},\"borrowIndex()\":{\"notice\":\"Accumulator of the total earned interest rate since the opening of the market\"},\"borrowRatePerBlock()\":{\"notice\":\"Returns the current per-block borrow interest rate for this cToken\"},\"comptroller()\":{\"notice\":\"Contract which oversees inter-cToken operations\"},\"decimals()\":{\"notice\":\"EIP-20 token decimals for this token\"},\"exchangeRateCurrent()\":{\"notice\":\"Accrue interest then return the up-to-date exchange rate\"},\"exchangeRateStored()\":{\"notice\":\"Calculates the exchange rate from the underlying to the CToken\"},\"getAccountSnapshot(address)\":{\"notice\":\"Get a snapshot of the account's balances, and the cached exchange rate\"},\"getCash()\":{\"notice\":\"Get cash balance of this cToken in the underlying asset\"},\"initialize(address,address,address,uint256,string,string,uint8)\":{\"notice\":\"Initialize the new money market\"},\"initialize(address,address,uint256,string,string,uint8)\":{\"notice\":\"Initialize the money market\"},\"interestRateModel()\":{\"notice\":\"Model which tells what the current interest rate should be\"},\"isCToken()\":{\"notice\":\"Indicator that this is a CToken contract (for inspection)\"},\"liquidateBorrow(address,uint256,address)\":{\"notice\":\"The sender liquidates the borrowers collateral.  The collateral seized is transferred to the liquidator.\"},\"mint(uint256)\":{\"notice\":\"Sender supplies assets into the market and receives cTokens in exchange\"},\"name()\":{\"notice\":\"EIP-20 token name for this token\"},\"pendingAdmin()\":{\"notice\":\"Pending administrator for this contract\"},\"protocolSeizeShareMantissa()\":{\"notice\":\"Share of seized collateral that is added to reserves\"},\"proxyInitialize(address,address,address,uint256,string,string,uint8,address)\":{\"notice\":\"Initialize the new money market\"},\"redeem(uint256)\":{\"notice\":\"Sender redeems cTokens in exchange for the underlying asset\"},\"redeemUnderlying(uint256)\":{\"notice\":\"Sender redeems cTokens in exchange for a specified amount of underlying asset\"},\"repayBorrow(uint256)\":{\"notice\":\"Sender repays their own borrow\"},\"repayBorrowBehalf(address,uint256)\":{\"notice\":\"Sender repays a borrow belonging to borrower\"},\"reserveFactorMantissa()\":{\"notice\":\"Fraction of interest currently set aside for reserves\"},\"reserveGuardian()\":{\"notice\":\"The reserve guardian can reduce the reserves of the market\"},\"seize(address,address,uint256)\":{\"notice\":\"Transfers collateral tokens (this market) to the liquidator.\"},\"supplyRatePerBlock()\":{\"notice\":\"Returns the current per-block supply interest rate for this cToken\"},\"sweepToken(address)\":{\"notice\":\"A public function to sweep accidental ERC-20 transfers to this contract. Tokens are sent to admin (timelock)\"},\"symbol()\":{\"notice\":\"EIP-20 token symbol for this token\"},\"totalBorrows()\":{\"notice\":\"Total amount of outstanding borrows of the underlying in this market\"},\"totalBorrowsCurrent()\":{\"notice\":\"Returns the current total borrows plus accrued interest\"},\"totalReserves()\":{\"notice\":\"Total amount of reserves of the underlying held in this market\"},\"totalSupply()\":{\"notice\":\"Total number of tokens in circulation\"},\"transfer(address,uint256)\":{\"notice\":\"Transfer `amount` tokens from `msg.sender` to `dst`\"},\"transferFrom(address,address,uint256)\":{\"notice\":\"Transfer `amount` tokens from `src` to `dst`\"},\"underlying()\":{\"notice\":\"Underlying asset for this CToken\"}},\"notice\":\"CTokens which wrap an EIP-20 underlying and are immutable\",\"version\":1}},\"settings\":{\"compilationTarget\":{\"contracts/CErc20Upgradable.sol\":\"CErc20Upgradable\"},\"evmVersion\":\"london\",\"libraries\":{},\"metadata\":{\"bytecodeHash\":\"ipfs\",\"useLiteralContent\":true},\"optimizer\":{\"enabled\":true,\"runs\":200},\"remappings\":[]},\"sources\":{\"@openzeppelin/contracts-upgradeable/proxy/utils/Initializable.sol\":{\"content\":\"// SPDX-License-Identifier: MIT\\n// OpenZeppelin Contracts (last updated v4.8.1) (proxy/utils/Initializable.sol)\\n\\npragma solidity ^0.8.2;\\n\\nimport \\\"../../utils/AddressUpgradeable.sol\\\";\\n\\n/**\\n * @dev This is a base contract to aid in writing upgradeable contracts, or any kind of contract that will be deployed\\n * behind a proxy. Since proxied contracts do not make use of a constructor, it's common to move constructor logic to an\\n * external initializer function, usually called `initialize`. It then becomes necessary to protect this initializer\\n * function so it can only be called once. The {initializer} modifier provided by this contract will have this effect.\\n *\\n * The initialization functions use a version number. Once a version number is used, it is consumed and cannot be\\n * reused. This mechanism prevents re-execution of each \\\"step\\\" but allows the creation of new initialization steps in\\n * case an upgrade adds a module that needs to be initialized.\\n *\\n * For example:\\n *\\n * [.hljs-theme-light.nopadding]\\n * ```\\n * contract MyToken is ERC20Upgradeable {\\n *     function initialize() initializer public {\\n *         __ERC20_init(\\\"MyToken\\\", \\\"MTK\\\");\\n *     }\\n * }\\n * contract MyTokenV2 is MyToken, ERC20PermitUpgradeable {\\n *     function initializeV2() reinitializer(2) public {\\n *         __ERC20Permit_init(\\\"MyToken\\\");\\n *     }\\n * }\\n * ```\\n *\\n * TIP: To avoid leaving the proxy in an uninitialized state, the initializer function should be called as early as\\n * possible by providing the encoded function call as the `_data` argument to {ERC1967Proxy-constructor}.\\n *\\n * CAUTION: When used with inheritance, manual care must be taken to not invoke a parent initializer twice, or to ensure\\n * that all initializers are idempotent. This is not verified automatically as constructors are by Solidity.\\n *\\n * [CAUTION]\\n * ====\\n * Avoid leaving a contract uninitialized.\\n *\\n * An uninitialized contract can be taken over by an attacker. This applies to both a proxy and its implementation\\n * contract, which may impact the proxy. To prevent the implementation contract from being used, you should invoke\\n * the {_disableInitializers} function in the constructor to automatically lock it when it is deployed:\\n *\\n * [.hljs-theme-light.nopadding]\\n * ```\\n * /// @custom:oz-upgrades-unsafe-allow constructor\\n * constructor() {\\n *     _disableInitializers();\\n * }\\n * ```\\n * ====\\n */\\nabstract contract Initializable {\\n    /**\\n     * @dev Indicates that the contract has been initialized.\\n     * @custom:oz-retyped-from bool\\n     */\\n    uint8 private _initialized;\\n\\n    /**\\n     * @dev Indicates that the contract is in the process of being initialized.\\n     */\\n    bool private _initializing;\\n\\n    /**\\n     * @dev Triggered when the contract has been initialized or reinitialized.\\n     */\\n    event Initialized(uint8 version);\\n\\n    /**\\n     * @dev A modifier that defines a protected initializer function that can be invoked at most once. In its scope,\\n     * `onlyInitializing` functions can be used to initialize parent contracts.\\n     *\\n     * Similar to `reinitializer(1)`, except that functions marked with `initializer` can be nested in the context of a\\n     * constructor.\\n     *\\n     * Emits an {Initialized} event.\\n     */\\n    modifier initializer() {\\n        bool isTopLevelCall = !_initializing;\\n        require(\\n            (isTopLevelCall && _initialized < 1) || (!AddressUpgradeable.isContract(address(this)) && _initialized == 1),\\n            \\\"Initializable: contract is already initialized\\\"\\n        );\\n        _initialized = 1;\\n        if (isTopLevelCall) {\\n            _initializing = true;\\n        }\\n        _;\\n        if (isTopLevelCall) {\\n            _initializing = false;\\n            emit Initialized(1);\\n        }\\n    }\\n\\n    /**\\n     * @dev A modifier that defines a protected reinitializer function that can be invoked at most once, and only if the\\n     * contract hasn't been initialized to a greater version before. In its scope, `onlyInitializing` functions can be\\n     * used to initialize parent contracts.\\n     *\\n     * A reinitializer may be used after the original initialization step. This is essential to configure modules that\\n     * are added through upgrades and that require initialization.\\n     *\\n     * When `version` is 1, this modifier is similar to `initializer`, except that functions marked with `reinitializer`\\n     * cannot be nested. If one is invoked in the context of another, execution will revert.\\n     *\\n     * Note that versions can jump in increments greater than 1; this implies that if multiple reinitializers coexist in\\n     * a contract, executing them in the right order is up to the developer or operator.\\n     *\\n     * WARNING: setting the version to 255 will prevent any future reinitialization.\\n     *\\n     * Emits an {Initialized} event.\\n     */\\n    modifier reinitializer(uint8 version) {\\n        require(!_initializing && _initialized < version, \\\"Initializable: contract is already initialized\\\");\\n        _initialized = version;\\n        _initializing = true;\\n        _;\\n        _initializing = false;\\n        emit Initialized(version);\\n    }\\n\\n    /**\\n     * @dev Modifier to protect an initialization function so that it can only be invoked by functions with the\\n     * {initializer} and {reinitializer} modifiers, directly or indirectly.\\n     */\\n    modifier onlyInitializing() {\\n        require(_initializing, \\\"Initializable: contract is not initializing\\\");\\n        _;\\n    }\\n\\n    /**\\n     * @dev Locks the contract, preventing any future reinitialization. This cannot be part of an initializer call.\\n     * Calling this in the constructor of a contract will prevent that contract from being initialized or reinitialized\\n     * to any version. It is recommended to use this to lock implementation contracts that are designed to be called\\n     * through proxies.\\n     *\\n     * Emits an {Initialized} event the first time it is successfully executed.\\n     */\\n    function _disableInitializers() internal virtual {\\n        require(!_initializing, \\\"Initializable: contract is initializing\\\");\\n        if (_initialized < type(uint8).max) {\\n            _initialized = type(uint8).max;\\n            emit Initialized(type(uint8).max);\\n        }\\n    }\\n\\n    /**\\n     * @dev Returns the highest version that has been initialized. See {reinitializer}.\\n     */\\n    function _getInitializedVersion() internal view returns (uint8) {\\n        return _initialized;\\n    }\\n\\n    /**\\n     * @dev Returns `true` if the contract is currently initializing. See {onlyInitializing}.\\n     */\\n    function _isInitializing() internal view returns (bool) {\\n        return _initializing;\\n    }\\n}\\n\",\"keccak256\":\"0x037c334add4b033ad3493038c25be1682d78c00992e1acb0e2795caff3925271\",\"license\":\"MIT\"},\"@openzeppelin/contracts-upgradeable/utils/AddressUpgradeable.sol\":{\"content\":\"// SPDX-License-Identifier: MIT\\n// OpenZeppelin Contracts (last updated v4.8.0) (utils/Address.sol)\\n\\npragma solidity ^0.8.1;\\n\\n/**\\n * @dev Collection of functions related to the address type\\n */\\nlibrary AddressUpgradeable {\\n    /**\\n     * @dev Returns true if `account` is a contract.\\n     *\\n     * [IMPORTANT]\\n     * ====\\n     * It is unsafe to assume that an address for which this function returns\\n     * false is an externally-owned account (EOA) and not a contract.\\n     *\\n     * Among others, `isContract` will return false for the following\\n     * types of addresses:\\n     *\\n     *  - an externally-owned account\\n     *  - a contract in construction\\n     *  - an address where a contract will be created\\n     *  - an address where a contract lived, but was destroyed\\n     * ====\\n     *\\n     * [IMPORTANT]\\n     * ====\\n     * You shouldn't rely on `isContract` to protect against flash loan attacks!\\n     *\\n     * Preventing calls from contracts is highly discouraged. It breaks composability, breaks support for smart wallets\\n     * like Gnosis Safe, and does not provide security since it can be circumvented by calling from a contract\\n     * constructor.\\n     * ====\\n     */\\n    function isContract(address account) internal view returns (bool) {\\n        // This method relies on extcodesize/address.code.length, which returns 0\\n        // for contracts in construction, since the code is only stored at the end\\n        // of the constructor execution.\\n\\n        return account.code.length > 0;\\n    }\\n\\n    /**\\n     * @dev Replacement for Solidity's `transfer`: sends `amount` wei to\\n     * `recipient`, forwarding all available gas and reverting on errors.\\n     *\\n     * https://eips.ethereum.org/EIPS/eip-1884[EIP1884] increases the gas cost\\n     * of certain opcodes, possibly making contracts go over the 2300 gas limit\\n     * imposed by `transfer`, making them unable to receive funds via\\n     * `transfer`. {sendValue} removes this limitation.\\n     *\\n     * https://diligence.consensys.net/posts/2019/09/stop-using-soliditys-transfer-now/[Learn more].\\n     *\\n     * IMPORTANT: because control is transferred to `recipient`, care must be\\n     * taken to not create reentrancy vulnerabilities. Consider using\\n     * {ReentrancyGuard} or the\\n     * https://solidity.readthedocs.io/en/v0.5.11/security-considerations.html#use-the-checks-effects-interactions-pattern[checks-effects-interactions pattern].\\n     */\\n    function sendValue(address payable recipient, uint256 amount) internal {\\n        require(address(this).balance >= amount, \\\"Address: insufficient balance\\\");\\n\\n        (bool success, ) = recipient.call{value: amount}(\\\"\\\");\\n        require(success, \\\"Address: unable to send value, recipient may have reverted\\\");\\n    }\\n\\n    /**\\n     * @dev Performs a Solidity function call using a low level `call`. A\\n     * plain `call` is an unsafe replacement for a function call: use this\\n     * function instead.\\n     *\\n     * If `target` reverts with a revert reason, it is bubbled up by this\\n     * function (like regular Solidity function calls).\\n     *\\n     * Returns the raw returned data. To convert to the expected return value,\\n     * use https://solidity.readthedocs.io/en/latest/units-and-global-variables.html?highlight=abi.decode#abi-encoding-and-decoding-functions[`abi.decode`].\\n     *\\n     * Requirements:\\n     *\\n     * - `target` must be a contract.\\n     * - calling `target` with `data` must not revert.\\n     *\\n     * _Available since v3.1._\\n     */\\n    function functionCall(address target, bytes memory data) internal returns (bytes memory) {\\n        return functionCallWithValue(target, data, 0, \\\"Address: low-level call failed\\\");\\n    }\\n\\n    /**\\n     * @dev Same as {xref-Address-functionCall-address-bytes-}[`functionCall`], but with\\n     * `errorMessage` as a fallback revert reason when `target` reverts.\\n     *\\n     * _Available since v3.1._\\n     */\\n    function functionCall(\\n        address target,\\n        bytes memory data,\\n        string memory errorMessage\\n    ) internal returns (bytes memory) {\\n        return functionCallWithValue(target, data, 0, errorMessage);\\n    }\\n\\n    /**\\n     * @dev Same as {xref-Address-functionCall-address-bytes-}[`functionCall`],\\n     * but also transferring `value` wei to `target`.\\n     *\\n     * Requirements:\\n     *\\n     * - the calling contract must have an ETH balance of at least `value`.\\n     * - the called Solidity function must be `payable`.\\n     *\\n     * _Available since v3.1._\\n     */\\n    function functionCallWithValue(\\n        address target,\\n        bytes memory data,\\n        uint256 value\\n    ) internal returns (bytes memory) {\\n        return functionCallWithValue(target, data, value, \\\"Address: low-level call with value failed\\\");\\n    }\\n\\n    /**\\n     * @dev Same as {xref-Address-functionCallWithValue-address-bytes-uint256-}[`functionCallWithValue`], but\\n     * with `errorMessage` as a fallback revert reason when `target` reverts.\\n     *\\n     * _Available since v3.1._\\n     */\\n    function functionCallWithValue(\\n        address target,\\n        bytes memory data,\\n        uint256 value,\\n        string memory errorMessage\\n    ) internal returns (bytes memory) {\\n        require(address(this).balance >= value, \\\"Address: insufficient balance for call\\\");\\n        (bool success, bytes memory returndata) = target.call{value: value}(data);\\n        return verifyCallResultFromTarget(target, success, returndata, errorMessage);\\n    }\\n\\n    /**\\n     * @dev Same as {xref-Address-functionCall-address-bytes-}[`functionCall`],\\n     * but performing a static call.\\n     *\\n     * _Available since v3.3._\\n     */\\n    function functionStaticCall(address target, bytes memory data) internal view returns (bytes memory) {\\n        return functionStaticCall(target, data, \\\"Address: low-level static call failed\\\");\\n    }\\n\\n    /**\\n     * @dev Same as {xref-Address-functionCall-address-bytes-string-}[`functionCall`],\\n     * but performing a static call.\\n     *\\n     * _Available since v3.3._\\n     */\\n    function functionStaticCall(\\n        address target,\\n        bytes memory data,\\n        string memory errorMessage\\n    ) internal view returns (bytes memory) {\\n        (bool success, bytes memory returndata) = target.staticcall(data);\\n        return verifyCallResultFromTarget(target, success, returndata, errorMessage);\\n    }\\n\\n    /**\\n     * @dev Tool to verify that a low level call to smart-contract was successful, and revert (either by bubbling\\n     * the revert reason or using the provided one) in case of unsuccessful call or if target was not a contract.\\n     *\\n     * _Available since v4.8._\\n     */\\n    function verifyCallResultFromTarget(\\n        address target,\\n        bool success,\\n        bytes memory returndata,\\n        string memory errorMessage\\n    ) internal view returns (bytes memory) {\\n        if (success) {\\n            if (returndata.length == 0) {\\n                // only check isContract if the call was successful and the return data is empty\\n                // otherwise we already know that it was a contract\\n                require(isContract(target), \\\"Address: call to non-contract\\\");\\n            }\\n            return returndata;\\n        } else {\\n            _revert(returndata, errorMessage);\\n        }\\n    }\\n\\n    /**\\n     * @dev Tool to verify that a low level call was successful, and revert if it wasn't, either by bubbling the\\n     * revert reason or using the provided one.\\n     *\\n     * _Available since v4.3._\\n     */\\n    function verifyCallResult(\\n        bool success,\\n        bytes memory returndata,\\n        string memory errorMessage\\n    ) internal pure returns (bytes memory) {\\n        if (success) {\\n            return returndata;\\n        } else {\\n            _revert(returndata, errorMessage);\\n        }\\n    }\\n\\n    function _revert(bytes memory returndata, string memory errorMessage) private pure {\\n        // Look for revert reason and bubble it up if present\\n        if (returndata.length > 0) {\\n            // The easiest way to bubble the revert reason is using memory via assembly\\n            /// @solidity memory-safe-assembly\\n            assembly {\\n                let returndata_size := mload(returndata)\\n                revert(add(32, returndata), returndata_size)\\n            }\\n        } else {\\n            revert(errorMessage);\\n        }\\n    }\\n}\\n\",\"keccak256\":\"0x2edcb41c121abc510932e8d83ff8b82cf9cdde35e7c297622f5c29ef0af25183\",\"license\":\"MIT\"},\"contracts/CErc20.sol\":{\"content\":\"// SPDX-License-Identifier: BSD-3-Clause\\r\\npragma solidity ^0.8.10;\\r\\n\\r\\nimport \\\"./CToken.sol\\\";\\r\\n\\r\\ninterface CompLike {\\r\\n    function delegate(address delegatee) external;\\r\\n}\\r\\n\\r\\n/**\\r\\n * @title Compound's CErc20 Contract\\r\\n * @notice CTokens which wrap an EIP-20 underlying\\r\\n * @author Compound\\r\\n */\\r\\ncontract CErc20 is CToken, CErc20Interface {\\r\\n    /**\\r\\n     * @notice Initialize the new money market\\r\\n     * @param underlying_ The address of the underlying asset\\r\\n     * @param comptroller_ The address of the Comptroller\\r\\n     * @param interestRateModel_ The address of the interest rate model\\r\\n     * @param initialExchangeRateMantissa_ The initial exchange rate, scaled by 1e18\\r\\n     * @param name_ ERC-20 name of this token\\r\\n     * @param symbol_ ERC-20 symbol of this token\\r\\n     * @param decimals_ ERC-20 decimal precision of this token\\r\\n     */\\r\\n    function initialize(\\r\\n        address underlying_,\\r\\n        ComptrollerInterface comptroller_,\\r\\n        InterestRateModel interestRateModel_,\\r\\n        uint initialExchangeRateMantissa_,\\r\\n        string memory name_,\\r\\n        string memory symbol_,\\r\\n        uint8 decimals_\\r\\n    ) public {\\r\\n        // CToken initialize does the bulk of the work\\r\\n        super.initialize(\\r\\n            comptroller_,\\r\\n            interestRateModel_,\\r\\n            initialExchangeRateMantissa_,\\r\\n            name_,\\r\\n            symbol_,\\r\\n            decimals_\\r\\n        );\\r\\n\\r\\n        // Set underlying and sanity check it\\r\\n        underlying = underlying_;\\r\\n        EIP20Interface(underlying).totalSupply();\\r\\n    }\\r\\n\\r\\n    /*** User Interface ***/\\r\\n\\r\\n    /**\\r\\n     * @notice Sender supplies assets into the market and receives cTokens in exchange\\r\\n     * @dev Accrues interest whether or not the operation succeeds, unless reverted\\r\\n     * @param mintAmount The amount of the underlying asset to supply\\r\\n     * @return uint 0=success, otherwise a failure (see ErrorReporter.sol for details)\\r\\n     */\\r\\n    function mint(uint mintAmount) external override returns (uint) {\\r\\n        mintInternal(mintAmount);\\r\\n        return NO_ERROR;\\r\\n    }\\r\\n\\r\\n    /**\\r\\n     * @notice Sender redeems cTokens in exchange for the underlying asset\\r\\n     * @dev Accrues interest whether or not the operation succeeds, unless reverted\\r\\n     * @param redeemTokens The number of cTokens to redeem into underlying\\r\\n     * @return uint 0=success, otherwise a failure (see ErrorReporter.sol for details)\\r\\n     */\\r\\n    function redeem(uint redeemTokens) external override returns (uint) {\\r\\n        redeemInternal(redeemTokens);\\r\\n        return NO_ERROR;\\r\\n    }\\r\\n\\r\\n    /**\\r\\n     * @notice Sender redeems cTokens in exchange for a specified amount of underlying asset\\r\\n     * @dev Accrues interest whether or not the operation succeeds, unless reverted\\r\\n     * @param redeemAmount The amount of underlying to redeem\\r\\n     * @return uint 0=success, otherwise a failure (see ErrorReporter.sol for details)\\r\\n     */\\r\\n    function redeemUnderlying(\\r\\n        uint redeemAmount\\r\\n    ) external override returns (uint) {\\r\\n        redeemUnderlyingInternal(redeemAmount);\\r\\n        return NO_ERROR;\\r\\n    }\\r\\n\\r\\n    /**\\r\\n     * @notice Sender borrows assets from the protocol to their own address\\r\\n     * @param borrowAmount The amount of the underlying asset to borrow\\r\\n     * @return uint 0=success, otherwise a failure (see ErrorReporter.sol for details)\\r\\n     */\\r\\n    function borrow(uint borrowAmount) external override returns (uint) {\\r\\n        borrowInternal(borrowAmount);\\r\\n        return NO_ERROR;\\r\\n    }\\r\\n\\r\\n    /**\\r\\n     * @notice Sender repays their own borrow\\r\\n     * @param repayAmount The amount to repay, or -1 for the full outstanding amount\\r\\n     * @return uint 0=success, otherwise a failure (see ErrorReporter.sol for details)\\r\\n     */\\r\\n    function repayBorrow(uint repayAmount) external override returns (uint) {\\r\\n        repayBorrowInternal(repayAmount);\\r\\n        return NO_ERROR;\\r\\n    }\\r\\n\\r\\n    /**\\r\\n     * @notice Sender repays a borrow belonging to borrower\\r\\n     * @param borrower the account with the debt being payed off\\r\\n     * @param repayAmount The amount to repay, or -1 for the full outstanding amount\\r\\n     * @return uint 0=success, otherwise a failure (see ErrorReporter.sol for details)\\r\\n     */\\r\\n    function repayBorrowBehalf(\\r\\n        address borrower,\\r\\n        uint repayAmount\\r\\n    ) external override returns (uint) {\\r\\n        repayBorrowBehalfInternal(borrower, repayAmount);\\r\\n        return NO_ERROR;\\r\\n    }\\r\\n\\r\\n    /**\\r\\n     * @notice The sender liquidates the borrowers collateral.\\r\\n     *  The collateral seized is transferred to the liquidator.\\r\\n     * @param borrower The borrower of this cToken to be liquidated\\r\\n     * @param repayAmount The amount of the underlying borrowed asset to repay\\r\\n     * @param cTokenCollateral The market in which to seize collateral from the borrower\\r\\n     * @return uint 0=success, otherwise a failure (see ErrorReporter.sol for details)\\r\\n     */\\r\\n    function liquidateBorrow(\\r\\n        address borrower,\\r\\n        uint repayAmount,\\r\\n        CTokenInterface cTokenCollateral\\r\\n    ) external override returns (uint) {\\r\\n        liquidateBorrowInternal(borrower, repayAmount, cTokenCollateral);\\r\\n        return NO_ERROR;\\r\\n    }\\r\\n\\r\\n    /**\\r\\n     * @notice A public function to sweep accidental ERC-20 transfers to this contract. Tokens are sent to admin (timelock)\\r\\n     * @param token The address of the ERC-20 token to sweep\\r\\n     */\\r\\n    function sweepToken(EIP20NonStandardInterface token) external override {\\r\\n        require(\\r\\n            msg.sender == admin,\\r\\n            \\\"CErc20::sweepToken: only admin can sweep tokens\\\"\\r\\n        );\\r\\n        require(\\r\\n            address(token) != underlying,\\r\\n            \\\"CErc20::sweepToken: can not sweep underlying token\\\"\\r\\n        );\\r\\n        uint256 balance = token.balanceOf(address(this));\\r\\n        token.transfer(admin, balance);\\r\\n    }\\r\\n\\r\\n    /**\\r\\n     * @notice The sender adds to reserves.\\r\\n     * @param addAmount The amount fo underlying token to add as reserves\\r\\n     * @return uint 0=success, otherwise a failure (see ErrorReporter.sol for details)\\r\\n     */\\r\\n    function _addReserves(uint addAmount) external override returns (uint) {\\r\\n        return _addReservesInternal(addAmount);\\r\\n    }\\r\\n\\r\\n    /*** Safe Token ***/\\r\\n\\r\\n    /**\\r\\n     * @notice Gets balance of this contract in terms of the underlying\\r\\n     * @dev This excludes the value of the current message, if any\\r\\n     * @return The quantity of underlying tokens owned by this contract\\r\\n     */\\r\\n    function getCashPrior() internal view virtual override returns (uint) {\\r\\n        EIP20Interface token = EIP20Interface(underlying);\\r\\n        return token.balanceOf(address(this));\\r\\n    }\\r\\n\\r\\n    /**\\r\\n     * @dev Similar to EIP20 transfer, except it handles a False result from `transferFrom` and reverts in that case.\\r\\n     *      This will revert due to insufficient balance or insufficient allowance.\\r\\n     *      This function returns the actual amount received,\\r\\n     *      which may be less than `amount` if there is a fee attached to the transfer.\\r\\n     *\\r\\n     *      Note: This wrapper safely handles non-standard ERC-20 tokens that do not return a value.\\r\\n     *            See here: https://medium.com/coinmonks/missing-return-value-bug-at-least-130-tokens-affected-d67bf08521ca\\r\\n     */\\r\\n    function doTransferIn(\\r\\n        address from,\\r\\n        uint amount\\r\\n    ) internal virtual override returns (uint) {\\r\\n        // Read from storage once\\r\\n        address underlying_ = underlying;\\r\\n        EIP20NonStandardInterface token = EIP20NonStandardInterface(\\r\\n            underlying_\\r\\n        );\\r\\n        uint balanceBefore = EIP20Interface(underlying_).balanceOf(\\r\\n            address(this)\\r\\n        );\\r\\n        token.transferFrom(from, address(this), amount);\\r\\n\\r\\n        bool success;\\r\\n        assembly {\\r\\n            switch returndatasize()\\r\\n            case 0 {\\r\\n                // This is a non-standard ERC-20\\r\\n                success := not(0) // set success to true\\r\\n            }\\r\\n            case 32 {\\r\\n                // This is a compliant ERC-20\\r\\n                returndatacopy(0, 0, 32)\\r\\n                success := mload(0) // Set `success = returndata` of override external call\\r\\n            }\\r\\n            default {\\r\\n                // This is an excessively non-compliant ERC-20, revert.\\r\\n                revert(0, 0)\\r\\n            }\\r\\n        }\\r\\n        require(success, \\\"TOKEN_TRANSFER_IN_FAILED\\\");\\r\\n\\r\\n        // Calculate the amount that was *actually* transferred\\r\\n        uint balanceAfter = EIP20Interface(underlying_).balanceOf(\\r\\n            address(this)\\r\\n        );\\r\\n        return balanceAfter - balanceBefore; // underflow already checked above, just subtract\\r\\n    }\\r\\n\\r\\n    /**\\r\\n     * @dev Similar to EIP20 transfer, except it handles a False success from `transfer` and returns an explanatory\\r\\n     *      error code rather than reverting. If caller has not called checked protocol's balance, this may revert due to\\r\\n     *      insufficient cash held in this contract. If caller has checked protocol's balance prior to this call, and verified\\r\\n     *      it is >= amount, this should not revert in normal conditions.\\r\\n     *\\r\\n     *      Note: This wrapper safely handles non-standard ERC-20 tokens that do not return a value.\\r\\n     *            See here: https://medium.com/coinmonks/missing-return-value-bug-at-least-130-tokens-affected-d67bf08521ca\\r\\n     */\\r\\n    function doTransferOut(\\r\\n        address payable to,\\r\\n        uint amount\\r\\n    ) internal virtual override {\\r\\n        EIP20NonStandardInterface token = EIP20NonStandardInterface(underlying);\\r\\n        token.transfer(to, amount);\\r\\n\\r\\n        bool success;\\r\\n        assembly {\\r\\n            switch returndatasize()\\r\\n            case 0 {\\r\\n                // This is a non-standard ERC-20\\r\\n                success := not(0) // set success to true\\r\\n            }\\r\\n            case 32 {\\r\\n                // This is a compliant ERC-20\\r\\n                returndatacopy(0, 0, 32)\\r\\n                success := mload(0) // Set `success = returndata` of override external call\\r\\n            }\\r\\n            default {\\r\\n                // This is an excessively non-compliant ERC-20, revert.\\r\\n                revert(0, 0)\\r\\n            }\\r\\n        }\\r\\n        require(success, \\\"TOKEN_TRANSFER_OUT_FAILED\\\");\\r\\n    }\\r\\n\\r\\n    /**\\r\\n     * @notice Admin call to delegate the votes of the COMP-like underlying\\r\\n     * @param compLikeDelegatee The address to delegate votes to\\r\\n     * @dev CTokens whose underlying are not CompLike should revert here\\r\\n     */\\r\\n    function _delegateCompLikeTo(address compLikeDelegatee) external {\\r\\n        require(\\r\\n            msg.sender == admin,\\r\\n            \\\"only the admin may set the comp-like delegate\\\"\\r\\n        );\\r\\n        CompLike(underlying).delegate(compLikeDelegatee);\\r\\n    }\\r\\n}\\r\\n\",\"keccak256\":\"0x1ef5752c7844dbb78637a3b1c4ac850f3f2192e95eec1b217fc2b6f14a1a0411\",\"license\":\"BSD-3-Clause\"},\"contracts/CErc20Upgradable.sol\":{\"content\":\"// SPDX-License-Identifier: BSD-3-Clause\\r\\npragma solidity ^0.8.10;\\r\\n\\r\\nimport \\\"@openzeppelin/contracts-upgradeable/proxy/utils/Initializable.sol\\\";\\r\\n\\r\\nimport \\\"./CErc20.sol\\\";\\r\\n\\r\\n/**\\r\\n * @title Compound's CErc20Immutable Contract\\r\\n * @notice CTokens which wrap an EIP-20 underlying and are immutable\\r\\n * @author Compound\\r\\n */\\r\\ncontract CErc20Upgradable is Initializable, CErc20 {\\r\\n    /**\\r\\n     * @notice Initialize the new money market\\r\\n     * @param underlying_ The address of the underlying asset\\r\\n     * @param comptroller_ The address of the Comptroller\\r\\n     * @param interestRateModel_ The address of the interest rate model\\r\\n     * @param initialExchangeRateMantissa_ The initial exchange rate, scaled by 1e18\\r\\n     * @param name_ ERC-20 name of this token\\r\\n     * @param symbol_ ERC-20 symbol of this token\\r\\n     * @param decimals_ ERC-20 decimal precision of this token\\r\\n     */\\r\\n    function proxyInitialize(\\r\\n        address underlying_,\\r\\n        ComptrollerInterface comptroller_,\\r\\n        InterestRateModel interestRateModel_,\\r\\n        uint initialExchangeRateMantissa_,\\r\\n        string memory name_,\\r\\n        string memory symbol_,\\r\\n        uint8 decimals_,\\r\\n        address payable admin_\\r\\n    ) public initializer {\\r\\n        // Creator of the contract is admin during initialization\\r\\n        admin = payable(msg.sender);\\r\\n\\r\\n        // CErc20 initialize does the bulk of the work\\r\\n        super.initialize(\\r\\n            underlying_,\\r\\n            comptroller_,\\r\\n            interestRateModel_,\\r\\n            initialExchangeRateMantissa_,\\r\\n            name_,\\r\\n            symbol_,\\r\\n            decimals_\\r\\n        );\\r\\n\\r\\n        // Set the proper admin now that initialization is done\\r\\n        admin = admin_;\\r\\n    }\\r\\n}\\r\\n\",\"keccak256\":\"0x6f213ad8adf8c5eebd3a49d6099eeb80d4fa8bd4898d06b83436358dec319606\",\"license\":\"BSD-3-Clause\"},\"contracts/CToken.sol\":{\"content\":\"// SPDX-License-Identifier: BSD-3-Clause\\r\\npragma solidity ^0.8.10;\\r\\n\\r\\nimport \\\"./ComptrollerInterface.sol\\\";\\r\\nimport \\\"./CTokenInterfaces.sol\\\";\\r\\nimport \\\"./ErrorReporter.sol\\\";\\r\\nimport \\\"./EIP20Interface.sol\\\";\\r\\nimport \\\"./InterestRateModel.sol\\\";\\r\\nimport \\\"./ExponentialNoError.sol\\\";\\r\\n\\r\\n/**\\r\\n * @title Compound's CToken Contract\\r\\n * @notice Abstract base for CTokens\\r\\n * @author Compound\\r\\n */\\r\\nabstract contract CToken is\\r\\n    CTokenInterface,\\r\\n    ExponentialNoError,\\r\\n    TokenErrorReporter\\r\\n{\\r\\n    /**\\r\\n     * @notice Initialize the money market\\r\\n     * @param comptroller_ The address of the Comptroller\\r\\n     * @param interestRateModel_ The address of the interest rate model\\r\\n     * @param initialExchangeRateMantissa_ The initial exchange rate, scaled by 1e18\\r\\n     * @param name_ EIP-20 name of this token\\r\\n     * @param symbol_ EIP-20 symbol of this token\\r\\n     * @param decimals_ EIP-20 decimal precision of this token\\r\\n     */\\r\\n    function initialize(\\r\\n        ComptrollerInterface comptroller_,\\r\\n        InterestRateModel interestRateModel_,\\r\\n        uint256 initialExchangeRateMantissa_,\\r\\n        string memory name_,\\r\\n        string memory symbol_,\\r\\n        uint8 decimals_\\r\\n    ) public {\\r\\n        require(msg.sender == admin, \\\"only admin may initialize the market\\\");\\r\\n        require(\\r\\n            accrualBlockNumber == 0 && borrowIndex == 0,\\r\\n            \\\"market may only be initialized once\\\"\\r\\n        );\\r\\n\\r\\n        // Set initial exchange rate\\r\\n        initialExchangeRateMantissa = initialExchangeRateMantissa_;\\r\\n        require(\\r\\n            initialExchangeRateMantissa > 0,\\r\\n            \\\"initial exchange rate must be greater than zero.\\\"\\r\\n        );\\r\\n\\r\\n        // Set the comptroller\\r\\n        uint256 err = _setComptroller(comptroller_);\\r\\n        require(err == NO_ERROR, \\\"setting comptroller failed\\\");\\r\\n\\r\\n        // Initialize block number and borrow index (block number mocks depend on comptroller being set)\\r\\n        accrualBlockNumber = getBlockNumber();\\r\\n        borrowIndex = mantissaOne;\\r\\n\\r\\n        // Set the interest rate model (depends on block number / borrow index)\\r\\n        err = _setInterestRateModelFresh(interestRateModel_);\\r\\n        require(err == NO_ERROR, \\\"setting interest rate model failed\\\");\\r\\n\\r\\n        name = name_;\\r\\n        symbol = symbol_;\\r\\n        decimals = decimals_;\\r\\n\\r\\n        // The counter starts true to prevent changing it from zero to non-zero (i.e. smaller cost/refund)\\r\\n        _notEntered = true;\\r\\n    }\\r\\n\\r\\n    /**\\r\\n     * @notice Transfer `tokens` tokens from `src` to `dst` by `spender`\\r\\n     * @dev Called by both `transfer` and `transferFrom` internally\\r\\n     * @param spender The address of the account performing the transfer\\r\\n     * @param src The address of the source account\\r\\n     * @param dst The address of the destination account\\r\\n     * @param tokens The number of tokens to transfer\\r\\n     * @return 0 if the transfer succeeded, else revert\\r\\n     */\\r\\n    function transferTokens(\\r\\n        address spender,\\r\\n        address src,\\r\\n        address dst,\\r\\n        uint256 tokens\\r\\n    ) internal returns (uint256) {\\r\\n        /* Fail if transfer not allowed */\\r\\n        uint256 allowed = comptroller.transferAllowed(\\r\\n            address(this),\\r\\n            src,\\r\\n            dst,\\r\\n            tokens\\r\\n        );\\r\\n        if (allowed != 0) {\\r\\n            revert TransferComptrollerRejection(allowed);\\r\\n        }\\r\\n\\r\\n        /* Do not allow self-transfers */\\r\\n        if (src == dst) {\\r\\n            revert TransferNotAllowed();\\r\\n        }\\r\\n\\r\\n        /* Get the allowance, infinite for the account owner */\\r\\n        uint256 startingAllowance = 0;\\r\\n        if (spender == src) {\\r\\n            startingAllowance = type(uint256).max;\\r\\n        } else {\\r\\n            startingAllowance = transferAllowances[src][spender];\\r\\n        }\\r\\n\\r\\n        /* Do the calculations, checking for {under,over}flow */\\r\\n        uint256 allowanceNew = startingAllowance - tokens;\\r\\n        uint256 srcTokensNew = accountTokens[src] - tokens;\\r\\n        uint256 dstTokensNew = accountTokens[dst] + tokens;\\r\\n\\r\\n        /////////////////////////\\r\\n        // EFFECTS & INTERACTIONS\\r\\n        // (No safe failures beyond this point)\\r\\n\\r\\n        accountTokens[src] = srcTokensNew;\\r\\n        accountTokens[dst] = dstTokensNew;\\r\\n\\r\\n        /* Eat some of the allowance (if necessary) */\\r\\n        if (startingAllowance != type(uint256).max) {\\r\\n            transferAllowances[src][spender] = allowanceNew;\\r\\n        }\\r\\n\\r\\n        /* We emit a Transfer event */\\r\\n        emit Transfer(src, dst, tokens);\\r\\n\\r\\n        // unused function\\r\\n        // comptroller.transferVerify(address(this), src, dst, tokens);\\r\\n\\r\\n        return NO_ERROR;\\r\\n    }\\r\\n\\r\\n    /**\\r\\n     * @notice Transfer `amount` tokens from `msg.sender` to `dst`\\r\\n     * @param dst The address of the destination account\\r\\n     * @param amount The number of tokens to transfer\\r\\n     * @return Whether or not the transfer succeeded\\r\\n     */\\r\\n    function transfer(\\r\\n        address dst,\\r\\n        uint256 amount\\r\\n    ) external override nonReentrant returns (bool) {\\r\\n        return transferTokens(msg.sender, msg.sender, dst, amount) == NO_ERROR;\\r\\n    }\\r\\n\\r\\n    /**\\r\\n     * @notice Transfer `amount` tokens from `src` to `dst`\\r\\n     * @param src The address of the source account\\r\\n     * @param dst The address of the destination account\\r\\n     * @param amount The number of tokens to transfer\\r\\n     * @return Whether or not the transfer succeeded\\r\\n     */\\r\\n    function transferFrom(\\r\\n        address src,\\r\\n        address dst,\\r\\n        uint256 amount\\r\\n    ) external override nonReentrant returns (bool) {\\r\\n        return transferTokens(msg.sender, src, dst, amount) == NO_ERROR;\\r\\n    }\\r\\n\\r\\n    /**\\r\\n     * @notice Approve `spender` to transfer up to `amount` from `src`\\r\\n     * @dev This will overwrite the approval amount for `spender`\\r\\n     *  and is subject to issues noted [here](https://eips.ethereum.org/EIPS/eip-20#approve)\\r\\n     * @param spender The address of the account which may transfer tokens\\r\\n     * @param amount The number of tokens that are approved (uint256.max means infinite)\\r\\n     * @return Whether or not the approval succeeded\\r\\n     */\\r\\n    function approve(\\r\\n        address spender,\\r\\n        uint256 amount\\r\\n    ) external override returns (bool) {\\r\\n        address src = msg.sender;\\r\\n        transferAllowances[src][spender] = amount;\\r\\n        emit Approval(src, spender, amount);\\r\\n        return true;\\r\\n    }\\r\\n\\r\\n    /**\\r\\n     * @notice Get the current allowance from `owner` for `spender`\\r\\n     * @param owner The address of the account which owns the tokens to be spent\\r\\n     * @param spender The address of the account which may transfer tokens\\r\\n     * @return The number of tokens allowed to be spent (-1 means infinite)\\r\\n     */\\r\\n    function allowance(\\r\\n        address owner,\\r\\n        address spender\\r\\n    ) external view override returns (uint256) {\\r\\n        return transferAllowances[owner][spender];\\r\\n    }\\r\\n\\r\\n    /**\\r\\n     * @notice Get the token balance of the `owner`\\r\\n     * @param owner The address of the account to query\\r\\n     * @return The number of tokens owned by `owner`\\r\\n     */\\r\\n    function balanceOf(address owner) external view override returns (uint256) {\\r\\n        return accountTokens[owner];\\r\\n    }\\r\\n\\r\\n    /**\\r\\n     * @notice Get the underlying balance of the `owner`\\r\\n     * @dev This also accrues interest in a transaction\\r\\n     * @param owner The address of the account to query\\r\\n     * @return The amount of underlying owned by `owner`\\r\\n     */\\r\\n    function balanceOfUnderlying(\\r\\n        address owner\\r\\n    ) external override returns (uint256) {\\r\\n        Exp memory exchangeRate = Exp({mantissa: exchangeRateCurrent()});\\r\\n        return mul_ScalarTruncate(exchangeRate, accountTokens[owner]);\\r\\n    }\\r\\n\\r\\n    /**\\r\\n     * @notice Get a snapshot of the account's balances, and the cached exchange rate\\r\\n     * @dev This is used by comptroller to more efficiently perform liquidity checks.\\r\\n     * @param account Address of the account to snapshot\\r\\n     * @return (possible error, token balance, borrow balance, exchange rate mantissa)\\r\\n     */\\r\\n    function getAccountSnapshot(\\r\\n        address account\\r\\n    ) external view override returns (uint256, uint256, uint256, uint256) {\\r\\n        return (\\r\\n            NO_ERROR,\\r\\n            accountTokens[account],\\r\\n            borrowBalanceStoredInternal(account),\\r\\n            exchangeRateStoredInternal()\\r\\n        );\\r\\n    }\\r\\n\\r\\n    /**\\r\\n     * @dev Function to simply retrieve block number\\r\\n     *  This exists mainly for inheriting test contracts to stub this result.\\r\\n     */\\r\\n    function getBlockNumber() internal view virtual returns (uint256) {\\r\\n        return block.timestamp;\\r\\n    }\\r\\n\\r\\n    /**\\r\\n     * @notice Returns the current per-block borrow interest rate for this cToken\\r\\n     * @return The borrow interest rate per block, scaled by 1e18\\r\\n     */\\r\\n    function borrowRatePerBlock() external view override returns (uint256) {\\r\\n        return\\r\\n            interestRateModel.getBorrowRate(\\r\\n                getCashPrior(),\\r\\n                totalBorrows,\\r\\n                totalReserves\\r\\n            );\\r\\n    }\\r\\n\\r\\n    /**\\r\\n     * @notice Returns the current per-block supply interest rate for this cToken\\r\\n     * @return The supply interest rate per block, scaled by 1e18\\r\\n     */\\r\\n    function supplyRatePerBlock() external view override returns (uint256) {\\r\\n        return\\r\\n            interestRateModel.getSupplyRate(\\r\\n                getCashPrior(),\\r\\n                totalBorrows,\\r\\n                totalReserves,\\r\\n                reserveFactorMantissa\\r\\n            );\\r\\n    }\\r\\n\\r\\n    /**\\r\\n     * @notice Returns the current total borrows plus accrued interest\\r\\n     * @return The total borrows with interest\\r\\n     */\\r\\n    function totalBorrowsCurrent()\\r\\n        external\\r\\n        override\\r\\n        nonReentrant\\r\\n        returns (uint256)\\r\\n    {\\r\\n        accrueInterest();\\r\\n        return totalBorrows;\\r\\n    }\\r\\n\\r\\n    /**\\r\\n     * @notice Accrue interest to updated borrowIndex and then calculate account's borrow balance using the updated borrowIndex\\r\\n     * @param account The address whose balance should be calculated after updating borrowIndex\\r\\n     * @return The calculated balance\\r\\n     */\\r\\n    function borrowBalanceCurrent(\\r\\n        address account\\r\\n    ) external override nonReentrant returns (uint256) {\\r\\n        accrueInterest();\\r\\n        return borrowBalanceStored(account);\\r\\n    }\\r\\n\\r\\n    /**\\r\\n     * @notice Return the borrow balance of account based on stored data\\r\\n     * @param account The address whose balance should be calculated\\r\\n     * @return The calculated balance\\r\\n     */\\r\\n    function borrowBalanceStored(\\r\\n        address account\\r\\n    ) public view override returns (uint256) {\\r\\n        return borrowBalanceStoredInternal(account);\\r\\n    }\\r\\n\\r\\n    /**\\r\\n     * @notice Return the borrow balance of account based on stored data\\r\\n     * @param account The address whose balance should be calculated\\r\\n     * @return (error code, the calculated balance or 0 if error code is non-zero)\\r\\n     */\\r\\n    function borrowBalanceStoredInternal(\\r\\n        address account\\r\\n    ) internal view returns (uint256) {\\r\\n        /* Get borrowBalance and borrowIndex */\\r\\n        BorrowSnapshot storage borrowSnapshot = accountBorrows[account];\\r\\n\\r\\n        /* If borrowBalance = 0 then borrowIndex is likely also 0.\\r\\n         * Rather than failing the calculation with a division by 0, we immediately return 0 in this case.\\r\\n         */\\r\\n        if (borrowSnapshot.principal == 0) {\\r\\n            return 0;\\r\\n        }\\r\\n\\r\\n        /* Calculate new borrow balance using the interest index:\\r\\n         *  recentBorrowBalance = borrower.borrowBalance * market.borrowIndex / borrower.borrowIndex\\r\\n         */\\r\\n        uint256 principalTimesIndex = borrowSnapshot.principal * borrowIndex;\\r\\n        return principalTimesIndex / borrowSnapshot.interestIndex;\\r\\n    }\\r\\n\\r\\n    /**\\r\\n     * @notice Accrue interest then return the up-to-date exchange rate\\r\\n     * @return Calculated exchange rate scaled by 1e18\\r\\n     */\\r\\n    function exchangeRateCurrent()\\r\\n        public\\r\\n        override\\r\\n        nonReentrant\\r\\n        returns (uint256)\\r\\n    {\\r\\n        accrueInterest();\\r\\n        return exchangeRateStored();\\r\\n    }\\r\\n\\r\\n    /**\\r\\n     * @notice Calculates the exchange rate from the underlying to the CToken\\r\\n     * @dev This function does not accrue interest before calculating the exchange rate\\r\\n     * @return Calculated exchange rate scaled by 1e18\\r\\n     */\\r\\n    function exchangeRateStored() public view override returns (uint256) {\\r\\n        return exchangeRateStoredInternal();\\r\\n    }\\r\\n\\r\\n    /**\\r\\n     * @notice Calculates the exchange rate from the underlying to the CToken\\r\\n     * @dev This function does not accrue interest before calculating the exchange rate\\r\\n     * @return calculated exchange rate scaled by 1e18\\r\\n     */\\r\\n    function exchangeRateStoredInternal()\\r\\n        internal\\r\\n        view\\r\\n        virtual\\r\\n        returns (uint256)\\r\\n    {\\r\\n        uint256 _totalSupply = totalSupply;\\r\\n        if (_totalSupply == 0) {\\r\\n            /*\\r\\n             * If there are no tokens minted:\\r\\n             *  exchangeRate = initialExchangeRate\\r\\n             */\\r\\n            return initialExchangeRateMantissa;\\r\\n        } else {\\r\\n            /*\\r\\n             * Otherwise:\\r\\n             *  exchangeRate = (totalCash + totalBorrows - totalReserves) / totalSupply\\r\\n             */\\r\\n            uint256 totalCash = getCashPrior();\\r\\n            uint256 cashPlusBorrowsMinusReserves = totalCash +\\r\\n                totalBorrows -\\r\\n                totalReserves;\\r\\n            uint256 exchangeRate = (cashPlusBorrowsMinusReserves * expScale) /\\r\\n                _totalSupply;\\r\\n\\r\\n            return exchangeRate;\\r\\n        }\\r\\n    }\\r\\n\\r\\n    /**\\r\\n     * @notice Get cash balance of this cToken in the underlying asset\\r\\n     * @return The quantity of underlying asset owned by this contract\\r\\n     */\\r\\n    function getCash() external view override returns (uint256) {\\r\\n        return getCashPrior();\\r\\n    }\\r\\n\\r\\n    /**\\r\\n     * @notice Applies accrued interest to total borrows and reserves\\r\\n     * @dev This calculates interest accrued from the last checkpointed block\\r\\n     *   up to the current block and writes new checkpoint to storage.\\r\\n     */\\r\\n    function accrueInterest() public virtual override returns (uint256) {\\r\\n        /* Remember the initial block number */\\r\\n        uint256 currentBlockNumber = getBlockNumber();\\r\\n        uint256 accrualBlockNumberPrior = accrualBlockNumber;\\r\\n\\r\\n        /* Short-circuit accumulating 0 interest */\\r\\n        if (accrualBlockNumberPrior == currentBlockNumber) {\\r\\n            return NO_ERROR;\\r\\n        }\\r\\n\\r\\n        /* Read the previous values out of storage */\\r\\n        uint256 cashPrior = getCashPrior();\\r\\n        uint256 borrowsPrior = totalBorrows;\\r\\n        uint256 reservesPrior = totalReserves;\\r\\n        uint256 borrowIndexPrior = borrowIndex;\\r\\n\\r\\n        /* Calculate the current borrow interest rate */\\r\\n        uint256 borrowRateMantissa = interestRateModel.getBorrowRate(\\r\\n            cashPrior,\\r\\n            borrowsPrior,\\r\\n            reservesPrior\\r\\n        );\\r\\n        require(\\r\\n            borrowRateMantissa <= borrowRateMaxMantissa,\\r\\n            \\\"borrow rate is absurdly high\\\"\\r\\n        );\\r\\n\\r\\n        /* Calculate the number of blocks elapsed since the last accrual */\\r\\n        uint256 blockDelta = currentBlockNumber - accrualBlockNumberPrior;\\r\\n\\r\\n        /*\\r\\n         * Calculate the interest accumulated into borrows and reserves and the new index:\\r\\n         *  simpleInterestFactor = borrowRate * blockDelta\\r\\n         *  interestAccumulated = simpleInterestFactor * totalBorrows\\r\\n         *  totalBorrowsNew = interestAccumulated + totalBorrows\\r\\n         *  totalReservesNew = interestAccumulated * reserveFactor + totalReserves\\r\\n         *  borrowIndexNew = simpleInterestFactor * borrowIndex + borrowIndex\\r\\n         */\\r\\n\\r\\n        Exp memory simpleInterestFactor = mul_(\\r\\n            Exp({mantissa: borrowRateMantissa}),\\r\\n            blockDelta\\r\\n        );\\r\\n        uint256 interestAccumulated = mul_ScalarTruncate(\\r\\n            simpleInterestFactor,\\r\\n            borrowsPrior\\r\\n        );\\r\\n        uint256 totalBorrowsNew = interestAccumulated + borrowsPrior;\\r\\n        uint256 totalReservesNew = mul_ScalarTruncateAddUInt(\\r\\n            Exp({mantissa: reserveFactorMantissa}),\\r\\n            interestAccumulated,\\r\\n            reservesPrior\\r\\n        );\\r\\n        uint256 borrowIndexNew = mul_ScalarTruncateAddUInt(\\r\\n            simpleInterestFactor,\\r\\n            borrowIndexPrior,\\r\\n            borrowIndexPrior\\r\\n        );\\r\\n\\r\\n        /////////////////////////\\r\\n        // EFFECTS & INTERACTIONS\\r\\n        // (No safe failures beyond this point)\\r\\n\\r\\n        /* We write the previously calculated values into storage */\\r\\n        accrualBlockNumber = currentBlockNumber;\\r\\n        borrowIndex = borrowIndexNew;\\r\\n        totalBorrows = totalBorrowsNew;\\r\\n        totalReserves = totalReservesNew;\\r\\n\\r\\n        /* We emit an AccrueInterest event */\\r\\n        emit AccrueInterest(\\r\\n            cashPrior,\\r\\n            interestAccumulated,\\r\\n            borrowIndexNew,\\r\\n            totalBorrowsNew\\r\\n        );\\r\\n\\r\\n        return NO_ERROR;\\r\\n    }\\r\\n\\r\\n    /**\\r\\n     * @notice Sender supplies assets into the market and receives cTokens in exchange\\r\\n     * @dev Accrues interest whether or not the operation succeeds, unless reverted\\r\\n     * @param mintAmount The amount of the underlying asset to supply\\r\\n     */\\r\\n    function mintInternal(uint256 mintAmount) internal nonReentrant {\\r\\n        accrueInterest();\\r\\n        // mintFresh emits the actual Mint event if successful and logs on errors, so we don't need to\\r\\n        mintFresh(msg.sender, mintAmount);\\r\\n    }\\r\\n\\r\\n    /**\\r\\n     * @notice User supplies assets into the market and receives cTokens in exchange\\r\\n     * @dev Assumes interest has already been accrued up to the current block\\r\\n     * @param minter The address of the account which is supplying the assets\\r\\n     * @param mintAmount The amount of the underlying asset to supply\\r\\n     */\\r\\n    function mintFresh(address minter, uint256 mintAmount) internal {\\r\\n        /* Fail if mint not allowed */\\r\\n        uint256 allowed = comptroller.mintAllowed(\\r\\n            address(this),\\r\\n            minter,\\r\\n            mintAmount\\r\\n        );\\r\\n        if (allowed != 0) {\\r\\n            revert MintComptrollerRejection(allowed);\\r\\n        }\\r\\n\\r\\n        /* Verify market's block number equals current block number */\\r\\n        if (accrualBlockNumber != getBlockNumber()) {\\r\\n            revert MintFreshnessCheck();\\r\\n        }\\r\\n\\r\\n        Exp memory exchangeRate = Exp({mantissa: exchangeRateStoredInternal()});\\r\\n\\r\\n        /////////////////////////\\r\\n        // EFFECTS & INTERACTIONS\\r\\n        // (No safe failures beyond this point)\\r\\n\\r\\n        /*\\r\\n         *  We call `doTransferIn` for the minter and the mintAmount.\\r\\n         *  Note: The cToken must handle variations between ERC-20 and ETH underlying.\\r\\n         *  `doTransferIn` reverts if anything goes wrong, since we can't be sure if\\r\\n         *  side-effects occurred. The function returns the amount actually transferred,\\r\\n         *  in case of a fee. On success, the cToken holds an additional `actualMintAmount`\\r\\n         *  of cash.\\r\\n         */\\r\\n        uint256 actualMintAmount = doTransferIn(minter, mintAmount);\\r\\n\\r\\n        /*\\r\\n         * We get the current exchange rate and calculate the number of cTokens to be minted:\\r\\n         *  mintTokens = actualMintAmount / exchangeRate\\r\\n         */\\r\\n\\r\\n        uint256 mintTokens = div_(actualMintAmount, exchangeRate);\\r\\n\\r\\n        // avoid exchangeRate manipulation\\r\\n        if (totalSupply == 0) {\\r\\n            totalSupply = 1000;\\r\\n            accountTokens[address(0)] = 1000;\\r\\n            mintTokens -= 1000;\\r\\n        }\\r\\n\\r\\n        /*\\r\\n         * We calculate the new total supply of cTokens and minter token balance, checking for overflow:\\r\\n         *  totalSupplyNew = totalSupply + mintTokens\\r\\n         *  accountTokensNew = accountTokens[minter] + mintTokens\\r\\n         * And write them into storage\\r\\n         */\\r\\n        totalSupply = totalSupply + mintTokens;\\r\\n        accountTokens[minter] = accountTokens[minter] + mintTokens;\\r\\n\\r\\n        /* We emit a Mint event, and a Transfer event */\\r\\n        emit Mint(minter, actualMintAmount, mintTokens);\\r\\n        emit Transfer(address(this), minter, mintTokens);\\r\\n\\r\\n        /* We call the defense hook */\\r\\n\\r\\n        comptroller.mintVerify(\\r\\n            address(this),\\r\\n            minter,\\r\\n            actualMintAmount,\\r\\n            mintTokens\\r\\n        );\\r\\n    }\\r\\n\\r\\n    /**\\r\\n     * @notice Sender redeems cTokens in exchange for the underlying asset\\r\\n     * @dev Accrues interest whether or not the operation succeeds, unless reverted\\r\\n     * @param redeemTokens The number of cTokens to redeem into underlying\\r\\n     */\\r\\n    function redeemInternal(uint256 redeemTokens) internal nonReentrant {\\r\\n        accrueInterest();\\r\\n        // redeemFresh emits redeem-specific logs on errors, so we don't need to\\r\\n        redeemFresh(payable(msg.sender), redeemTokens, 0);\\r\\n    }\\r\\n\\r\\n    /**\\r\\n     * @notice Sender redeems cTokens in exchange for a specified amount of underlying asset\\r\\n     * @dev Accrues interest whether or not the operation succeeds, unless reverted\\r\\n     * @param redeemAmount The amount of underlying to receive from redeeming cTokens\\r\\n     */\\r\\n    function redeemUnderlyingInternal(\\r\\n        uint256 redeemAmount\\r\\n    ) internal nonReentrant {\\r\\n        accrueInterest();\\r\\n        // redeemFresh emits redeem-specific logs on errors, so we don't need to\\r\\n        redeemFresh(payable(msg.sender), 0, redeemAmount);\\r\\n    }\\r\\n\\r\\n    /**\\r\\n     * @notice User redeems cTokens in exchange for the underlying asset\\r\\n     * @dev Assumes interest has already been accrued up to the current block\\r\\n     * @param redeemer The address of the account which is redeeming the tokens\\r\\n     * @param redeemTokensIn The number of cTokens to redeem into underlying (only one of redeemTokensIn or redeemAmountIn may be non-zero)\\r\\n     * @param redeemAmountIn The number of underlying tokens to receive from redeeming cTokens (only one of redeemTokensIn or redeemAmountIn may be non-zero)\\r\\n     */\\r\\n    function redeemFresh(\\r\\n        address payable redeemer,\\r\\n        uint256 redeemTokensIn,\\r\\n        uint256 redeemAmountIn\\r\\n    ) internal {\\r\\n        require(\\r\\n            redeemTokensIn == 0 || redeemAmountIn == 0,\\r\\n            \\\"one of redeemTokensIn or redeemAmountIn must be zero\\\"\\r\\n        );\\r\\n\\r\\n        /* exchangeRate = invoke Exchange Rate Stored() */\\r\\n        Exp memory exchangeRate = Exp({mantissa: exchangeRateStoredInternal()});\\r\\n\\r\\n        uint256 redeemTokens;\\r\\n        uint256 redeemAmount;\\r\\n        /* If redeemTokensIn > 0: */\\r\\n        if (redeemTokensIn > 0) {\\r\\n            /*\\r\\n             * We calculate the exchange rate and the amount of underlying to be redeemed:\\r\\n             *  redeemTokens = redeemTokensIn\\r\\n             *  redeemAmount = redeemTokensIn x exchangeRateCurrent\\r\\n             */\\r\\n            redeemTokens = redeemTokensIn;\\r\\n            redeemAmount = mul_ScalarTruncate(exchangeRate, redeemTokensIn);\\r\\n        } else {\\r\\n            /*\\r\\n             * We get the current exchange rate and calculate the amount to be redeemed:\\r\\n             *  redeemTokens = redeemAmountIn / exchangeRate\\r\\n             *  redeemAmount = redeemAmountIn\\r\\n             */\\r\\n            redeemTokens = div_(redeemAmountIn, exchangeRate);\\r\\n            redeemAmount = redeemAmountIn;\\r\\n        }\\r\\n\\r\\n        /* Fail if redeem not allowed */\\r\\n        uint256 allowed = comptroller.redeemAllowed(\\r\\n            address(this),\\r\\n            redeemer,\\r\\n            redeemTokens\\r\\n        );\\r\\n        if (allowed != 0) {\\r\\n            revert RedeemComptrollerRejection(allowed);\\r\\n        }\\r\\n\\r\\n        /* Verify market's block number equals current block number */\\r\\n        if (accrualBlockNumber != getBlockNumber()) {\\r\\n            revert RedeemFreshnessCheck();\\r\\n        }\\r\\n\\r\\n        /* Fail gracefully if protocol has insufficient cash */\\r\\n        if (getCashPrior() < redeemAmount) {\\r\\n            revert RedeemTransferOutNotPossible();\\r\\n        }\\r\\n\\r\\n        /////////////////////////\\r\\n        // EFFECTS & INTERACTIONS\\r\\n        // (No safe failures beyond this point)\\r\\n\\r\\n        /*\\r\\n         * We write the previously calculated values into storage.\\r\\n         *  Note: Avoid token reentrancy attacks by writing reduced supply before external transfer.\\r\\n         */\\r\\n        totalSupply = totalSupply - redeemTokens;\\r\\n        accountTokens[redeemer] = accountTokens[redeemer] - redeemTokens;\\r\\n\\r\\n        /*\\r\\n         * We invoke doTransferOut for the redeemer and the redeemAmount.\\r\\n         *  Note: The cToken must handle variations between ERC-20 and ETH underlying.\\r\\n         *  On success, the cToken has redeemAmount less of cash.\\r\\n         *  doTransferOut reverts if anything goes wrong, since we can't be sure if side effects occurred.\\r\\n         */\\r\\n        doTransferOut(redeemer, redeemAmount);\\r\\n\\r\\n        /* We emit a Transfer event, and a Redeem event */\\r\\n        emit Transfer(redeemer, address(this), redeemTokens);\\r\\n        emit Redeem(redeemer, redeemAmount, redeemTokens);\\r\\n\\r\\n        /* We call the defense hook */\\r\\n        comptroller.redeemVerify(\\r\\n            address(this),\\r\\n            redeemer,\\r\\n            redeemAmount,\\r\\n            redeemTokens\\r\\n        );\\r\\n    }\\r\\n\\r\\n    /**\\r\\n     * @notice Sender borrows assets from the protocol to their own address\\r\\n     * @param borrowAmount The amount of the underlying asset to borrow\\r\\n     */\\r\\n    function borrowInternal(uint256 borrowAmount) internal nonReentrant {\\r\\n        accrueInterest();\\r\\n        // borrowFresh emits borrow-specific logs on errors, so we don't need to\\r\\n        borrowFresh(payable(msg.sender), borrowAmount);\\r\\n    }\\r\\n\\r\\n    /**\\r\\n     * @notice Users borrow assets from the protocol to their own address\\r\\n     * @param borrowAmount The amount of the underlying asset to borrow\\r\\n     */\\r\\n    function borrowFresh(\\r\\n        address payable borrower,\\r\\n        uint256 borrowAmount\\r\\n    ) internal {\\r\\n        /* Fail if borrow not allowed */\\r\\n        uint256 allowed = comptroller.borrowAllowed(\\r\\n            address(this),\\r\\n            borrower,\\r\\n            borrowAmount\\r\\n        );\\r\\n        if (allowed != 0) {\\r\\n            revert BorrowComptrollerRejection(allowed);\\r\\n        }\\r\\n\\r\\n        /* Verify market's block number equals current block number */\\r\\n        if (accrualBlockNumber != getBlockNumber()) {\\r\\n            revert BorrowFreshnessCheck();\\r\\n        }\\r\\n\\r\\n        /* Fail gracefully if protocol has insufficient underlying cash */\\r\\n        if (getCashPrior() < borrowAmount) {\\r\\n            revert BorrowCashNotAvailable();\\r\\n        }\\r\\n\\r\\n        /*\\r\\n         * We calculate the new borrower and total borrow balances, failing on overflow:\\r\\n         *  accountBorrowNew = accountBorrow + borrowAmount\\r\\n         *  totalBorrowsNew = totalBorrows + borrowAmount\\r\\n         */\\r\\n        uint256 accountBorrowsPrev = borrowBalanceStoredInternal(borrower);\\r\\n        uint256 accountBorrowsNew = accountBorrowsPrev + borrowAmount;\\r\\n        uint256 totalBorrowsNew = totalBorrows + borrowAmount;\\r\\n\\r\\n        /////////////////////////\\r\\n        // EFFECTS & INTERACTIONS\\r\\n        // (No safe failures beyond this point)\\r\\n\\r\\n        /*\\r\\n         * We write the previously calculated values into storage.\\r\\n         *  Note: Avoid token reentrancy attacks by writing increased borrow before external transfer.\\r\\n        `*/\\r\\n        accountBorrows[borrower].principal = accountBorrowsNew;\\r\\n        accountBorrows[borrower].interestIndex = borrowIndex;\\r\\n        totalBorrows = totalBorrowsNew;\\r\\n\\r\\n        /*\\r\\n         * We invoke doTransferOut for the borrower and the borrowAmount.\\r\\n         *  Note: The cToken must handle variations between ERC-20 and ETH underlying.\\r\\n         *  On success, the cToken borrowAmount less of cash.\\r\\n         *  doTransferOut reverts if anything goes wrong, since we can't be sure if side effects occurred.\\r\\n         */\\r\\n        doTransferOut(borrower, borrowAmount);\\r\\n\\r\\n        /* We emit a Borrow event */\\r\\n        emit Borrow(borrower, borrowAmount, accountBorrowsNew, totalBorrowsNew);\\r\\n    }\\r\\n\\r\\n    /**\\r\\n     * @notice Sender repays their own borrow\\r\\n     * @param repayAmount The amount to repay, or -1 for the full outstanding amount\\r\\n     */\\r\\n    function repayBorrowInternal(uint256 repayAmount) internal nonReentrant {\\r\\n        accrueInterest();\\r\\n        // repayBorrowFresh emits repay-borrow-specific logs on errors, so we don't need to\\r\\n        repayBorrowFresh(msg.sender, msg.sender, repayAmount);\\r\\n    }\\r\\n\\r\\n    /**\\r\\n     * @notice Sender repays a borrow belonging to borrower\\r\\n     * @param borrower the account with the debt being payed off\\r\\n     * @param repayAmount The amount to repay, or -1 for the full outstanding amount\\r\\n     */\\r\\n    function repayBorrowBehalfInternal(\\r\\n        address borrower,\\r\\n        uint256 repayAmount\\r\\n    ) internal nonReentrant {\\r\\n        accrueInterest();\\r\\n        // repayBorrowFresh emits repay-borrow-specific logs on errors, so we don't need to\\r\\n        repayBorrowFresh(msg.sender, borrower, repayAmount);\\r\\n    }\\r\\n\\r\\n    /**\\r\\n     * @notice Borrows are repaid by another user (possibly the borrower).\\r\\n     * @param payer the account paying off the borrow\\r\\n     * @param borrower the account with the debt being payed off\\r\\n     * @param repayAmount the amount of underlying tokens being returned, or -1 for the full outstanding amount\\r\\n     * @return (uint) the actual repayment amount.\\r\\n     */\\r\\n    function repayBorrowFresh(\\r\\n        address payer,\\r\\n        address borrower,\\r\\n        uint256 repayAmount\\r\\n    ) internal returns (uint256) {\\r\\n        /* Fail if repayBorrow not allowed */\\r\\n        uint256 allowed = comptroller.repayBorrowAllowed(\\r\\n            address(this),\\r\\n            payer,\\r\\n            borrower,\\r\\n            repayAmount\\r\\n        );\\r\\n        if (allowed != 0) {\\r\\n            revert RepayBorrowComptrollerRejection(allowed);\\r\\n        }\\r\\n\\r\\n        /* Verify market's block number equals current block number */\\r\\n        if (accrualBlockNumber != getBlockNumber()) {\\r\\n            revert RepayBorrowFreshnessCheck();\\r\\n        }\\r\\n\\r\\n        /* We fetch the amount the borrower owes, with accumulated interest */\\r\\n        uint256 accountBorrowsPrev = borrowBalanceStoredInternal(borrower);\\r\\n\\r\\n        /* If repayAmount == -1, repayAmount = accountBorrows */\\r\\n        uint256 repayAmountFinal = repayAmount == type(uint256).max\\r\\n            ? accountBorrowsPrev\\r\\n            : repayAmount;\\r\\n\\r\\n        /////////////////////////\\r\\n        // EFFECTS & INTERACTIONS\\r\\n        // (No safe failures beyond this point)\\r\\n\\r\\n        /*\\r\\n         * We call doTransferIn for the payer and the repayAmount\\r\\n         *  Note: The cToken must handle variations between ERC-20 and ETH underlying.\\r\\n         *  On success, the cToken holds an additional repayAmount of cash.\\r\\n         *  doTransferIn reverts if anything goes wrong, since we can't be sure if side effects occurred.\\r\\n         *   it returns the amount actually transferred, in case of a fee.\\r\\n         */\\r\\n        uint256 actualRepayAmount = doTransferIn(payer, repayAmountFinal);\\r\\n\\r\\n        /*\\r\\n         * We calculate the new borrower and total borrow balances, failing on underflow:\\r\\n         *  accountBorrowsNew = accountBorrows - actualRepayAmount\\r\\n         *  totalBorrowsNew = totalBorrows - actualRepayAmount\\r\\n         */\\r\\n        uint256 accountBorrowsNew = accountBorrowsPrev - actualRepayAmount;\\r\\n        uint256 totalBorrowsNew = totalBorrows - actualRepayAmount;\\r\\n\\r\\n        /* We write the previously calculated values into storage */\\r\\n        accountBorrows[borrower].principal = accountBorrowsNew;\\r\\n        accountBorrows[borrower].interestIndex = borrowIndex;\\r\\n        totalBorrows = totalBorrowsNew;\\r\\n\\r\\n        /* We emit a RepayBorrow event */\\r\\n        emit RepayBorrow(\\r\\n            payer,\\r\\n            borrower,\\r\\n            actualRepayAmount,\\r\\n            accountBorrowsNew,\\r\\n            totalBorrowsNew\\r\\n        );\\r\\n\\r\\n        return actualRepayAmount;\\r\\n    }\\r\\n\\r\\n    /**\\r\\n     * @notice The sender liquidates the borrowers collateral.\\r\\n     *  The collateral seized is transferred to the liquidator.\\r\\n     * @param borrower The borrower of this cToken to be liquidated\\r\\n     * @param cTokenCollateral The market in which to seize collateral from the borrower\\r\\n     * @param repayAmount The amount of the underlying borrowed asset to repay\\r\\n     */\\r\\n    function liquidateBorrowInternal(\\r\\n        address borrower,\\r\\n        uint256 repayAmount,\\r\\n        CTokenInterface cTokenCollateral\\r\\n    ) internal nonReentrant {\\r\\n        accrueInterest();\\r\\n\\r\\n        uint256 error = cTokenCollateral.accrueInterest();\\r\\n        if (error != NO_ERROR) {\\r\\n            // accrueInterest emits logs on errors, but we still want to log the fact that an attempted liquidation failed\\r\\n            revert LiquidateAccrueCollateralInterestFailed(error);\\r\\n        }\\r\\n\\r\\n        // liquidateBorrowFresh emits borrow-specific logs on errors, so we don't need to\\r\\n        liquidateBorrowFresh(\\r\\n            msg.sender,\\r\\n            borrower,\\r\\n            repayAmount,\\r\\n            cTokenCollateral\\r\\n        );\\r\\n    }\\r\\n\\r\\n    /**\\r\\n     * @notice The liquidator liquidates the borrowers collateral.\\r\\n     *  The collateral seized is transferred to the liquidator.\\r\\n     * @param borrower The borrower of this cToken to be liquidated\\r\\n     * @param liquidator The address repaying the borrow and seizing collateral\\r\\n     * @param cTokenCollateral The market in which to seize collateral from the borrower\\r\\n     * @param repayAmount The amount of the underlying borrowed asset to repay\\r\\n     */\\r\\n    function liquidateBorrowFresh(\\r\\n        address liquidator,\\r\\n        address borrower,\\r\\n        uint256 repayAmount,\\r\\n        CTokenInterface cTokenCollateral\\r\\n    ) internal {\\r\\n        /* Fail if liquidate not allowed */\\r\\n        uint256 allowed = comptroller.liquidateBorrowAllowed(\\r\\n            address(this),\\r\\n            address(cTokenCollateral),\\r\\n            liquidator,\\r\\n            borrower,\\r\\n            repayAmount\\r\\n        );\\r\\n        if (allowed != 0) {\\r\\n            revert LiquidateComptrollerRejection(allowed);\\r\\n        }\\r\\n\\r\\n        /* Verify market's block number equals current block number */\\r\\n        if (accrualBlockNumber != getBlockNumber()) {\\r\\n            revert LiquidateFreshnessCheck();\\r\\n        }\\r\\n\\r\\n        /* Verify cTokenCollateral market's block number equals current block number */\\r\\n        if (cTokenCollateral.accrualBlockNumber() != getBlockNumber()) {\\r\\n            revert LiquidateCollateralFreshnessCheck();\\r\\n        }\\r\\n\\r\\n        /* Fail if borrower = liquidator */\\r\\n        if (borrower == liquidator) {\\r\\n            revert LiquidateLiquidatorIsBorrower();\\r\\n        }\\r\\n\\r\\n        /* Fail if repayAmount = 0 */\\r\\n        if (repayAmount == 0) {\\r\\n            revert LiquidateCloseAmountIsZero();\\r\\n        }\\r\\n\\r\\n        /* Fail if repayAmount = -1 */\\r\\n        if (repayAmount == type(uint256).max) {\\r\\n            revert LiquidateCloseAmountIsUintMax();\\r\\n        }\\r\\n\\r\\n        /* Fail if repayBorrow fails */\\r\\n        uint256 actualRepayAmount = repayBorrowFresh(\\r\\n            liquidator,\\r\\n            borrower,\\r\\n            repayAmount\\r\\n        );\\r\\n\\r\\n        /////////////////////////\\r\\n        // EFFECTS & INTERACTIONS\\r\\n        // (No safe failures beyond this point)\\r\\n\\r\\n        /* We calculate the number of collateral tokens that will be seized */\\r\\n        (uint256 amountSeizeError, uint256 seizeTokens) = comptroller\\r\\n            .liquidateCalculateSeizeTokens(\\r\\n                address(this),\\r\\n                address(cTokenCollateral),\\r\\n                actualRepayAmount\\r\\n            );\\r\\n        require(\\r\\n            amountSeizeError == NO_ERROR,\\r\\n            \\\"LIQUIDATE_COMPTROLLER_CALCULATE_AMOUNT_SEIZE_FAILED\\\"\\r\\n        );\\r\\n\\r\\n        /* Revert if borrower collateral token balance < seizeTokens */\\r\\n        require(\\r\\n            cTokenCollateral.balanceOf(borrower) >= seizeTokens,\\r\\n            \\\"LIQUIDATE_SEIZE_TOO_MUCH\\\"\\r\\n        );\\r\\n\\r\\n        // If this is also the collateral, run seizeInternal to avoid re-entrancy, otherwise make an external call\\r\\n        if (address(cTokenCollateral) == address(this)) {\\r\\n            seizeInternal(address(this), liquidator, borrower, seizeTokens);\\r\\n        } else {\\r\\n            require(\\r\\n                cTokenCollateral.seize(liquidator, borrower, seizeTokens) ==\\r\\n                    NO_ERROR,\\r\\n                \\\"token seizure failed\\\"\\r\\n            );\\r\\n        }\\r\\n\\r\\n        /* We emit a LiquidateBorrow event */\\r\\n        emit LiquidateBorrow(\\r\\n            liquidator,\\r\\n            borrower,\\r\\n            actualRepayAmount,\\r\\n            address(cTokenCollateral),\\r\\n            seizeTokens\\r\\n        );\\r\\n    }\\r\\n\\r\\n    /**\\r\\n     * @notice Transfers collateral tokens (this market) to the liquidator.\\r\\n     * @dev Will fail unless called by another cToken during the process of liquidation.\\r\\n     *  Its absolutely critical to use msg.sender as the borrowed cToken and not a parameter.\\r\\n     * @param liquidator The account receiving seized collateral\\r\\n     * @param borrower The account having collateral seized\\r\\n     * @param seizeTokens The number of cTokens to seize\\r\\n     * @return uint 0=success, otherwise a failure (see ErrorReporter.sol for details)\\r\\n     */\\r\\n    function seize(\\r\\n        address liquidator,\\r\\n        address borrower,\\r\\n        uint256 seizeTokens\\r\\n    ) external override nonReentrant returns (uint256) {\\r\\n        seizeInternal(msg.sender, liquidator, borrower, seizeTokens);\\r\\n\\r\\n        return NO_ERROR;\\r\\n    }\\r\\n\\r\\n    /**\\r\\n     * @notice Transfers collateral tokens (this market) to the liquidator.\\r\\n     * @dev Called only during an in-kind liquidation, or by liquidateBorrow during the liquidation of another CToken.\\r\\n     *  Its absolutely critical to use msg.sender as the seizer cToken and not a parameter.\\r\\n     * @param seizerToken The contract seizing the collateral (i.e. borrowed cToken)\\r\\n     * @param liquidator The account receiving seized collateral\\r\\n     * @param borrower The account having collateral seized\\r\\n     * @param seizeTokens The number of cTokens to seize\\r\\n     */\\r\\n    function seizeInternal(\\r\\n        address seizerToken,\\r\\n        address liquidator,\\r\\n        address borrower,\\r\\n        uint256 seizeTokens\\r\\n    ) internal {\\r\\n        /* Fail if seize not allowed */\\r\\n        uint256 allowed = comptroller.seizeAllowed(\\r\\n            address(this),\\r\\n            seizerToken,\\r\\n            liquidator,\\r\\n            borrower,\\r\\n            seizeTokens\\r\\n        );\\r\\n        if (allowed != 0) {\\r\\n            revert LiquidateSeizeComptrollerRejection(allowed);\\r\\n        }\\r\\n\\r\\n        /* Fail if borrower = liquidator */\\r\\n        if (borrower == liquidator) {\\r\\n            revert LiquidateSeizeLiquidatorIsBorrower();\\r\\n        }\\r\\n\\r\\n        /*\\r\\n         * We calculate the new borrower and liquidator token balances, failing on underflow/overflow:\\r\\n         *  borrowerTokensNew = accountTokens[borrower] - seizeTokens\\r\\n         *  liquidatorTokensNew = accountTokens[liquidator] + seizeTokens\\r\\n         */\\r\\n        uint256 protocolSeizeTokens = mul_(\\r\\n            seizeTokens,\\r\\n            Exp({mantissa: protocolSeizeShareMantissa})\\r\\n        );\\r\\n        uint256 liquidatorSeizeTokens = seizeTokens - protocolSeizeTokens;\\r\\n        Exp memory exchangeRate = Exp({mantissa: exchangeRateStoredInternal()});\\r\\n        uint256 protocolSeizeAmount = mul_ScalarTruncate(\\r\\n            exchangeRate,\\r\\n            protocolSeizeTokens\\r\\n        );\\r\\n        uint256 totalReservesNew = totalReserves + protocolSeizeAmount;\\r\\n\\r\\n        /////////////////////////\\r\\n        // EFFECTS & INTERACTIONS\\r\\n        // (No safe failures beyond this point)\\r\\n\\r\\n        /* We write the calculated values into storage */\\r\\n        totalReserves = totalReservesNew;\\r\\n        totalSupply = totalSupply - protocolSeizeTokens;\\r\\n        accountTokens[borrower] = accountTokens[borrower] - seizeTokens;\\r\\n        accountTokens[liquidator] =\\r\\n            accountTokens[liquidator] +\\r\\n            liquidatorSeizeTokens;\\r\\n\\r\\n        /* Emit a Transfer event */\\r\\n        emit Transfer(borrower, liquidator, liquidatorSeizeTokens);\\r\\n        emit Transfer(borrower, address(this), protocolSeizeTokens);\\r\\n        emit ReservesAdded(\\r\\n            address(this),\\r\\n            protocolSeizeAmount,\\r\\n            totalReservesNew\\r\\n        );\\r\\n    }\\r\\n\\r\\n    /*** Admin Functions ***/\\r\\n\\r\\n    /**\\r\\n     * @notice Begins transfer of admin rights. The newPendingAdmin must call `_acceptAdmin` to finalize the transfer.\\r\\n     * @dev Admin function to begin change of admin. The newPendingAdmin must call `_acceptAdmin` to finalize the transfer.\\r\\n     * @param newPendingAdmin New pending admin.\\r\\n     * @return uint 0=success, otherwise a failure (see ErrorReporter.sol for details)\\r\\n     */\\r\\n    function _setPendingAdmin(\\r\\n        address payable newPendingAdmin\\r\\n    ) external override returns (uint256) {\\r\\n        // Check caller = admin\\r\\n        if (msg.sender != admin) {\\r\\n            revert SetPendingAdminOwnerCheck();\\r\\n        }\\r\\n\\r\\n        // Save current value, if any, for inclusion in log\\r\\n        address oldPendingAdmin = pendingAdmin;\\r\\n\\r\\n        // Store pendingAdmin with value newPendingAdmin\\r\\n        pendingAdmin = newPendingAdmin;\\r\\n\\r\\n        // Emit NewPendingAdmin(oldPendingAdmin, newPendingAdmin)\\r\\n        emit NewPendingAdmin(oldPendingAdmin, newPendingAdmin);\\r\\n\\r\\n        return NO_ERROR;\\r\\n    }\\r\\n\\r\\n    /**\\r\\n     * @notice Accepts transfer of admin rights. msg.sender must be pendingAdmin\\r\\n     * @dev Admin function for pending admin to accept role and update admin\\r\\n     * @return uint 0=success, otherwise a failure (see ErrorReporter.sol for details)\\r\\n     */\\r\\n    function _acceptAdmin() external override returns (uint256) {\\r\\n        // Check caller is pendingAdmin and pendingAdmin \\u2260 address(0)\\r\\n        if (msg.sender != pendingAdmin || msg.sender == address(0)) {\\r\\n            revert AcceptAdminPendingAdminCheck();\\r\\n        }\\r\\n\\r\\n        // Save current values for inclusion in log\\r\\n        address oldAdmin = admin;\\r\\n        address oldPendingAdmin = pendingAdmin;\\r\\n\\r\\n        // Store admin with value pendingAdmin\\r\\n        admin = pendingAdmin;\\r\\n\\r\\n        // Clear the pending value\\r\\n        pendingAdmin = payable(address(0));\\r\\n\\r\\n        emit NewAdmin(oldAdmin, admin);\\r\\n        emit NewPendingAdmin(oldPendingAdmin, pendingAdmin);\\r\\n\\r\\n        return NO_ERROR;\\r\\n    }\\r\\n\\r\\n    /**\\r\\n     * @notice Sets a new comptroller for the market\\r\\n     * @dev Admin function to set a new comptroller\\r\\n     * @return uint 0=success, otherwise a failure (see ErrorReporter.sol for details)\\r\\n     */\\r\\n    function _setComptroller(\\r\\n        ComptrollerInterface newComptroller\\r\\n    ) public override returns (uint256) {\\r\\n        // Check caller is admin\\r\\n        if (msg.sender != admin) {\\r\\n            revert SetComptrollerOwnerCheck();\\r\\n        }\\r\\n\\r\\n        ComptrollerInterface oldComptroller = comptroller;\\r\\n        // Ensure invoke comptroller.isComptroller() returns true\\r\\n        require(newComptroller.isComptroller(), \\\"marker method returned false\\\");\\r\\n\\r\\n        // Set market's comptroller to newComptroller\\r\\n        comptroller = newComptroller;\\r\\n\\r\\n        // Emit NewComptroller(oldComptroller, newComptroller)\\r\\n        emit NewComptroller(oldComptroller, newComptroller);\\r\\n\\r\\n        return NO_ERROR;\\r\\n    }\\r\\n\\r\\n    /**\\r\\n     * @notice accrues interest and sets a new reserve factor for the protocol using _setReserveFactorFresh\\r\\n     * @dev Admin function to accrue interest and set a new reserve factor\\r\\n     * @return uint 0=success, otherwise a failure (see ErrorReporter.sol for details)\\r\\n     */\\r\\n    function _setReserveFactor(\\r\\n        uint256 newReserveFactorMantissa\\r\\n    ) external override nonReentrant returns (uint256) {\\r\\n        accrueInterest();\\r\\n        // _setReserveFactorFresh emits reserve-factor-specific logs on errors, so we don't need to.\\r\\n        return _setReserveFactorFresh(newReserveFactorMantissa);\\r\\n    }\\r\\n\\r\\n    /**\\r\\n     * @notice Sets a new reserve factor for the protocol (*requires fresh interest accrual)\\r\\n     * @dev Admin function to set a new reserve factor\\r\\n     * @return uint 0=success, otherwise a failure (see ErrorReporter.sol for details)\\r\\n     */\\r\\n    function _setReserveFactorFresh(\\r\\n        uint256 newReserveFactorMantissa\\r\\n    ) internal returns (uint256) {\\r\\n        // Check caller is admin\\r\\n        if (msg.sender != admin) {\\r\\n            revert SetReserveFactorAdminCheck();\\r\\n        }\\r\\n\\r\\n        // Verify market's block number equals current block number\\r\\n        if (accrualBlockNumber != getBlockNumber()) {\\r\\n            revert SetReserveFactorFreshCheck();\\r\\n        }\\r\\n\\r\\n        // Check newReserveFactor \\u2264 maxReserveFactor\\r\\n        if (newReserveFactorMantissa > reserveFactorMaxMantissa) {\\r\\n            revert SetReserveFactorBoundsCheck();\\r\\n        }\\r\\n\\r\\n        uint256 oldReserveFactorMantissa = reserveFactorMantissa;\\r\\n        reserveFactorMantissa = newReserveFactorMantissa;\\r\\n\\r\\n        emit NewReserveFactor(\\r\\n            oldReserveFactorMantissa,\\r\\n            newReserveFactorMantissa\\r\\n        );\\r\\n\\r\\n        return NO_ERROR;\\r\\n    }\\r\\n\\r\\n    /**\\r\\n     * @notice Accrues interest and reduces reserves by transferring from msg.sender\\r\\n     * @param addAmount Amount of addition to reserves\\r\\n     * @return uint 0=success, otherwise a failure (see ErrorReporter.sol for details)\\r\\n     */\\r\\n    function _addReservesInternal(\\r\\n        uint256 addAmount\\r\\n    ) internal nonReentrant returns (uint256) {\\r\\n        accrueInterest();\\r\\n\\r\\n        // _addReservesFresh emits reserve-addition-specific logs on errors, so we don't need to.\\r\\n        _addReservesFresh(addAmount);\\r\\n        return NO_ERROR;\\r\\n    }\\r\\n\\r\\n    /**\\r\\n     * @notice Add reserves by transferring from caller\\r\\n     * @dev Requires fresh interest accrual\\r\\n     * @param addAmount Amount of addition to reserves\\r\\n     * @return (uint, uint) An error code (0=success, otherwise a failure (see ErrorReporter.sol for details)) and the actual amount added, net token fees\\r\\n     */\\r\\n    function _addReservesFresh(\\r\\n        uint256 addAmount\\r\\n    ) internal returns (uint256, uint256) {\\r\\n        // totalReserves + actualAddAmount\\r\\n        uint256 totalReservesNew;\\r\\n        uint256 actualAddAmount;\\r\\n\\r\\n        // We fail gracefully unless market's block number equals current block number\\r\\n        if (accrualBlockNumber != getBlockNumber()) {\\r\\n            revert AddReservesFactorFreshCheck(actualAddAmount);\\r\\n        }\\r\\n\\r\\n        /////////////////////////\\r\\n        // EFFECTS & INTERACTIONS\\r\\n        // (No safe failures beyond this point)\\r\\n\\r\\n        /*\\r\\n         * We call doTransferIn for the caller and the addAmount\\r\\n         *  Note: The cToken must handle variations between ERC-20 and ETH underlying.\\r\\n         *  On success, the cToken holds an additional addAmount of cash.\\r\\n         *  doTransferIn reverts if anything goes wrong, since we can't be sure if side effects occurred.\\r\\n         *  it returns the amount actually transferred, in case of a fee.\\r\\n         */\\r\\n\\r\\n        actualAddAmount = doTransferIn(msg.sender, addAmount);\\r\\n\\r\\n        totalReservesNew = totalReserves + actualAddAmount;\\r\\n\\r\\n        // Store reserves[n+1] = reserves[n] + actualAddAmount\\r\\n        totalReserves = totalReservesNew;\\r\\n\\r\\n        /* Emit NewReserves(admin, actualAddAmount, reserves[n+1]) */\\r\\n        emit ReservesAdded(msg.sender, actualAddAmount, totalReservesNew);\\r\\n\\r\\n        /* Return (NO_ERROR, actualAddAmount) */\\r\\n        return (NO_ERROR, actualAddAmount);\\r\\n    }\\r\\n\\r\\n    /**\\r\\n     * @notice Admin function to set new reserve guardian\\r\\n     * @param newReserveGuardian New reserve guardian address\\r\\n     * @return uint 0=success, otherwise a failure (see ErrorReporter.sol for details)\\r\\n     */\\r\\n    function _setReserveGuardian(\\r\\n        address payable newReserveGuardian\\r\\n    ) external returns (uint256) {\\r\\n        // Check caller is admin\\r\\n        if (msg.sender != admin) {\\r\\n            revert SetReserveGuardianOwnerCheck();\\r\\n        }\\r\\n\\r\\n        // Save current value, if any, for inclusion in log\\r\\n        address oldReserveGuardian = reserveGuardian;\\r\\n\\r\\n        // Set market's reserveGuardian to newReserveGuardian\\r\\n        reserveGuardian = newReserveGuardian;\\r\\n\\r\\n        emit NewReserveGuardian(oldReserveGuardian, newReserveGuardian);\\r\\n\\r\\n        return NO_ERROR;\\r\\n    }\\r\\n\\r\\n    /**\\r\\n     * @notice Accrues interest and reduces reserves by transferring to admin\\r\\n     * @param reduceAmount Amount of reduction to reserves\\r\\n     * @return uint 0=success, otherwise a failure (see ErrorReporter.sol for details)\\r\\n     */\\r\\n    function _reduceReserves(\\r\\n        uint256 reduceAmount\\r\\n    ) external override nonReentrant returns (uint256) {\\r\\n        accrueInterest();\\r\\n        // _reduceReservesFresh emits reserve-reduction-specific logs on errors, so we don't need to.\\r\\n        return _reduceReservesFresh(reduceAmount);\\r\\n    }\\r\\n\\r\\n    /**\\r\\n     * @notice Reduces reserves by transferring to admin\\r\\n     * @dev Requires fresh interest accrual\\r\\n     * @param reduceAmount Amount of reduction to reserves\\r\\n     * @return uint 0=success, otherwise a failure (see ErrorReporter.sol for details)\\r\\n     */\\r\\n    function _reduceReservesFresh(\\r\\n        uint256 reduceAmount\\r\\n    ) internal returns (uint256) {\\r\\n        // totalReserves - reduceAmount\\r\\n        uint256 totalReservesNew;\\r\\n\\r\\n        // Check caller is admin\\r\\n        // TODO: Fix\\r\\n        if (msg.sender != admin && msg.sender != reserveGuardian) {\\r\\n            revert ReduceReservesAdminCheck();\\r\\n        }\\r\\n\\r\\n        // We fail gracefully unless market's block number equals current block number\\r\\n        if (accrualBlockNumber != getBlockNumber()) {\\r\\n            revert ReduceReservesFreshCheck();\\r\\n        }\\r\\n\\r\\n        // Fail gracefully if protocol has insufficient underlying cash\\r\\n        if (getCashPrior() < reduceAmount) {\\r\\n            revert ReduceReservesCashNotAvailable();\\r\\n        }\\r\\n\\r\\n        // Check reduceAmount \\u2264 reserves[n] (totalReserves)\\r\\n        if (reduceAmount > totalReserves) {\\r\\n            revert ReduceReservesCashValidation();\\r\\n        }\\r\\n\\r\\n        /////////////////////////\\r\\n        // EFFECTS & INTERACTIONS\\r\\n        // (No safe failures beyond this point)\\r\\n\\r\\n        totalReservesNew = totalReserves - reduceAmount;\\r\\n\\r\\n        // Store reserves[n+1] = reserves[n] - reduceAmount\\r\\n        totalReserves = totalReservesNew;\\r\\n\\r\\n        // doTransferOut reverts if anything goes wrong, since we can't be sure if side effects occurred.\\r\\n        doTransferOut(payable(msg.sender), reduceAmount);\\r\\n\\r\\n        emit ReservesReduced(admin, reduceAmount, totalReservesNew);\\r\\n\\r\\n        return NO_ERROR;\\r\\n    }\\r\\n\\r\\n    /**\\r\\n     * @notice accrues interest and updates the interest rate model using _setInterestRateModelFresh\\r\\n     * @dev Admin function to accrue interest and update the interest rate model\\r\\n     * @param newInterestRateModel the new interest rate model to use\\r\\n     * @return uint 0=success, otherwise a failure (see ErrorReporter.sol for details)\\r\\n     */\\r\\n    function _setInterestRateModel(\\r\\n        InterestRateModel newInterestRateModel\\r\\n    ) public override returns (uint256) {\\r\\n        accrueInterest();\\r\\n        // _setInterestRateModelFresh emits interest-rate-model-update-specific logs on errors, so we don't need to.\\r\\n        return _setInterestRateModelFresh(newInterestRateModel);\\r\\n    }\\r\\n\\r\\n    /**\\r\\n     * @notice updates the interest rate model (*requires fresh interest accrual)\\r\\n     * @dev Admin function to update the interest rate model\\r\\n     * @param newInterestRateModel the new interest rate model to use\\r\\n     * @return uint 0=success, otherwise a failure (see ErrorReporter.sol for details)\\r\\n     */\\r\\n    function _setInterestRateModelFresh(\\r\\n        InterestRateModel newInterestRateModel\\r\\n    ) internal returns (uint256) {\\r\\n        // Used to store old model for use in the event that is emitted on success\\r\\n        InterestRateModel oldInterestRateModel;\\r\\n\\r\\n        // Check caller is admin\\r\\n        if (msg.sender != admin) {\\r\\n            revert SetInterestRateModelOwnerCheck();\\r\\n        }\\r\\n\\r\\n        // We fail gracefully unless market's block number equals current block number\\r\\n        if (accrualBlockNumber != getBlockNumber()) {\\r\\n            revert SetInterestRateModelFreshCheck();\\r\\n        }\\r\\n\\r\\n        // Track the market's current interest rate model\\r\\n        oldInterestRateModel = interestRateModel;\\r\\n\\r\\n        // Ensure invoke newInterestRateModel.isInterestRateModel() returns true\\r\\n        require(\\r\\n            newInterestRateModel.isInterestRateModel(),\\r\\n            \\\"marker method returned false\\\"\\r\\n        );\\r\\n\\r\\n        // Set the interest rate model to newInterestRateModel\\r\\n        interestRateModel = newInterestRateModel;\\r\\n\\r\\n        // Emit NewMarketInterestRateModel(oldInterestRateModel, newInterestRateModel)\\r\\n        emit NewMarketInterestRateModel(\\r\\n            oldInterestRateModel,\\r\\n            newInterestRateModel\\r\\n        );\\r\\n\\r\\n        return NO_ERROR;\\r\\n    }\\r\\n\\r\\n    /*** Safe Token ***/\\r\\n\\r\\n    /**\\r\\n     * @notice Gets balance of this contract in terms of the underlying\\r\\n     * @dev This excludes the value of the current message, if any\\r\\n     * @return The quantity of underlying owned by this contract\\r\\n     */\\r\\n    function getCashPrior() internal view virtual returns (uint256);\\r\\n\\r\\n    /**\\r\\n     * @dev Performs a transfer in, reverting upon failure. Returns the amount actually transferred to the protocol, in case of a fee.\\r\\n     *  This may revert due to insufficient balance or insufficient allowance.\\r\\n     */\\r\\n    function doTransferIn(\\r\\n        address from,\\r\\n        uint256 amount\\r\\n    ) internal virtual returns (uint256);\\r\\n\\r\\n    /**\\r\\n     * @dev Performs a transfer out, ideally returning an explanatory error code upon failure rather than reverting.\\r\\n     *  If caller has not called checked protocol's balance, may revert due to insufficient cash held in the contract.\\r\\n     *  If caller has checked protocol's balance, and verified it is >= amount, this should not revert in normal conditions.\\r\\n     */\\r\\n    function doTransferOut(address payable to, uint256 amount) internal virtual;\\r\\n\\r\\n    /*** Reentrancy Guard ***/\\r\\n\\r\\n    /**\\r\\n     * @dev Prevents a contract from calling itself, directly or indirectly.\\r\\n     */\\r\\n    modifier nonReentrant() {\\r\\n        require(_notEntered, \\\"re-entered\\\");\\r\\n        _notEntered = false;\\r\\n        _;\\r\\n        _notEntered = true; // get a gas-refund post-Istanbul\\r\\n    }\\r\\n}\\r\\n\",\"keccak256\":\"0x5e1c0d9425ff424f90cf68ebbc4ab38b28fff477f5032a4e4b09d85fb444f75e\",\"license\":\"BSD-3-Clause\"},\"contracts/CTokenInterfaces.sol\":{\"content\":\"// SPDX-License-Identifier: BSD-3-Clause\\r\\npragma solidity ^0.8.10;\\r\\n\\r\\nimport \\\"./ComptrollerInterface.sol\\\";\\r\\nimport \\\"./InterestRateModel.sol\\\";\\r\\nimport \\\"./EIP20NonStandardInterface.sol\\\";\\r\\nimport \\\"./ErrorReporter.sol\\\";\\r\\n\\r\\ncontract CTokenStorage {\\r\\n    /**\\r\\n     * @dev Guard variable for re-entrancy checks\\r\\n     */\\r\\n    bool internal _notEntered;\\r\\n\\r\\n    /**\\r\\n     * @notice EIP-20 token name for this token\\r\\n     */\\r\\n    string public name;\\r\\n\\r\\n    /**\\r\\n     * @notice EIP-20 token symbol for this token\\r\\n     */\\r\\n    string public symbol;\\r\\n\\r\\n    /**\\r\\n     * @notice EIP-20 token decimals for this token\\r\\n     */\\r\\n    uint8 public decimals;\\r\\n\\r\\n    // Maximum borrow rate that can ever be applied (.0005% / block)\\r\\n    uint internal constant borrowRateMaxMantissa = 0.00004e16;\\r\\n\\r\\n    // Maximum fraction of interest that can be set aside for reserves\\r\\n    uint internal constant reserveFactorMaxMantissa = 1e18;\\r\\n\\r\\n    /**\\r\\n     * @notice Administrator for this contract\\r\\n     */\\r\\n    address payable public admin;\\r\\n\\r\\n    /**\\r\\n     * @notice Pending administrator for this contract\\r\\n     */\\r\\n    address payable public pendingAdmin;\\r\\n\\r\\n    /**\\r\\n     * @notice Contract which oversees inter-cToken operations\\r\\n     */\\r\\n    ComptrollerInterface public comptroller;\\r\\n\\r\\n    /**\\r\\n     * @notice Model which tells what the current interest rate should be\\r\\n     */\\r\\n    InterestRateModel public interestRateModel;\\r\\n\\r\\n    // Initial exchange rate used when minting the first CTokens (used when totalSupply = 0)\\r\\n    uint internal initialExchangeRateMantissa;\\r\\n\\r\\n    /**\\r\\n     * @notice Fraction of interest currently set aside for reserves\\r\\n     */\\r\\n    uint public reserveFactorMantissa;\\r\\n\\r\\n    /**\\r\\n     * @notice Block number that interest was last accrued at\\r\\n     */\\r\\n    uint public accrualBlockNumber;\\r\\n\\r\\n    /**\\r\\n     * @notice Accumulator of the total earned interest rate since the opening of the market\\r\\n     */\\r\\n    uint public borrowIndex;\\r\\n\\r\\n    /**\\r\\n     * @notice Total amount of outstanding borrows of the underlying in this market\\r\\n     */\\r\\n    uint public totalBorrows;\\r\\n\\r\\n    /**\\r\\n     * @notice Total amount of reserves of the underlying held in this market\\r\\n     */\\r\\n    uint public totalReserves;\\r\\n\\r\\n    /**\\r\\n     * @notice Total number of tokens in circulation\\r\\n     */\\r\\n    uint public totalSupply;\\r\\n\\r\\n    // Official record of token balances for each account\\r\\n    mapping(address => uint) internal accountTokens;\\r\\n\\r\\n    // Approved token transfer amounts on behalf of others\\r\\n    mapping(address => mapping(address => uint)) internal transferAllowances;\\r\\n\\r\\n    /**\\r\\n     * @notice Container for borrow balance information\\r\\n     * @member principal Total balance (with accrued interest), after applying the most recent balance-changing action\\r\\n     * @member interestIndex Global borrowIndex as of the most recent balance-changing action\\r\\n     */\\r\\n    struct BorrowSnapshot {\\r\\n        uint principal;\\r\\n        uint interestIndex;\\r\\n    }\\r\\n\\r\\n    // Mapping of account addresses to outstanding borrow balances\\r\\n    mapping(address => BorrowSnapshot) internal accountBorrows;\\r\\n\\r\\n    /**\\r\\n     * @notice Share of seized collateral that is added to reserves\\r\\n     */\\r\\n    uint public constant protocolSeizeShareMantissa = 2.8e16; //2.8%\\r\\n\\r\\n    /**\\r\\n     * @notice The reserve guardian can reduce the reserves of the market\\r\\n     */\\r\\n    address payable public reserveGuardian;\\r\\n}\\r\\n\\r\\nabstract contract CTokenInterface is CTokenStorage {\\r\\n    /**\\r\\n     * @notice Indicator that this is a CToken contract (for inspection)\\r\\n     */\\r\\n    bool public constant isCToken = true;\\r\\n\\r\\n    /*** Market Events ***/\\r\\n\\r\\n    /**\\r\\n     * @notice Event emitted when interest is accrued\\r\\n     */\\r\\n    event AccrueInterest(\\r\\n        uint cashPrior,\\r\\n        uint interestAccumulated,\\r\\n        uint borrowIndex,\\r\\n        uint totalBorrows\\r\\n    );\\r\\n\\r\\n    /**\\r\\n     * @notice Event emitted when tokens are minted\\r\\n     */\\r\\n    event Mint(address minter, uint mintAmount, uint mintTokens);\\r\\n\\r\\n    /**\\r\\n     * @notice Event emitted when tokens are redeemed\\r\\n     */\\r\\n    event Redeem(address redeemer, uint redeemAmount, uint redeemTokens);\\r\\n\\r\\n    /**\\r\\n     * @notice Event emitted when underlying is borrowed\\r\\n     */\\r\\n    event Borrow(\\r\\n        address borrower,\\r\\n        uint borrowAmount,\\r\\n        uint accountBorrows,\\r\\n        uint totalBorrows\\r\\n    );\\r\\n\\r\\n    /**\\r\\n     * @notice Event emitted when a borrow is repaid\\r\\n     */\\r\\n    event RepayBorrow(\\r\\n        address payer,\\r\\n        address borrower,\\r\\n        uint repayAmount,\\r\\n        uint accountBorrows,\\r\\n        uint totalBorrows\\r\\n    );\\r\\n\\r\\n    /**\\r\\n     * @notice Event emitted when a borrow is liquidated\\r\\n     */\\r\\n    event LiquidateBorrow(\\r\\n        address liquidator,\\r\\n        address borrower,\\r\\n        uint repayAmount,\\r\\n        address cTokenCollateral,\\r\\n        uint seizeTokens\\r\\n    );\\r\\n\\r\\n    /*** Admin Events ***/\\r\\n\\r\\n    /**\\r\\n     * @notice Event emitted when pendingAdmin is changed\\r\\n     */\\r\\n    event NewPendingAdmin(address oldPendingAdmin, address newPendingAdmin);\\r\\n\\r\\n    /**\\r\\n     * @notice Event emitted when pendingAdmin is accepted, which means admin is updated\\r\\n     */\\r\\n    event NewAdmin(address oldAdmin, address newAdmin);\\r\\n\\r\\n    /**\\r\\n     * @notice Event emitted when comptroller is changed\\r\\n     */\\r\\n    event NewComptroller(\\r\\n        ComptrollerInterface oldComptroller,\\r\\n        ComptrollerInterface newComptroller\\r\\n    );\\r\\n\\r\\n    /**\\r\\n     * @notice Event emitted when reserve guardian is changed\\r\\n     */\\r\\n    event NewReserveGuardian(\\r\\n        address oldReserveGuardian,\\r\\n        address newReserveGuardian\\r\\n    );\\r\\n\\r\\n    /**\\r\\n     * @notice Event emitted when interestRateModel is changed\\r\\n     */\\r\\n    event NewMarketInterestRateModel(\\r\\n        InterestRateModel oldInterestRateModel,\\r\\n        InterestRateModel newInterestRateModel\\r\\n    );\\r\\n\\r\\n    /**\\r\\n     * @notice Event emitted when the reserve factor is changed\\r\\n     */\\r\\n    event NewReserveFactor(\\r\\n        uint oldReserveFactorMantissa,\\r\\n        uint newReserveFactorMantissa\\r\\n    );\\r\\n\\r\\n    /**\\r\\n     * @notice Event emitted when the reserves are added\\r\\n     */\\r\\n    event ReservesAdded(\\r\\n        address benefactor,\\r\\n        uint addAmount,\\r\\n        uint newTotalReserves\\r\\n    );\\r\\n\\r\\n    /**\\r\\n     * @notice Event emitted when the reserves are reduced\\r\\n     */\\r\\n    event ReservesReduced(\\r\\n        address admin,\\r\\n        uint reduceAmount,\\r\\n        uint newTotalReserves\\r\\n    );\\r\\n\\r\\n    /**\\r\\n     * @notice EIP20 Transfer event\\r\\n     */\\r\\n    event Transfer(address indexed from, address indexed to, uint amount);\\r\\n\\r\\n    /**\\r\\n     * @notice EIP20 Approval event\\r\\n     */\\r\\n    event Approval(address indexed owner, address indexed spender, uint amount);\\r\\n\\r\\n    /*** User Interface ***/\\r\\n\\r\\n    function transfer(address dst, uint amount) external virtual returns (bool);\\r\\n\\r\\n    function transferFrom(\\r\\n        address src,\\r\\n        address dst,\\r\\n        uint amount\\r\\n    ) external virtual returns (bool);\\r\\n\\r\\n    function approve(\\r\\n        address spender,\\r\\n        uint amount\\r\\n    ) external virtual returns (bool);\\r\\n\\r\\n    function allowance(\\r\\n        address owner,\\r\\n        address spender\\r\\n    ) external view virtual returns (uint);\\r\\n\\r\\n    function balanceOf(address owner) external view virtual returns (uint);\\r\\n\\r\\n    function balanceOfUnderlying(address owner) external virtual returns (uint);\\r\\n\\r\\n    function getAccountSnapshot(\\r\\n        address account\\r\\n    ) external view virtual returns (uint, uint, uint, uint);\\r\\n\\r\\n    function borrowRatePerBlock() external view virtual returns (uint);\\r\\n\\r\\n    function supplyRatePerBlock() external view virtual returns (uint);\\r\\n\\r\\n    function totalBorrowsCurrent() external virtual returns (uint);\\r\\n\\r\\n    function borrowBalanceCurrent(\\r\\n        address account\\r\\n    ) external virtual returns (uint);\\r\\n\\r\\n    function borrowBalanceStored(\\r\\n        address account\\r\\n    ) external view virtual returns (uint);\\r\\n\\r\\n    function exchangeRateCurrent() external virtual returns (uint);\\r\\n\\r\\n    function exchangeRateStored() external view virtual returns (uint);\\r\\n\\r\\n    function getCash() external view virtual returns (uint);\\r\\n\\r\\n    function accrueInterest() external virtual returns (uint);\\r\\n\\r\\n    function seize(\\r\\n        address liquidator,\\r\\n        address borrower,\\r\\n        uint seizeTokens\\r\\n    ) external virtual returns (uint);\\r\\n\\r\\n    /*** Admin Functions ***/\\r\\n\\r\\n    function _setPendingAdmin(\\r\\n        address payable newPendingAdmin\\r\\n    ) external virtual returns (uint);\\r\\n\\r\\n    function _acceptAdmin() external virtual returns (uint);\\r\\n\\r\\n    function _setComptroller(\\r\\n        ComptrollerInterface newComptroller\\r\\n    ) external virtual returns (uint);\\r\\n\\r\\n    function _setReserveFactor(\\r\\n        uint newReserveFactorMantissa\\r\\n    ) external virtual returns (uint);\\r\\n\\r\\n    function _reduceReserves(uint reduceAmount) external virtual returns (uint);\\r\\n\\r\\n    function _setInterestRateModel(\\r\\n        InterestRateModel newInterestRateModel\\r\\n    ) external virtual returns (uint);\\r\\n}\\r\\n\\r\\ncontract CErc20Storage {\\r\\n    /**\\r\\n     * @notice Underlying asset for this CToken\\r\\n     */\\r\\n    address public underlying;\\r\\n}\\r\\n\\r\\nabstract contract CErc20Interface is CErc20Storage {\\r\\n    /*** User Interface ***/\\r\\n\\r\\n    function mint(uint mintAmount) external virtual returns (uint);\\r\\n\\r\\n    function redeem(uint redeemTokens) external virtual returns (uint);\\r\\n\\r\\n    function redeemUnderlying(\\r\\n        uint redeemAmount\\r\\n    ) external virtual returns (uint);\\r\\n\\r\\n    function borrow(uint borrowAmount) external virtual returns (uint);\\r\\n\\r\\n    function repayBorrow(uint repayAmount) external virtual returns (uint);\\r\\n\\r\\n    function repayBorrowBehalf(\\r\\n        address borrower,\\r\\n        uint repayAmount\\r\\n    ) external virtual returns (uint);\\r\\n\\r\\n    function liquidateBorrow(\\r\\n        address borrower,\\r\\n        uint repayAmount,\\r\\n        CTokenInterface cTokenCollateral\\r\\n    ) external virtual returns (uint);\\r\\n\\r\\n    function sweepToken(EIP20NonStandardInterface token) external virtual;\\r\\n\\r\\n    /*** Admin Functions ***/\\r\\n\\r\\n    function _addReserves(uint addAmount) external virtual returns (uint);\\r\\n}\\r\\n\\r\\ncontract CDelegationStorage {\\r\\n    /**\\r\\n     * @notice Implementation address for this contract\\r\\n     */\\r\\n    address public implementation;\\r\\n}\\r\\n\\r\\nabstract contract CDelegatorInterface is CDelegationStorage {\\r\\n    /**\\r\\n     * @notice Emitted when implementation is changed\\r\\n     */\\r\\n    event NewImplementation(\\r\\n        address oldImplementation,\\r\\n        address newImplementation\\r\\n    );\\r\\n\\r\\n    /**\\r\\n     * @notice Called by the admin to update the implementation of the delegator\\r\\n     * @param implementation_ The address of the new implementation for delegation\\r\\n     * @param allowResign Flag to indicate whether to call _resignImplementation on the old implementation\\r\\n     * @param becomeImplementationData The encoded bytes data to be passed to _becomeImplementation\\r\\n     */\\r\\n    function _setImplementation(\\r\\n        address implementation_,\\r\\n        bool allowResign,\\r\\n        bytes memory becomeImplementationData\\r\\n    ) external virtual;\\r\\n}\\r\\n\\r\\nabstract contract CDelegateInterface is CDelegationStorage {\\r\\n    /**\\r\\n     * @notice Called by the delegator on a delegate to initialize it for duty\\r\\n     * @dev Should revert if any issues arise which make it unfit for delegation\\r\\n     * @param data The encoded bytes data for any initialization\\r\\n     */\\r\\n    function _becomeImplementation(bytes memory data) external virtual;\\r\\n\\r\\n    /**\\r\\n     * @notice Called by the delegator on a delegate to forfeit its responsibility\\r\\n     */\\r\\n    function _resignImplementation() external virtual;\\r\\n}\\r\\n\",\"keccak256\":\"0xcdc39e3b76f17de5b2cbe542dcf49693839dad0806815d19d69699f55dbc8445\",\"license\":\"BSD-3-Clause\"},\"contracts/ComptrollerInterface.sol\":{\"content\":\"// SPDX-License-Identifier: BSD-3-Clause\\r\\npragma solidity ^0.8.10;\\r\\n\\r\\nabstract contract ComptrollerInterface {\\r\\n    /// @notice Indicator that this is a Comptroller contract (for inspection)\\r\\n    bool public constant isComptroller = true;\\r\\n\\r\\n    /*** Assets You Are In ***/\\r\\n\\r\\n    function enterMarkets(\\r\\n        address[] calldata cTokens\\r\\n    ) external virtual returns (uint[] memory);\\r\\n\\r\\n    function exitMarket(address cToken) external virtual returns (uint);\\r\\n\\r\\n    /*** Policy Hooks ***/\\r\\n\\r\\n    function mintAllowed(\\r\\n        address cToken,\\r\\n        address minter,\\r\\n        uint mintAmount\\r\\n    ) external virtual returns (uint);\\r\\n\\r\\n    function mintVerify(\\r\\n        address cToken,\\r\\n        address minter,\\r\\n        uint mintAmount,\\r\\n        uint mintTokens\\r\\n    ) external virtual;\\r\\n\\r\\n    function redeemAllowed(\\r\\n        address cToken,\\r\\n        address redeemer,\\r\\n        uint redeemTokens\\r\\n    ) external virtual returns (uint);\\r\\n\\r\\n    function redeemVerify(\\r\\n        address cToken,\\r\\n        address redeemer,\\r\\n        uint redeemAmount,\\r\\n        uint redeemTokens\\r\\n    ) external virtual;\\r\\n\\r\\n    function borrowAllowed(\\r\\n        address cToken,\\r\\n        address borrower,\\r\\n        uint borrowAmount\\r\\n    ) external virtual returns (uint);\\r\\n\\r\\n    function borrowVerify(\\r\\n        address cToken,\\r\\n        address borrower,\\r\\n        uint borrowAmount\\r\\n    ) external virtual;\\r\\n\\r\\n    function repayBorrowAllowed(\\r\\n        address cToken,\\r\\n        address payer,\\r\\n        address borrower,\\r\\n        uint repayAmount\\r\\n    ) external virtual returns (uint);\\r\\n\\r\\n    function repayBorrowVerify(\\r\\n        address cToken,\\r\\n        address payer,\\r\\n        address borrower,\\r\\n        uint repayAmount,\\r\\n        uint borrowerIndex\\r\\n    ) external virtual;\\r\\n\\r\\n    function liquidateBorrowAllowed(\\r\\n        address cTokenBorrowed,\\r\\n        address cTokenCollateral,\\r\\n        address liquidator,\\r\\n        address borrower,\\r\\n        uint repayAmount\\r\\n    ) external virtual returns (uint);\\r\\n\\r\\n    function liquidateBorrowVerify(\\r\\n        address cTokenBorrowed,\\r\\n        address cTokenCollateral,\\r\\n        address liquidator,\\r\\n        address borrower,\\r\\n        uint repayAmount,\\r\\n        uint seizeTokens\\r\\n    ) external virtual;\\r\\n\\r\\n    function seizeAllowed(\\r\\n        address cTokenCollateral,\\r\\n        address cTokenBorrowed,\\r\\n        address liquidator,\\r\\n        address borrower,\\r\\n        uint seizeTokens\\r\\n    ) external virtual returns (uint);\\r\\n\\r\\n    function seizeVerify(\\r\\n        address cTokenCollateral,\\r\\n        address cTokenBorrowed,\\r\\n        address liquidator,\\r\\n        address borrower,\\r\\n        uint seizeTokens\\r\\n    ) external virtual;\\r\\n\\r\\n    function transferAllowed(\\r\\n        address cToken,\\r\\n        address src,\\r\\n        address dst,\\r\\n        uint transferTokens\\r\\n    ) external virtual returns (uint);\\r\\n\\r\\n    function transferVerify(\\r\\n        address cToken,\\r\\n        address src,\\r\\n        address dst,\\r\\n        uint transferTokens\\r\\n    ) external virtual;\\r\\n\\r\\n    /*** Liquidity/Liquidation Calculations ***/\\r\\n\\r\\n    function liquidateCalculateSeizeTokens(\\r\\n        address cTokenBorrowed,\\r\\n        address cTokenCollateral,\\r\\n        uint repayAmount\\r\\n    ) external view virtual returns (uint, uint);\\r\\n}\\r\\n\",\"keccak256\":\"0xdafdd1529146620d7c2d407e7940b7533a1ba241e8d4546b481aef311079ef38\",\"license\":\"BSD-3-Clause\"},\"contracts/EIP20Interface.sol\":{\"content\":\"// SPDX-License-Identifier: BSD-3-Clause\\r\\npragma solidity ^0.8.10;\\r\\n\\r\\n/**\\r\\n * @title ERC 20 Token Standard Interface\\r\\n *  https://eips.ethereum.org/EIPS/eip-20\\r\\n */\\r\\ninterface EIP20Interface {\\r\\n    function name() external view returns (string memory);\\r\\n\\r\\n    function symbol() external view returns (string memory);\\r\\n\\r\\n    function decimals() external view returns (uint8);\\r\\n\\r\\n    /**\\r\\n     * @notice Get the total number of tokens in circulation\\r\\n     * @return The supply of tokens\\r\\n     */\\r\\n    function totalSupply() external view returns (uint256);\\r\\n\\r\\n    /**\\r\\n     * @notice Gets the balance of the specified address\\r\\n     * @param owner The address from which the balance will be retrieved\\r\\n     * @return balance The balance\\r\\n     */\\r\\n    function balanceOf(address owner) external view returns (uint256 balance);\\r\\n\\r\\n    /**\\r\\n     * @notice Transfer `amount` tokens from `msg.sender` to `dst`\\r\\n     * @param dst The address of the destination account\\r\\n     * @param amount The number of tokens to transfer\\r\\n     * @return success Whether or not the transfer succeeded\\r\\n     */\\r\\n    function transfer(\\r\\n        address dst,\\r\\n        uint256 amount\\r\\n    ) external returns (bool success);\\r\\n\\r\\n    /**\\r\\n     * @notice Transfer `amount` tokens from `src` to `dst`\\r\\n     * @param src The address of the source account\\r\\n     * @param dst The address of the destination account\\r\\n     * @param amount The number of tokens to transfer\\r\\n     * @return success Whether or not the transfer succeeded\\r\\n     */\\r\\n    function transferFrom(\\r\\n        address src,\\r\\n        address dst,\\r\\n        uint256 amount\\r\\n    ) external returns (bool success);\\r\\n\\r\\n    /**\\r\\n     * @notice Approve `spender` to transfer up to `amount` from `src`\\r\\n     * @dev This will overwrite the approval amount for `spender`\\r\\n     *  and is subject to issues noted [here](https://eips.ethereum.org/EIPS/eip-20#approve)\\r\\n     * @param spender The address of the account which may transfer tokens\\r\\n     * @param amount The number of tokens that are approved (-1 means infinite)\\r\\n     * @return success Whether or not the approval succeeded\\r\\n     */\\r\\n    function approve(\\r\\n        address spender,\\r\\n        uint256 amount\\r\\n    ) external returns (bool success);\\r\\n\\r\\n    /**\\r\\n     * @notice Get the current allowance from `owner` for `spender`\\r\\n     * @param owner The address of the account which owns the tokens to be spent\\r\\n     * @param spender The address of the account which may transfer tokens\\r\\n     * @return remaining The number of tokens allowed to be spent (-1 means infinite)\\r\\n     */\\r\\n    function allowance(\\r\\n        address owner,\\r\\n        address spender\\r\\n    ) external view returns (uint256 remaining);\\r\\n\\r\\n    event Transfer(address indexed from, address indexed to, uint256 amount);\\r\\n    event Approval(\\r\\n        address indexed owner,\\r\\n        address indexed spender,\\r\\n        uint256 amount\\r\\n    );\\r\\n}\\r\\n\",\"keccak256\":\"0x0962c83cbc826ed86136fc3c396e4dc069d9dfa4a4228d2b040e87b7e35fffee\",\"license\":\"BSD-3-Clause\"},\"contracts/EIP20NonStandardInterface.sol\":{\"content\":\"// SPDX-License-Identifier: BSD-3-Clause\\r\\npragma solidity ^0.8.10;\\r\\n\\r\\n/**\\r\\n * @title EIP20NonStandardInterface\\r\\n * @dev Version of ERC20 with no return values for `transfer` and `transferFrom`\\r\\n *  See https://medium.com/coinmonks/missing-return-value-bug-at-least-130-tokens-affected-d67bf08521ca\\r\\n */\\r\\ninterface EIP20NonStandardInterface {\\r\\n    /**\\r\\n     * @notice Get the total number of tokens in circulation\\r\\n     * @return The supply of tokens\\r\\n     */\\r\\n    function totalSupply() external view returns (uint256);\\r\\n\\r\\n    /**\\r\\n     * @notice Gets the balance of the specified address\\r\\n     * @param owner The address from which the balance will be retrieved\\r\\n     * @return balance The balance\\r\\n     */\\r\\n    function balanceOf(address owner) external view returns (uint256 balance);\\r\\n\\r\\n    ///\\r\\n    /// !!!!!!!!!!!!!!\\r\\n    /// !!! NOTICE !!! `transfer` does not return a value, in violation of the ERC-20 specification\\r\\n    /// !!!!!!!!!!!!!!\\r\\n    ///\\r\\n\\r\\n    /**\\r\\n     * @notice Transfer `amount` tokens from `msg.sender` to `dst`\\r\\n     * @param dst The address of the destination account\\r\\n     * @param amount The number of tokens to transfer\\r\\n     */\\r\\n    function transfer(address dst, uint256 amount) external;\\r\\n\\r\\n    ///\\r\\n    /// !!!!!!!!!!!!!!\\r\\n    /// !!! NOTICE !!! `transferFrom` does not return a value, in violation of the ERC-20 specification\\r\\n    /// !!!!!!!!!!!!!!\\r\\n    ///\\r\\n\\r\\n    /**\\r\\n     * @notice Transfer `amount` tokens from `src` to `dst`\\r\\n     * @param src The address of the source account\\r\\n     * @param dst The address of the destination account\\r\\n     * @param amount The number of tokens to transfer\\r\\n     */\\r\\n    function transferFrom(address src, address dst, uint256 amount) external;\\r\\n\\r\\n    /**\\r\\n     * @notice Approve `spender` to transfer up to `amount` from `src`\\r\\n     * @dev This will overwrite the approval amount for `spender`\\r\\n     *  and is subject to issues noted [here](https://eips.ethereum.org/EIPS/eip-20#approve)\\r\\n     * @param spender The address of the account which may transfer tokens\\r\\n     * @param amount The number of tokens that are approved\\r\\n     * @return success Whether or not the approval succeeded\\r\\n     */\\r\\n    function approve(\\r\\n        address spender,\\r\\n        uint256 amount\\r\\n    ) external returns (bool success);\\r\\n\\r\\n    /**\\r\\n     * @notice Get the current allowance from `owner` for `spender`\\r\\n     * @param owner The address of the account which owns the tokens to be spent\\r\\n     * @param spender The address of the account which may transfer tokens\\r\\n     * @return remaining The number of tokens allowed to be spent\\r\\n     */\\r\\n    function allowance(\\r\\n        address owner,\\r\\n        address spender\\r\\n    ) external view returns (uint256 remaining);\\r\\n\\r\\n    event Transfer(address indexed from, address indexed to, uint256 amount);\\r\\n    event Approval(\\r\\n        address indexed owner,\\r\\n        address indexed spender,\\r\\n        uint256 amount\\r\\n    );\\r\\n}\\r\\n\",\"keccak256\":\"0x9482f5bdd98c5e2f0f00af1028223de05a5402fe12b52c036ce5812c87a228b5\",\"license\":\"BSD-3-Clause\"},\"contracts/ErrorReporter.sol\":{\"content\":\"// SPDX-License-Identifier: BSD-3-Clause\\r\\npragma solidity ^0.8.10;\\r\\n\\r\\ncontract ComptrollerErrorReporter {\\r\\n    enum Error {\\r\\n        NO_ERROR,\\r\\n        UNAUTHORIZED,\\r\\n        COMPTROLLER_MISMATCH,\\r\\n        INSUFFICIENT_SHORTFALL,\\r\\n        INSUFFICIENT_LIQUIDITY,\\r\\n        INVALID_CLOSE_FACTOR,\\r\\n        INVALID_COLLATERAL_FACTOR,\\r\\n        INVALID_LIQUIDATION_INCENTIVE,\\r\\n        MARKET_NOT_ENTERED, // no longer possible\\r\\n        MARKET_NOT_LISTED,\\r\\n        MARKET_ALREADY_LISTED,\\r\\n        MATH_ERROR,\\r\\n        NONZERO_BORROW_BALANCE,\\r\\n        PRICE_ERROR,\\r\\n        REJECTION,\\r\\n        SNAPSHOT_ERROR,\\r\\n        TOO_MANY_ASSETS,\\r\\n        TOO_MUCH_REPAY\\r\\n    }\\r\\n\\r\\n    enum FailureInfo {\\r\\n        ACCEPT_ADMIN_PENDING_ADMIN_CHECK,\\r\\n        ACCEPT_PENDING_IMPLEMENTATION_ADDRESS_CHECK,\\r\\n        EXIT_MARKET_BALANCE_OWED,\\r\\n        EXIT_MARKET_REJECTION,\\r\\n        SET_CLOSE_FACTOR_OWNER_CHECK,\\r\\n        SET_CLOSE_FACTOR_VALIDATION,\\r\\n        SET_COLLATERAL_FACTOR_OWNER_CHECK,\\r\\n        SET_COLLATERAL_FACTOR_NO_EXISTS,\\r\\n        SET_COLLATERAL_FACTOR_VALIDATION,\\r\\n        SET_COLLATERAL_FACTOR_WITHOUT_PRICE,\\r\\n        SET_IMPLEMENTATION_OWNER_CHECK,\\r\\n        SET_LIQUIDATION_INCENTIVE_OWNER_CHECK,\\r\\n        SET_LIQUIDATION_INCENTIVE_VALIDATION,\\r\\n        SET_MAX_ASSETS_OWNER_CHECK,\\r\\n        SET_PENDING_ADMIN_OWNER_CHECK,\\r\\n        SET_PENDING_IMPLEMENTATION_OWNER_CHECK,\\r\\n        SET_PRICE_ORACLE_OWNER_CHECK,\\r\\n        SUPPORT_MARKET_EXISTS,\\r\\n        SUPPORT_MARKET_OWNER_CHECK,\\r\\n        SET_PAUSE_GUARDIAN_OWNER_CHECK\\r\\n    }\\r\\n\\r\\n    /**\\r\\n     * @dev `error` corresponds to enum Error; `info` corresponds to enum FailureInfo, and `detail` is an arbitrary\\r\\n     * contract-specific code that enables us to report opaque error codes from upgradeable contracts.\\r\\n     **/\\r\\n    event Failure(uint error, uint info, uint detail);\\r\\n\\r\\n    /**\\r\\n     * @dev use this when reporting a known error from the money market or a non-upgradeable collaborator\\r\\n     */\\r\\n    function fail(Error err, FailureInfo info) internal returns (uint) {\\r\\n        emit Failure(uint(err), uint(info), 0);\\r\\n\\r\\n        return uint(err);\\r\\n    }\\r\\n\\r\\n    /**\\r\\n     * @dev use this when reporting an opaque error from an upgradeable collaborator contract\\r\\n     */\\r\\n    function failOpaque(\\r\\n        Error err,\\r\\n        FailureInfo info,\\r\\n        uint opaqueError\\r\\n    ) internal returns (uint) {\\r\\n        emit Failure(uint(err), uint(info), opaqueError);\\r\\n\\r\\n        return uint(err);\\r\\n    }\\r\\n}\\r\\n\\r\\ncontract TokenErrorReporter {\\r\\n    uint public constant NO_ERROR = 0; // support legacy return codes\\r\\n\\r\\n    error TransferComptrollerRejection(uint256 errorCode);\\r\\n    error TransferNotAllowed();\\r\\n    error TransferNotEnough();\\r\\n    error TransferTooMuch();\\r\\n\\r\\n    error MintComptrollerRejection(uint256 errorCode);\\r\\n    error MintFreshnessCheck();\\r\\n\\r\\n    error RedeemComptrollerRejection(uint256 errorCode);\\r\\n    error RedeemFreshnessCheck();\\r\\n    error RedeemTransferOutNotPossible();\\r\\n\\r\\n    error BorrowComptrollerRejection(uint256 errorCode);\\r\\n    error BorrowFreshnessCheck();\\r\\n    error BorrowCashNotAvailable();\\r\\n\\r\\n    error RepayBorrowComptrollerRejection(uint256 errorCode);\\r\\n    error RepayBorrowFreshnessCheck();\\r\\n\\r\\n    error LiquidateComptrollerRejection(uint256 errorCode);\\r\\n    error LiquidateFreshnessCheck();\\r\\n    error LiquidateCollateralFreshnessCheck();\\r\\n    error LiquidateAccrueBorrowInterestFailed(uint256 errorCode);\\r\\n    error LiquidateAccrueCollateralInterestFailed(uint256 errorCode);\\r\\n    error LiquidateLiquidatorIsBorrower();\\r\\n    error LiquidateCloseAmountIsZero();\\r\\n    error LiquidateCloseAmountIsUintMax();\\r\\n    error LiquidateRepayBorrowFreshFailed(uint256 errorCode);\\r\\n\\r\\n    error LiquidateSeizeComptrollerRejection(uint256 errorCode);\\r\\n    error LiquidateSeizeLiquidatorIsBorrower();\\r\\n\\r\\n    error AcceptAdminPendingAdminCheck();\\r\\n\\r\\n    error SetComptrollerOwnerCheck();\\r\\n    error SetPendingAdminOwnerCheck();\\r\\n\\r\\n    error SetReserveFactorAdminCheck();\\r\\n    error SetReserveFactorFreshCheck();\\r\\n    error SetReserveFactorBoundsCheck();\\r\\n\\r\\n    error AddReservesFactorFreshCheck(uint256 actualAddAmount);\\r\\n\\r\\n    error SetReserveGuardianOwnerCheck();\\r\\n\\r\\n    error ReduceReservesAdminCheck();\\r\\n    error ReduceReservesFreshCheck();\\r\\n    error ReduceReservesCashNotAvailable();\\r\\n    error ReduceReservesCashValidation();\\r\\n\\r\\n    error SetInterestRateModelOwnerCheck();\\r\\n    error SetInterestRateModelFreshCheck();\\r\\n}\\r\\n\",\"keccak256\":\"0x28e6791db03f8002b4e9c948e4a1600a1d03e1bf243aa8a8bdb04a4cb10eefe0\",\"license\":\"BSD-3-Clause\"},\"contracts/ExponentialNoError.sol\":{\"content\":\"// SPDX-License-Identifier: BSD-3-Clause\\r\\npragma solidity ^0.8.10;\\r\\n\\r\\n/**\\r\\n * @title Exponential module for storing fixed-precision decimals\\r\\n * @author Compound\\r\\n * @notice Exp is a struct which stores decimals with a fixed precision of 18 decimal places.\\r\\n *         Thus, if we wanted to store the 5.1, mantissa would store 5.1e18. That is:\\r\\n *         `Exp({mantissa: 5100000000000000000})`.\\r\\n */\\r\\ncontract ExponentialNoError {\\r\\n    uint constant expScale = 1e18;\\r\\n    uint constant doubleScale = 1e36;\\r\\n    uint constant halfExpScale = expScale / 2;\\r\\n    uint constant mantissaOne = expScale;\\r\\n\\r\\n    struct Exp {\\r\\n        uint mantissa;\\r\\n    }\\r\\n\\r\\n    struct Double {\\r\\n        uint mantissa;\\r\\n    }\\r\\n\\r\\n    /**\\r\\n     * @dev Truncates the given exp to a whole number value.\\r\\n     *      For example, truncate(Exp{mantissa: 15 * expScale}) = 15\\r\\n     */\\r\\n    function truncate(Exp memory exp) internal pure returns (uint) {\\r\\n        // Note: We are not using careful math here as we're performing a division that cannot fail\\r\\n        return exp.mantissa / expScale;\\r\\n    }\\r\\n\\r\\n    /**\\r\\n     * @dev Multiply an Exp by a scalar, then truncate to return an unsigned integer.\\r\\n     */\\r\\n    function mul_ScalarTruncate(\\r\\n        Exp memory a,\\r\\n        uint scalar\\r\\n    ) internal pure returns (uint) {\\r\\n        Exp memory product = mul_(a, scalar);\\r\\n        return truncate(product);\\r\\n    }\\r\\n\\r\\n    /**\\r\\n     * @dev Multiply an Exp by a scalar, truncate, then add an to an unsigned integer, returning an unsigned integer.\\r\\n     */\\r\\n    function mul_ScalarTruncateAddUInt(\\r\\n        Exp memory a,\\r\\n        uint scalar,\\r\\n        uint addend\\r\\n    ) internal pure returns (uint) {\\r\\n        Exp memory product = mul_(a, scalar);\\r\\n        return add_(truncate(product), addend);\\r\\n    }\\r\\n\\r\\n    /**\\r\\n     * @dev Checks if first Exp is less than second Exp.\\r\\n     */\\r\\n    function lessThanExp(\\r\\n        Exp memory left,\\r\\n        Exp memory right\\r\\n    ) internal pure returns (bool) {\\r\\n        return left.mantissa < right.mantissa;\\r\\n    }\\r\\n\\r\\n    /**\\r\\n     * @dev Checks if left Exp <= right Exp.\\r\\n     */\\r\\n    function lessThanOrEqualExp(\\r\\n        Exp memory left,\\r\\n        Exp memory right\\r\\n    ) internal pure returns (bool) {\\r\\n        return left.mantissa <= right.mantissa;\\r\\n    }\\r\\n\\r\\n    /**\\r\\n     * @dev Checks if left Exp > right Exp.\\r\\n     */\\r\\n    function greaterThanExp(\\r\\n        Exp memory left,\\r\\n        Exp memory right\\r\\n    ) internal pure returns (bool) {\\r\\n        return left.mantissa > right.mantissa;\\r\\n    }\\r\\n\\r\\n    /**\\r\\n     * @dev returns true if Exp is exactly zero\\r\\n     */\\r\\n    function isZeroExp(Exp memory value) internal pure returns (bool) {\\r\\n        return value.mantissa == 0;\\r\\n    }\\r\\n\\r\\n    function safe224(\\r\\n        uint n,\\r\\n        string memory errorMessage\\r\\n    ) internal pure returns (uint224) {\\r\\n        require(n < 2 ** 224, errorMessage);\\r\\n        return uint224(n);\\r\\n    }\\r\\n\\r\\n    function safe32(\\r\\n        uint n,\\r\\n        string memory errorMessage\\r\\n    ) internal pure returns (uint32) {\\r\\n        require(n < 2 ** 32, errorMessage);\\r\\n        return uint32(n);\\r\\n    }\\r\\n\\r\\n    function add_(\\r\\n        Exp memory a,\\r\\n        Exp memory b\\r\\n    ) internal pure returns (Exp memory) {\\r\\n        return Exp({mantissa: add_(a.mantissa, b.mantissa)});\\r\\n    }\\r\\n\\r\\n    function add_(\\r\\n        Double memory a,\\r\\n        Double memory b\\r\\n    ) internal pure returns (Double memory) {\\r\\n        return Double({mantissa: add_(a.mantissa, b.mantissa)});\\r\\n    }\\r\\n\\r\\n    function add_(uint a, uint b) internal pure returns (uint) {\\r\\n        return a + b;\\r\\n    }\\r\\n\\r\\n    function sub_(\\r\\n        Exp memory a,\\r\\n        Exp memory b\\r\\n    ) internal pure returns (Exp memory) {\\r\\n        return Exp({mantissa: sub_(a.mantissa, b.mantissa)});\\r\\n    }\\r\\n\\r\\n    function sub_(\\r\\n        Double memory a,\\r\\n        Double memory b\\r\\n    ) internal pure returns (Double memory) {\\r\\n        return Double({mantissa: sub_(a.mantissa, b.mantissa)});\\r\\n    }\\r\\n\\r\\n    function sub_(uint a, uint b) internal pure returns (uint) {\\r\\n        return a - b;\\r\\n    }\\r\\n\\r\\n    function mul_(\\r\\n        Exp memory a,\\r\\n        Exp memory b\\r\\n    ) internal pure returns (Exp memory) {\\r\\n        return Exp({mantissa: mul_(a.mantissa, b.mantissa) / expScale});\\r\\n    }\\r\\n\\r\\n    function mul_(Exp memory a, uint b) internal pure returns (Exp memory) {\\r\\n        return Exp({mantissa: mul_(a.mantissa, b)});\\r\\n    }\\r\\n\\r\\n    function mul_(uint a, Exp memory b) internal pure returns (uint) {\\r\\n        return mul_(a, b.mantissa) / expScale;\\r\\n    }\\r\\n\\r\\n    function mul_(\\r\\n        Double memory a,\\r\\n        Double memory b\\r\\n    ) internal pure returns (Double memory) {\\r\\n        return Double({mantissa: mul_(a.mantissa, b.mantissa) / doubleScale});\\r\\n    }\\r\\n\\r\\n    function mul_(\\r\\n        Double memory a,\\r\\n        uint b\\r\\n    ) internal pure returns (Double memory) {\\r\\n        return Double({mantissa: mul_(a.mantissa, b)});\\r\\n    }\\r\\n\\r\\n    function mul_(uint a, Double memory b) internal pure returns (uint) {\\r\\n        return mul_(a, b.mantissa) / doubleScale;\\r\\n    }\\r\\n\\r\\n    function mul_(uint a, uint b) internal pure returns (uint) {\\r\\n        return a * b;\\r\\n    }\\r\\n\\r\\n    function div_(\\r\\n        Exp memory a,\\r\\n        Exp memory b\\r\\n    ) internal pure returns (Exp memory) {\\r\\n        return Exp({mantissa: div_(mul_(a.mantissa, expScale), b.mantissa)});\\r\\n    }\\r\\n\\r\\n    function div_(Exp memory a, uint b) internal pure returns (Exp memory) {\\r\\n        return Exp({mantissa: div_(a.mantissa, b)});\\r\\n    }\\r\\n\\r\\n    function div_(uint a, Exp memory b) internal pure returns (uint) {\\r\\n        return div_(mul_(a, expScale), b.mantissa);\\r\\n    }\\r\\n\\r\\n    function div_(\\r\\n        Double memory a,\\r\\n        Double memory b\\r\\n    ) internal pure returns (Double memory) {\\r\\n        return\\r\\n            Double({mantissa: div_(mul_(a.mantissa, doubleScale), b.mantissa)});\\r\\n    }\\r\\n\\r\\n    function div_(\\r\\n        Double memory a,\\r\\n        uint b\\r\\n    ) internal pure returns (Double memory) {\\r\\n        return Double({mantissa: div_(a.mantissa, b)});\\r\\n    }\\r\\n\\r\\n    function div_(uint a, Double memory b) internal pure returns (uint) {\\r\\n        return div_(mul_(a, doubleScale), b.mantissa);\\r\\n    }\\r\\n\\r\\n    function div_(uint a, uint b) internal pure returns (uint) {\\r\\n        return a / b;\\r\\n    }\\r\\n\\r\\n    function fraction(uint a, uint b) internal pure returns (Double memory) {\\r\\n        return Double({mantissa: div_(mul_(a, doubleScale), b)});\\r\\n    }\\r\\n}\\r\\n\",\"keccak256\":\"0x01ff129a3a6e3dc1e03b30bb3571458b8cb6c979dd54ce2e8a0c31cc18d6a102\",\"license\":\"BSD-3-Clause\"},\"contracts/InterestRateModel.sol\":{\"content\":\"// SPDX-License-Identifier: BSD-3-Clause\\r\\npragma solidity ^0.8.10;\\r\\n\\r\\n/**\\r\\n * @title Compound's InterestRateModel Interface\\r\\n * @author Compound\\r\\n */\\r\\nabstract contract InterestRateModel {\\r\\n    /// @notice Indicator that this is an InterestRateModel contract (for inspection)\\r\\n    bool public constant isInterestRateModel = true;\\r\\n\\r\\n    /**\\r\\n     * @notice Calculates the current borrow interest rate per block\\r\\n     * @param cash The total amount of cash the market has\\r\\n     * @param borrows The total amount of borrows the market has outstanding\\r\\n     * @param reserves The total amount of reserves the market has\\r\\n     * @return The borrow rate per block (as a percentage, and scaled by 1e18)\\r\\n     */\\r\\n    function getBorrowRate(\\r\\n        uint cash,\\r\\n        uint borrows,\\r\\n        uint reserves\\r\\n    ) external view virtual returns (uint);\\r\\n\\r\\n    /**\\r\\n     * @notice Calculates the current supply interest rate per block\\r\\n     * @param cash The total amount of cash the market has\\r\\n     * @param borrows The total amount of borrows the market has outstanding\\r\\n     * @param reserves The total amount of reserves the market has\\r\\n     * @param reserveFactorMantissa The current reserve factor the market has\\r\\n     * @return The supply rate per block (as a percentage, and scaled by 1e18)\\r\\n     */\\r\\n    function getSupplyRate(\\r\\n        uint cash,\\r\\n        uint borrows,\\r\\n        uint reserves,\\r\\n        uint reserveFactorMantissa\\r\\n    ) external view virtual returns (uint);\\r\\n}\\r\\n\",\"keccak256\":\"0xdcebe8eff94635acca1ef41ce1bff4a1dfc83dca53def658fa77cf5e35e29562\",\"license\":\"BSD-3-Clause\"}},\"version\":1}",
  "bytecode": "0x608060405234801561001057600080fd5b50613e71806100206000396000f3fe608060405234801561001057600080fd5b506004361061035d5760003560e01c80637f1e06be116101d3578063bd6d894d11610104578063f2b3abbd116100a2578063f851a4401161007c578063f851a44014610732578063f8f9da281461074a578063fca7820b14610752578063fe9c44ae1461076557600080fd5b8063f2b3abbd146106f9578063f3fdb15a1461070c578063f5e3c4621461071f57600080fd5b8063c5ebeaec116100de578063c5ebeaec14610692578063db006a75146106a5578063dd62ed3e146106b8578063e9c714f2146106f157600080fd5b8063bd6d894d14610644578063c37f68e21461064c578063c39b127f1461067f57600080fd5b8063a6afed9511610171578063ae9d70b01161014b578063ae9d70b014610603578063b2a02ff11461060b578063b57a4a721461061e578063b71d1a0c1461063157600080fd5b8063a6afed95146105df578063a9059cbb146105e7578063aa5af0fd146105fa57600080fd5b806395d89b41116101ad57806395d89b411461059e57806395dd9193146105a657806399d8c1b4146105b9578063a0712d68146105cc57600080fd5b80637f1e06be1461056f578063852a12e3146105825780638f840ddd1461059557600080fd5b8063313ce567116102ad578063601a0bf11161024b5780636c540baf116102255780636c540baf146105225780636f307dc31461052b57806370a082311461053e57806373acee981461056757600080fd5b8063601a0bf1146104f95780636752e7021461050c57806369ab32501461051a57600080fd5b80633e941010116102875780633e941010146104b75780634576b5db146104ca57806347bd3718146104dd5780635fe3b567146104e657600080fd5b8063313ce5671461047d5780633af9e6691461049c5780633b1d21a2146104af57600080fd5b806318160ddd1161031a5780631be19560116102f45780631be195601461043157806323b872dd146104445780632608f81814610457578063267822471461046a57600080fd5b806318160ddd1461040b578063182df0f5146104145780631a31d4651461041c57600080fd5b806306fdde0314610362578063095ea7b3146103805780630d983cc6146103a35780630e752702146103ce578063173b9904146103ef57806317bfdfbc146103f8575b600080fd5b61036a61076d565b604051610377919061382b565b60405180910390f35b61039361038e366004613898565b6107fb565b6040519015158152602001610377565b6011546103b6906001600160a01b031681565b6040516001600160a01b039091168152602001610377565b6103e16103dc3660046138c4565b610869565b604051908152602001610377565b6103e160085481565b6103e16104063660046138dd565b61087c565b6103e1600d5481565b6103e16108e4565b61042f61042a3660046139b3565b6108f3565b005b61042f61043f3660046138dd565b610988565b610393610452366004613a69565b610b54565b6103e1610465366004613898565b610bb0565b6004546103b6906001600160a01b031681565b60035461048a9060ff1681565b60405160ff9091168152602001610377565b6103e16104aa3660046138dd565b610bc5565b6103e1610c0b565b6103e16104c53660046138c4565b610c15565b6103e16104d83660046138dd565b610c26565b6103e1600b5481565b6005546103b6906001600160a01b031681565b6103e16105073660046138c4565b610d78565b6103e1666379da05b6000081565b6103e1600081565b6103e160095481565b6012546103b6906001600160a01b031681565b6103e161054c3660046138dd565b6001600160a01b03166000908152600e602052604090205490565b6103e1610dbf565b61042f61057d3660046138dd565b610e15565b6103e16105903660046138c4565b610eec565b6103e1600c5481565b61036a610ef7565b6103e16105b43660046138dd565b610f04565b61042f6105c7366004613aaa565b610f0f565b6103e16105da3660046138c4565b611172565b6103e161117d565b6103936105f5366004613898565b61136a565b6103e1600a5481565b6103e16113c5565b6103e1610619366004613a69565b61145d565b61042f61062c366004613b4c565b6114b8565b6103e161063f3660046138dd565b61160f565b6103e161169c565b61065f61065a3660046138dd565b6116f8565b604080519485526020850193909352918301526060820152608001610377565b6103e161068d3660046138dd565b611739565b6103e16106a03660046138c4565b6117c6565b6103e16106b33660046138c4565b6117d1565b6103e16106c6366004613c17565b6001600160a01b039182166000908152600f6020908152604080832093909416825291909152205490565b6103e16117dc565b6103e16107073660046138dd565b6118e3565b6006546103b6906001600160a01b031681565b6103e161072d366004613c50565b6118f7565b6003546103b69061010090046001600160a01b031681565b6103e161190e565b6103e16107603660046138c4565b611961565b610393600181565b6001805461077a90613c92565b80601f01602080910402602001604051908101604052809291908181526020018280546107a690613c92565b80156107f35780601f106107c8576101008083540402835291602001916107f3565b820191906000526020600020905b8154815290600101906020018083116107d657829003601f168201915b505050505081565b336000818152600f602090815260408083206001600160a01b03871680855292528083208590555191929182907f8c5be1e5ebec7d5bd14f71427d1e84f3dd0314c0f7b2291e5b200ac8c7c3b925906108579087815260200190565b60405180910390a35060019392505050565b6000610874826119a8565b506000919050565b6000805462010000900460ff166108ae5760405162461bcd60e51b81526004016108a590613ccd565b60405180910390fd5b6000805462ff0000191690556108c261117d565b506108cc82610f04565b90506000805462ff0000191662010000179055919050565b60006108ee611a05565b905090565b610901868686868686610f0f565b601280546001600160a01b0319166001600160a01b038916908117909155604080516318160ddd60e01b815290516318160ddd916004808201926020929091908290030181865afa15801561095a573d6000803e3d6000fd5b505050506040513d601f19601f8201168201806040525081019061097e9190613cf1565b5050505050505050565b60035461010090046001600160a01b031633146109ff5760405162461bcd60e51b815260206004820152602f60248201527f4345726332303a3a7377656570546f6b656e3a206f6e6c792061646d696e206360448201526e616e20737765657020746f6b656e7360881b60648201526084016108a5565b6012546001600160a01b0382811691161415610a785760405162461bcd60e51b815260206004820152603260248201527f4345726332303a3a7377656570546f6b656e3a2063616e206e6f74207377656560448201527138103ab73232b9363cb4b733903a37b5b2b760711b60648201526084016108a5565b6040516370a0823160e01b81523060048201526000906001600160a01b038316906370a0823190602401602060405180830381865afa158015610abf573d6000803e3d6000fd5b505050506040513d601f19601f82011682018060405250810190610ae39190613cf1565b60035460405163a9059cbb60e01b81526001600160a01b03610100909204821660048201526024810183905291925083169063a9059cbb90604401600060405180830381600087803b158015610b3857600080fd5b505af1158015610b4c573d6000803e3d6000fd5b505050505050565b6000805462010000900460ff16610b7d5760405162461bcd60e51b81526004016108a590613ccd565b6000805462ff000019168155610b9533868686611a6f565b1490506000805462ff00001916620100001790559392505050565b6000610bbc8383611c9d565b50600092915050565b6000806040518060200160405280610bdb61169c565b90526001600160a01b0384166000908152600e6020526040902054909150610c04908290611cfb565b9392505050565b60006108ee611d1b565b6000610c2082611d90565b92915050565b60035460009061010090046001600160a01b03163314610c595760405163d219dc1f60e01b815260040160405180910390fd5b60055460408051623f1ee960e11b815290516001600160a01b0392831692851691627e3dd29160048083019260209291908290030181865afa158015610ca3573d6000803e3d6000fd5b505050506040513d601f19601f82011682018060405250810190610cc79190613d0a565b610d135760405162461bcd60e51b815260206004820152601c60248201527f6d61726b6572206d6574686f642072657475726e65642066616c73650000000060448201526064016108a5565b600580546001600160a01b0319166001600160a01b0385811691821790925560408051928416835260208301919091527f7ac369dbd14fa5ea3f473ed67cc9d598964a77501540ba6751eb0b3decf5870d91015b60405180910390a150600092915050565b6000805462010000900460ff16610da15760405162461bcd60e51b81526004016108a590613ccd565b6000805462ff000019169055610db561117d565b506108cc82611df3565b6000805462010000900460ff16610de85760405162461bcd60e51b81526004016108a590613ccd565b6000805462ff000019169055610dfc61117d565b5050600b546000805462ff000019166201000017905590565b60035461010090046001600160a01b03163314610e8a5760405162461bcd60e51b815260206004820152602d60248201527f6f6e6c79207468652061646d696e206d6179207365742074686520636f6d702d60448201526c6c696b652064656c656761746560981b60648201526084016108a5565b6012546040516317066a5760e21b81526001600160a01b03838116600483015290911690635c19a95c90602401600060405180830381600087803b158015610ed157600080fd5b505af1158015610ee5573d6000803e3d6000fd5b5050505050565b600061087482611f15565b6002805461077a90613c92565b6000610c2082611f72565b60035461010090046001600160a01b03163314610f7a5760405162461bcd60e51b8152602060048201526024808201527f6f6e6c792061646d696e206d617920696e697469616c697a6520746865206d616044820152631c9ad95d60e21b60648201526084016108a5565b600954158015610f8a5750600a54155b610fe25760405162461bcd60e51b815260206004820152602360248201527f6d61726b6574206d6179206f6e6c7920626520696e697469616c697a6564206f6044820152626e636560e81b60648201526084016108a5565b60078490558361104d5760405162461bcd60e51b815260206004820152603060248201527f696e697469616c2065786368616e67652072617465206d75737420626520677260448201526f32b0ba32b9103a3430b7103d32b9379760811b60648201526084016108a5565b600061105887610c26565b905080156110a85760405162461bcd60e51b815260206004820152601a60248201527f73657474696e6720636f6d7074726f6c6c6572206661696c656400000000000060448201526064016108a5565b42600955670de0b6b3a7640000600a556110c186611fbc565b9050801561111c5760405162461bcd60e51b815260206004820152602260248201527f73657474696e6720696e7465726573742072617465206d6f64656c206661696c604482015261195960f21b60648201526084016108a5565b835161112f90600190602087019061379b565b50825161114390600290602086019061379b565b50506003805460ff90921660ff1990921691909117905550506000805462ff0000191662010000179055505050565b600061087482612131565b6009546000904290808214156111965760009250505090565b60006111a0611d1b565b600b54600c54600a546006546040516315f2405360e01b81526004810186905260248101859052604481018490529495509293919290916000916001600160a01b0316906315f2405390606401602060405180830381865afa15801561120a573d6000803e3d6000fd5b505050506040513d601f19601f8201168201806040525081019061122e9190613cf1565b9050645d21dba0008111156112855760405162461bcd60e51b815260206004820152601c60248201527f626f72726f772072617465206973206162737572646c7920686967680000000060448201526064016108a5565b60006112918789613d42565b905060006112ad60405180602001604052808581525083612178565b905060006112bb8288611cfb565b905060006112c98883613d59565b905060006112e86040518060200160405280600854815250848a6121a9565b905060006112f785898a6121a9565b60098e9055600a819055600b849055600c839055604080518d815260208101879052908101829052606081018590529091507f4dec04e750ca11537cabcd8a9eab06494de08da3735bc8871cd41250e190bc049060800160405180910390a160009d505050505050505050505050505090565b6000805462010000900460ff166113935760405162461bcd60e51b81526004016108a590613ccd565b6000805462ff0000191681556113ab33808686611a6f565b1490506000805462ff000019166201000017905592915050565b6006546000906001600160a01b031663b81688166113e1611d1b565b600b54600c546008546040516001600160e01b031960e087901b16815260048101949094526024840192909252604483015260648201526084015b602060405180830381865afa158015611439573d6000803e3d6000fd5b505050506040513d601f19601f820116820180604052508101906108ee9190613cf1565b6000805462010000900460ff166114865760405162461bcd60e51b81526004016108a590613ccd565b6000805462ff00001916905561149e338585856121ca565b50600080805462ff00001916620100001790559392505050565b600054610100900460ff16158080156114d85750600054600160ff909116105b806114f25750303b1580156114f2575060005460ff166001145b6115555760405162461bcd60e51b815260206004820152602e60248201527f496e697469616c697a61626c653a20636f6e747261637420697320616c72656160448201526d191e481a5b9a5d1a585b1a5e995960921b60648201526084016108a5565b6000805460ff191660011790558015611578576000805461ff0019166101001790555b60038054610100600160a81b031916336101000217905561159e898989898989896108f3565b60038054610100600160a81b0319166101006001600160a01b038516021790558015611604576000805461ff0019169055604051600181527f7f26b83ff96e1f2b6a682f133852f6798a09c465da95921460cefb38474024989060200160405180910390a15b505050505050505050565b60035460009061010090046001600160a01b0316331461164257604051635cb56c2b60e01b815260040160405180910390fd5b600480546001600160a01b038481166001600160a01b031983168117909355604080519190921680825260208201939093527fca4f2f25d0898edd99413412fb94012f9e54ec8142f9b093e7720646a95b16a99101610d67565b6000805462010000900460ff166116c55760405162461bcd60e51b81526004016108a590613ccd565b6000805462ff0000191690556116d961117d565b506116e26108e4565b90506000805462ff000019166201000017905590565b6001600160a01b0381166000908152600e6020526040812054819081908190819061172287611f72565b61172a611a05565b93509350935093509193509193565b60035460009061010090046001600160a01b0316331461176c57604051632f7aaee760e01b815260040160405180910390fd5b601180546001600160a01b038481166001600160a01b031983168117909355604080519190921680825260208201939093527fe3f5272426aa3e70e583474d1155b19c7d9a5394147c40191dfaf32b792bc9789101610d67565b600061087482612443565b60006108748261248a565b6004546000906001600160a01b0316331415806117f7575033155b1561181557604051631ba24f2960e21b815260040160405180910390fd5b60038054600480546001600160a01b03808216610100818102610100600160a81b0319871617968790556001600160a01b031990931690935560408051948390048216808652929095041660208401529290917ff9ffabca9c8276e99321725bcb43fb076a6c66a54b7f21c4e8146d8519b417dc910160405180910390a1600454604080516001600160a01b03808516825290921660208301527fca4f2f25d0898edd99413412fb94012f9e54ec8142f9b093e7720646a95b16a9910160405180910390a160009250505090565b60006118ed61117d565b50610c2082611fbc565b60006119048484846124d3565b5060009392505050565b6006546000906001600160a01b03166315f2405361192a611d1b565b600b54600c546040516001600160e01b031960e086901b16815260048101939093526024830191909152604482015260640161141c565b6000805462010000900460ff1661198a5760405162461bcd60e51b81526004016108a590613ccd565b6000805462ff00001916905561199e61117d565b506108cc826125bd565b60005462010000900460ff166119d05760405162461bcd60e51b81526004016108a590613ccd565b6000805462ff0000191690556119e461117d565b506119f0333383612679565b50506000805462ff0000191662010000179055565b600d5460009080611a1857505060075490565b6000611a22611d1b565b90506000600c54600b5483611a379190613d59565b611a419190613d42565b9050600083611a58670de0b6b3a764000084613d71565b611a629190613d90565b95945050505050565b5090565b6005546040516317b9b84b60e31b81523060048201526001600160a01b038581166024830152848116604483015260648201849052600092839291169063bdcdc258906084016020604051808303816000875af1158015611ad4573d6000803e3d6000fd5b505050506040513d601f19601f82011682018060405250810190611af89190613cf1565b90508015611b1c5760405163089d427760e11b8152600481018290526024016108a5565b836001600160a01b0316856001600160a01b03161415611b4f57604051638cd22d1960e01b815260040160405180910390fd5b6000856001600160a01b0316876001600160a01b03161415611b745750600019611b9c565b506001600160a01b038086166000908152600f60209081526040808320938a16835292905220545b6000611ba88583613d42565b6001600160a01b0388166000908152600e602052604081205491925090611bd0908790613d42565b6001600160a01b0388166000908152600e602052604081205491925090611bf8908890613d59565b6001600160a01b03808b166000908152600e6020526040808220869055918b1681522081905590506000198414611c52576001600160a01b03808a166000908152600f60209081526040808320938e168352929052208390555b876001600160a01b0316896001600160a01b0316600080516020613e1c83398151915289604051611c8591815260200190565b60405180910390a35060009998505050505050505050565b60005462010000900460ff16611cc55760405162461bcd60e51b81526004016108a590613ccd565b6000805462ff000019169055611cd961117d565b50611ce5338383612679565b50506000805462ff000019166201000017905550565b600080611d088484612178565b9050611d1381612822565b949350505050565b6012546040516370a0823160e01b81523060048201526000916001600160a01b03169081906370a0823190602401602060405180830381865afa158015611d66573d6000803e3d6000fd5b505050506040513d601f19601f82011682018060405250810190611d8a9190613cf1565b91505090565b6000805462010000900460ff16611db95760405162461bcd60e51b81526004016108a590613ccd565b6000805462ff000019169055611dcd61117d565b50611dd78261283a565b5050600090506000805462ff0000191662010000179055919050565b600354600090819061010090046001600160a01b03163314801590611e2357506011546001600160a01b03163314155b15611e4157604051630f7e5e6d60e41b815260040160405180910390fd5b4260095414611e6357604051630dff50cb60e41b815260040160405180910390fd5b82611e6c611d1b565b1015611e8b57604051633345e99960e01b815260040160405180910390fd5b600c54831115611eae576040516378d2980560e11b815260040160405180910390fd5b82600c54611ebc9190613d42565b600c8190559050611ecd33846128ce565b7f3bad0c59cf2f06e7314077049f48a93578cd16f5ef92329f1dab1420a99c177e600360019054906101000a90046001600160a01b03168483604051610d6793929190613db2565b60005462010000900460ff16611f3d5760405162461bcd60e51b81526004016108a590613ccd565b6000805462ff000019169055611f5161117d565b50611f5e336000836129b8565b506000805462ff0000191662010000179055565b6001600160a01b03811660009081526010602052604081208054611f995750600092915050565b600a548154600091611faa91613d71565b9050816001015481611d139190613d90565b600354600090819061010090046001600160a01b03163314611ff15760405163407fded560e01b815260040160405180910390fd5b426009541461201357604051630be2a5cb60e11b815260040160405180910390fd5b600660009054906101000a90046001600160a01b03169050826001600160a01b0316632191f92a6040518163ffffffff1660e01b8152600401602060405180830381865afa158015612069573d6000803e3d6000fd5b505050506040513d601f19601f8201168201806040525081019061208d9190613d0a565b6120d95760405162461bcd60e51b815260206004820152601c60248201527f6d61726b6572206d6574686f642072657475726e65642066616c73650000000060448201526064016108a5565b600680546001600160a01b0319166001600160a01b0385811691821790925560408051928416835260208301919091527fedffc32e068c7c95dfd4bdfd5c4d939a084d6b11c4199eac8436ed234d72f9269101610d67565b60005462010000900460ff166121595760405162461bcd60e51b81526004016108a590613ccd565b6000805462ff00001916905561216d61117d565b50611f5e3382612c95565b60408051602081019091526000815260405180602001604052806121a0856000015185612f0b565b90529392505050565b6000806121b68585612178565b9050611a626121c482612822565b84612f17565b60055460405163d02f735160e01b81523060048201526001600160a01b0386811660248301528581166044830152848116606483015260848201849052600092169063d02f73519060a4016020604051808303816000875af1158015612234573d6000803e3d6000fd5b505050506040513d601f19601f820116820180604052508101906122589190613cf1565b9050801561227c576040516363e00e3360e11b8152600481018290526024016108a5565b836001600160a01b0316836001600160a01b031614156122af57604051633a94626760e11b815260040160405180910390fd5b60006122d0836040518060200160405280666379da05b60000815250612f23565b905060006122de8285613d42565b9050600060405180602001604052806122f5611a05565b9052905060006123058285611cfb565b9050600081600c546123179190613d59565b600c819055600d5490915061232d908690613d42565b600d556001600160a01b0388166000908152600e6020526040902054612354908890613d42565b6001600160a01b03808a166000908152600e602052604080822093909355908b1681522054612384908590613d59565b6001600160a01b03808b166000818152600e602052604090819020939093559151908a1690600080516020613e1c833981519152906123c69088815260200190565b60405180910390a360405185815230906001600160a01b038a1690600080516020613e1c8339815191529060200160405180910390a37fa91e67c5ea634cd43a12c5a482724b03de01e85ca68702a53d0c2f45cb7c1dc530838360405161242f93929190613db2565b60405180910390a150505050505050505050565b60005462010000900460ff1661246b5760405162461bcd60e51b81526004016108a590613ccd565b6000805462ff00001916905561247f61117d565b50611f5e3382612f46565b60005462010000900460ff166124b25760405162461bcd60e51b81526004016108a590613ccd565b6000805462ff0000191690556124c661117d565b50611f5e338260006129b8565b60005462010000900460ff166124fb5760405162461bcd60e51b81526004016108a590613ccd565b6000805462ff00001916905561250f61117d565b506000816001600160a01b031663a6afed956040518163ffffffff1660e01b81526004016020604051808303816000875af1158015612552573d6000803e3d6000fd5b505050506040513d601f19601f820116820180604052508101906125769190613cf1565b9050801561259a57604051633eea49b760e11b8152600481018290526024016108a5565b6125a6338585856130e5565b50506000805462ff00001916620100001790555050565b60035460009061010090046001600160a01b031633146125f057604051631205b57b60e11b815260040160405180910390fd5b426009541461261257604051637dfca6b760e11b815260040160405180910390fd5b670de0b6b3a764000082111561263b5760405163717220f360e11b815260040160405180910390fd5b600880549083905560408051828152602081018590527faaa68312e2ea9d50e16af5068410ab56e1a1fd06037b1a35664812c30f8214609101610d67565b600554604051631200453160e11b81523060048201526001600160a01b03858116602483015284811660448301526064820184905260009283929116906324008a62906084016020604051808303816000875af11580156126de573d6000803e3d6000fd5b505050506040513d601f19601f820116820180604052508101906127029190613cf1565b9050801561272657604051638c81362d60e01b8152600481018290526024016108a5565b42600954146127485760405163c9021e2f60e01b815260040160405180910390fd5b600061275385611f72565b9050600060001985146127665784612768565b815b90506000612776888361359f565b905060006127848285613d42565b9050600082600b546127969190613d42565b6001600160a01b038a8116600081815260106020908152604091829020878155600a54600190910155600b8590558151938f168452830191909152810185905260608101849052608081018290529091507f1a2a22cb034d26d1854bdc6666a5b91fe25efbbb5dcad3b0355478d6f5c362a19060a00160405180910390a1509098975050505050505050565b8051600090610c2090670de0b6b3a764000090613d90565b60008080804260095414612864576040516338acf79960e01b8152600481018290526024016108a5565b61286e338661359f565b905080600c5461287e9190613d59565b915081600c819055507fa91e67c5ea634cd43a12c5a482724b03de01e85ca68702a53d0c2f45cb7c1dc53382846040516128ba93929190613db2565b60405180910390a160009590945092505050565b60125460405163a9059cbb60e01b81526001600160a01b0384811660048301526024820184905290911690819063a9059cbb90604401600060405180830381600087803b15801561291e57600080fd5b505af1158015612932573d6000803e3d6000fd5b5050505060003d6000811461294e576020811461295857600080fd5b6000199150612964565b60206000803e60005191505b50806129b25760405162461bcd60e51b815260206004820152601960248201527f544f4b454e5f5452414e534645525f4f55545f4641494c45440000000000000060448201526064016108a5565b50505050565b8115806129c3575080155b612a2c5760405162461bcd60e51b815260206004820152603460248201527f6f6e65206f662072656465656d546f6b656e73496e206f722072656465656d416044820152736d6f756e74496e206d757374206265207a65726f60601b60648201526084016108a5565b60006040518060200160405280612a41611a05565b905290506000808415612a6257849150612a5b8386611cfb565b9050612a72565b612a6c8484613776565b91508390505b60055460405163eabe7d9160e01b81526000916001600160a01b03169063eabe7d9190612aa79030908b908890600401613dd3565b6020604051808303816000875af1158015612ac6573d6000803e3d6000fd5b505050506040513d601f19601f82011682018060405250810190612aea9190613cf1565b90508015612b0e5760405163480f424760e01b8152600481018290526024016108a5565b4260095414612b30576040516397b5cfcd60e01b815260040160405180910390fd5b81612b39611d1b565b1015612b58576040516391240a1b60e01b815260040160405180910390fd5b82600d54612b669190613d42565b600d556001600160a01b0387166000908152600e6020526040902054612b8d908490613d42565b6001600160a01b0388166000908152600e6020526040902055612bb087836128ce565b60405183815230906001600160a01b03891690600080516020613e1c8339815191529060200160405180910390a37fe5b754fb1abb7f01b499791d0b820ae3b6af3424ac1c59768edb53f4ec31a929878385604051612c1193929190613db2565b60405180910390a16005546040516351dff98960e01b81523060048201526001600160a01b0389811660248301526044820185905260648201869052909116906351dff98990608401600060405180830381600087803b158015612c7457600080fd5b505af1158015612c88573d6000803e3d6000fd5b5050505050505050505050565b600554604051634ef4c3e160e01b81526000916001600160a01b031690634ef4c3e190612cca90309087908790600401613dd3565b6020604051808303816000875af1158015612ce9573d6000803e3d6000fd5b505050506040513d601f19601f82011682018060405250810190612d0d9190613cf1565b90508015612d31576040516349abd4fd60e01b8152600481018290526024016108a5565b4260095414612d53576040516338d8859760e01b815260040160405180910390fd5b60006040518060200160405280612d68611a05565b905290506000612d78858561359f565b90506000612d868284613776565b9050600d5460001415612dd5576103e8600d81905560008052600e6020527fe710864318d4a32f37d6ce54cb3fadbef648dd12d8dbdf53973564d56b7f881c819055612dd29082613d42565b90505b80600d54612de39190613d59565b600d556001600160a01b0386166000908152600e6020526040902054612e0a908290613d59565b6001600160a01b0387166000908152600e60205260409081902091909155517f4c209b5fc8ad50758f13e2e1088ba56a560dff690a1c6fef26394f4c03821c4f90612e5a90889085908590613db2565b60405180910390a16040518181526001600160a01b038716903090600080516020613e1c8339815191529060200160405180910390a36005546040516341c728b960e01b81523060048201526001600160a01b0388811660248301526044820185905260648201849052909116906341c728b990608401600060405180830381600087803b158015612eeb57600080fd5b505af1158015612eff573d6000803e3d6000fd5b50505050505050505050565b6000610c048284613d71565b6000610c048284613d59565b6000670de0b6b3a7640000612f3c848460000151612f0b565b610c049190613d90565b60055460405163368f515360e21b81526000916001600160a01b03169063da3d454c90612f7b90309087908790600401613dd3565b6020604051808303816000875af1158015612f9a573d6000803e3d6000fd5b505050506040513d601f19601f82011682018060405250810190612fbe9190613cf1565b90508015612fe25760405163918db40f60e01b8152600481018290526024016108a5565b426009541461300457604051630e8d8c6160e21b815260040160405180910390fd5b8161300d611d1b565b101561302c576040516348c2588160e01b815260040160405180910390fd5b600061303784611f72565b905060006130458483613d59565b9050600084600b546130579190613d59565b6001600160a01b0387166000908152601060205260409020838155600a54600190910155600b819055905061308c86866128ce565b604080516001600160a01b038816815260208101879052908101839052606081018290527f13ed6866d4e1ee6da46f845c46d7e54120883d75c5ea9a2dacc1c4ca8984ab809060800160405180910390a1505050505050565b600554604051632fe3f38f60e11b81523060048201526001600160a01b03838116602483015286811660448301528581166064830152608482018590526000921690635fc7e71e9060a4016020604051808303816000875af115801561314f573d6000803e3d6000fd5b505050506040513d601f19601f820116820180604052508101906131739190613cf1565b9050801561319757604051630a14d17960e11b8152600481018290526024016108a5565b42600954146131b9576040516380965b1b60e01b815260040160405180910390fd5b42826001600160a01b0316636c540baf6040518163ffffffff1660e01b8152600401602060405180830381865afa1580156131f8573d6000803e3d6000fd5b505050506040513d601f19601f8201168201806040525081019061321c9190613cf1565b1461323a57604051631046f38d60e31b815260040160405180910390fd5b846001600160a01b0316846001600160a01b0316141561326d57604051631bd1a62160e21b815260040160405180910390fd5b8261328b5760405163d29da7ef60e01b815260040160405180910390fd5b6000198314156132ae57604051635982c5bb60e11b815260040160405180910390fd5b60006132bb868686612679565b60055460405163c488847b60e01b815291925060009182916001600160a01b03169063c488847b906132f590309089908890600401613dd3565b6040805180830381865afa158015613311573d6000803e3d6000fd5b505050506040513d601f19601f820116820180604052508101906133359190613df7565b91509150600082146133a55760405162461bcd60e51b815260206004820152603360248201527f4c49515549444154455f434f4d5054524f4c4c45525f43414c43554c4154455f604482015272105353d5539517d4d152569157d19052531151606a1b60648201526084016108a5565b6040516370a0823160e01b81526001600160a01b0388811660048301528291908716906370a0823190602401602060405180830381865afa1580156133ee573d6000803e3d6000fd5b505050506040513d601f19601f820116820180604052508101906134129190613cf1565b10156134605760405162461bcd60e51b815260206004820152601860248201527f4c49515549444154455f5345495a455f544f4f5f4d554348000000000000000060448201526064016108a5565b6001600160a01b0385163014156134825761347d308989846121ca565b61353c565b60405163b2a02ff160e01b81526000906001600160a01b0387169063b2a02ff1906134b5908c908c908790600401613dd3565b6020604051808303816000875af11580156134d4573d6000803e3d6000fd5b505050506040513d601f19601f820116820180604052508101906134f89190613cf1565b1461353c5760405162461bcd60e51b81526020600482015260146024820152731d1bdad95b881cd95a5e9d5c994819985a5b195960621b60448201526064016108a5565b604080516001600160a01b038a811682528981166020830152818301869052871660608201526080810183905290517f298637f684da70674f26509b10f07ec2fbc77a335ab1e7d6215a4b2484d8bb529181900360a00190a15050505050505050565b6012546040516370a0823160e01b81523060048201526000916001600160a01b0316908190839082906370a0823190602401602060405180830381865afa1580156135ee573d6000803e3d6000fd5b505050506040513d601f19601f820116820180604052508101906136129190613cf1565b6040516323b872dd60e01b81529091506001600160a01b038316906323b872dd9061364590899030908a90600401613dd3565b600060405180830381600087803b15801561365f57600080fd5b505af1158015613673573d6000803e3d6000fd5b5050505060003d6000811461368f576020811461369957600080fd5b60001991506136a5565b60206000803e60005191505b50806136f35760405162461bcd60e51b815260206004820152601860248201527f544f4b454e5f5452414e534645525f494e5f4641494c4544000000000000000060448201526064016108a5565b6040516370a0823160e01b81523060048201526000906001600160a01b038616906370a0823190602401602060405180830381865afa15801561373a573d6000803e3d6000fd5b505050506040513d601f19601f8201168201806040525081019061375e9190613cf1565b905061376a8382613d42565b98975050505050505050565b6000610c0461378d84670de0b6b3a7640000612f0b565b83516000610c048284613d90565b8280546137a790613c92565b90600052602060002090601f0160209004810192826137c9576000855561380f565b82601f106137e257805160ff191683800117855561380f565b8280016001018555821561380f579182015b8281111561380f5782518255916020019190600101906137f4565b50611a6b9291505b80821115611a6b5760008155600101613817565b600060208083528351808285015260005b818110156138585785810183015185820160400152820161383c565b8181111561386a576000604083870101525b50601f01601f1916929092016040019392505050565b6001600160a01b038116811461389557600080fd5b50565b600080604083850312156138ab57600080fd5b82356138b681613880565b946020939093013593505050565b6000602082840312156138d657600080fd5b5035919050565b6000602082840312156138ef57600080fd5b8135610c0481613880565b634e487b7160e01b600052604160045260246000fd5b600082601f83011261392157600080fd5b813567ffffffffffffffff8082111561393c5761393c6138fa565b604051601f8301601f19908116603f01168101908282118183101715613964576139646138fa565b8160405283815286602085880101111561397d57600080fd5b836020870160208301376000602085830101528094505050505092915050565b803560ff811681146139ae57600080fd5b919050565b600080600080600080600060e0888a0312156139ce57600080fd5b87356139d981613880565b965060208801356139e981613880565b955060408801356139f981613880565b945060608801359350608088013567ffffffffffffffff80821115613a1d57600080fd5b613a298b838c01613910565b945060a08a0135915080821115613a3f57600080fd5b50613a4c8a828b01613910565b925050613a5b60c0890161399d565b905092959891949750929550565b600080600060608486031215613a7e57600080fd5b8335613a8981613880565b92506020840135613a9981613880565b929592945050506040919091013590565b60008060008060008060c08789031215613ac357600080fd5b8635613ace81613880565b95506020870135613ade81613880565b945060408701359350606087013567ffffffffffffffff80821115613b0257600080fd5b613b0e8a838b01613910565b94506080890135915080821115613b2457600080fd5b50613b3189828a01613910565b925050613b4060a0880161399d565b90509295509295509295565b600080600080600080600080610100898b031215613b6957600080fd5b8835613b7481613880565b97506020890135613b8481613880565b96506040890135613b9481613880565b955060608901359450608089013567ffffffffffffffff80821115613bb857600080fd5b613bc48c838d01613910565b955060a08b0135915080821115613bda57600080fd5b50613be78b828c01613910565b935050613bf660c08a0161399d565b915060e0890135613c0681613880565b809150509295985092959890939650565b60008060408385031215613c2a57600080fd5b8235613c3581613880565b91506020830135613c4581613880565b809150509250929050565b600080600060608486031215613c6557600080fd5b8335613c7081613880565b9250602084013591506040840135613c8781613880565b809150509250925092565b600181811c90821680613ca657607f821691505b60208210811415613cc757634e487b7160e01b600052602260045260246000fd5b50919050565b6020808252600a90820152691c994b595b9d195c995960b21b604082015260600190565b600060208284031215613d0357600080fd5b5051919050565b600060208284031215613d1c57600080fd5b81518015158114610c0457600080fd5b634e487b7160e01b600052601160045260246000fd5b600082821015613d5457613d54613d2c565b500390565b60008219821115613d6c57613d6c613d2c565b500190565b6000816000190483118215151615613d8b57613d8b613d2c565b500290565b600082613dad57634e487b7160e01b600052601260045260246000fd5b500490565b6001600160a01b039390931683526020830191909152604082015260600190565b6001600160a01b039384168152919092166020820152604081019190915260600190565b60008060408385031215613e0a57600080fd5b50508051602090910151909290915056feddf252ad1be2c89b69c2b068fc378daa952ba7f163c4a11628f55a4df523b3efa26469706673582212203dd9ccd5d5b69241ee712886c09af80df4db4e94f9f3f03aa69af2bc28d4e9bb64736f6c634300080a0033",
  "deployedBytecode": "0x608060405234801561001057600080fd5b506004361061035d5760003560e01c80637f1e06be116101d3578063bd6d894d11610104578063f2b3abbd116100a2578063f851a4401161007c578063f851a44014610732578063f8f9da281461074a578063fca7820b14610752578063fe9c44ae1461076557600080fd5b8063f2b3abbd146106f9578063f3fdb15a1461070c578063f5e3c4621461071f57600080fd5b8063c5ebeaec116100de578063c5ebeaec14610692578063db006a75146106a5578063dd62ed3e146106b8578063e9c714f2146106f157600080fd5b8063bd6d894d14610644578063c37f68e21461064c578063c39b127f1461067f57600080fd5b8063a6afed9511610171578063ae9d70b01161014b578063ae9d70b014610603578063b2a02ff11461060b578063b57a4a721461061e578063b71d1a0c1461063157600080fd5b8063a6afed95146105df578063a9059cbb146105e7578063aa5af0fd146105fa57600080fd5b806395d89b41116101ad57806395d89b411461059e57806395dd9193146105a657806399d8c1b4146105b9578063a0712d68146105cc57600080fd5b80637f1e06be1461056f578063852a12e3146105825780638f840ddd1461059557600080fd5b8063313ce567116102ad578063601a0bf11161024b5780636c540baf116102255780636c540baf146105225780636f307dc31461052b57806370a082311461053e57806373acee981461056757600080fd5b8063601a0bf1146104f95780636752e7021461050c57806369ab32501461051a57600080fd5b80633e941010116102875780633e941010146104b75780634576b5db146104ca57806347bd3718146104dd5780635fe3b567146104e657600080fd5b8063313ce5671461047d5780633af9e6691461049c5780633b1d21a2146104af57600080fd5b806318160ddd1161031a5780631be19560116102f45780631be195601461043157806323b872dd146104445780632608f81814610457578063267822471461046a57600080fd5b806318160ddd1461040b578063182df0f5146104145780631a31d4651461041c57600080fd5b806306fdde0314610362578063095ea7b3146103805780630d983cc6146103a35780630e752702146103ce578063173b9904146103ef57806317bfdfbc146103f8575b600080fd5b61036a61076d565b604051610377919061382b565b60405180910390f35b61039361038e366004613898565b6107fb565b6040519015158152602001610377565b6011546103b6906001600160a01b031681565b6040516001600160a01b039091168152602001610377565b6103e16103dc3660046138c4565b610869565b604051908152602001610377565b6103e160085481565b6103e16104063660046138dd565b61087c565b6103e1600d5481565b6103e16108e4565b61042f61042a3660046139b3565b6108f3565b005b61042f61043f3660046138dd565b610988565b610393610452366004613a69565b610b54565b6103e1610465366004613898565b610bb0565b6004546103b6906001600160a01b031681565b60035461048a9060ff1681565b60405160ff9091168152602001610377565b6103e16104aa3660046138dd565b610bc5565b6103e1610c0b565b6103e16104c53660046138c4565b610c15565b6103e16104d83660046138dd565b610c26565b6103e1600b5481565b6005546103b6906001600160a01b031681565b6103e16105073660046138c4565b610d78565b6103e1666379da05b6000081565b6103e1600081565b6103e160095481565b6012546103b6906001600160a01b031681565b6103e161054c3660046138dd565b6001600160a01b03166000908152600e602052604090205490565b6103e1610dbf565b61042f61057d3660046138dd565b610e15565b6103e16105903660046138c4565b610eec565b6103e1600c5481565b61036a610ef7565b6103e16105b43660046138dd565b610f04565b61042f6105c7366004613aaa565b610f0f565b6103e16105da3660046138c4565b611172565b6103e161117d565b6103936105f5366004613898565b61136a565b6103e1600a5481565b6103e16113c5565b6103e1610619366004613a69565b61145d565b61042f61062c366004613b4c565b6114b8565b6103e161063f3660046138dd565b61160f565b6103e161169c565b61065f61065a3660046138dd565b6116f8565b604080519485526020850193909352918301526060820152608001610377565b6103e161068d3660046138dd565b611739565b6103e16106a03660046138c4565b6117c6565b6103e16106b33660046138c4565b6117d1565b6103e16106c6366004613c17565b6001600160a01b039182166000908152600f6020908152604080832093909416825291909152205490565b6103e16117dc565b6103e16107073660046138dd565b6118e3565b6006546103b6906001600160a01b031681565b6103e161072d366004613c50565b6118f7565b6003546103b69061010090046001600160a01b031681565b6103e161190e565b6103e16107603660046138c4565b611961565b610393600181565b6001805461077a90613c92565b80601f01602080910402602001604051908101604052809291908181526020018280546107a690613c92565b80156107f35780601f106107c8576101008083540402835291602001916107f3565b820191906000526020600020905b8154815290600101906020018083116107d657829003601f168201915b505050505081565b336000818152600f602090815260408083206001600160a01b03871680855292528083208590555191929182907f8c5be1e5ebec7d5bd14f71427d1e84f3dd0314c0f7b2291e5b200ac8c7c3b925906108579087815260200190565b60405180910390a35060019392505050565b6000610874826119a8565b506000919050565b6000805462010000900460ff166108ae5760405162461bcd60e51b81526004016108a590613ccd565b60405180910390fd5b6000805462ff0000191690556108c261117d565b506108cc82610f04565b90506000805462ff0000191662010000179055919050565b60006108ee611a05565b905090565b610901868686868686610f0f565b601280546001600160a01b0319166001600160a01b038916908117909155604080516318160ddd60e01b815290516318160ddd916004808201926020929091908290030181865afa15801561095a573d6000803e3d6000fd5b505050506040513d601f19601f8201168201806040525081019061097e9190613cf1565b5050505050505050565b60035461010090046001600160a01b031633146109ff5760405162461bcd60e51b815260206004820152602f60248201527f4345726332303a3a7377656570546f6b656e3a206f6e6c792061646d696e206360448201526e616e20737765657020746f6b656e7360881b60648201526084016108a5565b6012546001600160a01b0382811691161415610a785760405162461bcd60e51b815260206004820152603260248201527f4345726332303a3a7377656570546f6b656e3a2063616e206e6f74207377656560448201527138103ab73232b9363cb4b733903a37b5b2b760711b60648201526084016108a5565b6040516370a0823160e01b81523060048201526000906001600160a01b038316906370a0823190602401602060405180830381865afa158015610abf573d6000803e3d6000fd5b505050506040513d601f19601f82011682018060405250810190610ae39190613cf1565b60035460405163a9059cbb60e01b81526001600160a01b03610100909204821660048201526024810183905291925083169063a9059cbb90604401600060405180830381600087803b158015610b3857600080fd5b505af1158015610b4c573d6000803e3d6000fd5b505050505050565b6000805462010000900460ff16610b7d5760405162461bcd60e51b81526004016108a590613ccd565b6000805462ff000019168155610b9533868686611a6f565b1490506000805462ff00001916620100001790559392505050565b6000610bbc8383611c9d565b50600092915050565b6000806040518060200160405280610bdb61169c565b90526001600160a01b0384166000908152600e6020526040902054909150610c04908290611cfb565b9392505050565b60006108ee611d1b565b6000610c2082611d90565b92915050565b60035460009061010090046001600160a01b03163314610c595760405163d219dc1f60e01b815260040160405180910390fd5b60055460408051623f1ee960e11b815290516001600160a01b0392831692851691627e3dd29160048083019260209291908290030181865afa158015610ca3573d6000803e3d6000fd5b505050506040513d601f19601f82011682018060405250810190610cc79190613d0a565b610d135760405162461bcd60e51b815260206004820152601c60248201527f6d61726b6572206d6574686f642072657475726e65642066616c73650000000060448201526064016108a5565b600580546001600160a01b0319166001600160a01b0385811691821790925560408051928416835260208301919091527f7ac369dbd14fa5ea3f473ed67cc9d598964a77501540ba6751eb0b3decf5870d91015b60405180910390a150600092915050565b6000805462010000900460ff16610da15760405162461bcd60e51b81526004016108a590613ccd565b6000805462ff000019169055610db561117d565b506108cc82611df3565b6000805462010000900460ff16610de85760405162461bcd60e51b81526004016108a590613ccd565b6000805462ff000019169055610dfc61117d565b5050600b546000805462ff000019166201000017905590565b60035461010090046001600160a01b03163314610e8a5760405162461bcd60e51b815260206004820152602d60248201527f6f6e6c79207468652061646d696e206d6179207365742074686520636f6d702d60448201526c6c696b652064656c656761746560981b60648201526084016108a5565b6012546040516317066a5760e21b81526001600160a01b03838116600483015290911690635c19a95c90602401600060405180830381600087803b158015610ed157600080fd5b505af1158015610ee5573d6000803e3d6000fd5b5050505050565b600061087482611f15565b6002805461077a90613c92565b6000610c2082611f72565b60035461010090046001600160a01b03163314610f7a5760405162461bcd60e51b8152602060048201526024808201527f6f6e6c792061646d696e206d617920696e697469616c697a6520746865206d616044820152631c9ad95d60e21b60648201526084016108a5565b600954158015610f8a5750600a54155b610fe25760405162461bcd60e51b815260206004820152602360248201527f6d61726b6574206d6179206f6e6c7920626520696e697469616c697a6564206f6044820152626e636560e81b60648201526084016108a5565b60078490558361104d5760405162461bcd60e51b815260206004820152603060248201527f696e697469616c2065786368616e67652072617465206d75737420626520677260448201526f32b0ba32b9103a3430b7103d32b9379760811b60648201526084016108a5565b600061105887610c26565b905080156110a85760405162461bcd60e51b815260206004820152601a60248201527f73657474696e6720636f6d7074726f6c6c6572206661696c656400000000000060448201526064016108a5565b42600955670de0b6b3a7640000600a556110c186611fbc565b9050801561111c5760405162461bcd60e51b815260206004820152602260248201527f73657474696e6720696e7465726573742072617465206d6f64656c206661696c604482015261195960f21b60648201526084016108a5565b835161112f90600190602087019061379b565b50825161114390600290602086019061379b565b50506003805460ff90921660ff1990921691909117905550506000805462ff0000191662010000179055505050565b600061087482612131565b6009546000904290808214156111965760009250505090565b60006111a0611d1b565b600b54600c54600a546006546040516315f2405360e01b81526004810186905260248101859052604481018490529495509293919290916000916001600160a01b0316906315f2405390606401602060405180830381865afa15801561120a573d6000803e3d6000fd5b505050506040513d601f19601f8201168201806040525081019061122e9190613cf1565b9050645d21dba0008111156112855760405162461bcd60e51b815260206004820152601c60248201527f626f72726f772072617465206973206162737572646c7920686967680000000060448201526064016108a5565b60006112918789613d42565b905060006112ad60405180602001604052808581525083612178565b905060006112bb8288611cfb565b905060006112c98883613d59565b905060006112e86040518060200160405280600854815250848a6121a9565b905060006112f785898a6121a9565b60098e9055600a819055600b849055600c839055604080518d815260208101879052908101829052606081018590529091507f4dec04e750ca11537cabcd8a9eab06494de08da3735bc8871cd41250e190bc049060800160405180910390a160009d505050505050505050505050505090565b6000805462010000900460ff166113935760405162461bcd60e51b81526004016108a590613ccd565b6000805462ff0000191681556113ab33808686611a6f565b1490506000805462ff000019166201000017905592915050565b6006546000906001600160a01b031663b81688166113e1611d1b565b600b54600c546008546040516001600160e01b031960e087901b16815260048101949094526024840192909252604483015260648201526084015b602060405180830381865afa158015611439573d6000803e3d6000fd5b505050506040513d601f19601f820116820180604052508101906108ee9190613cf1565b6000805462010000900460ff166114865760405162461bcd60e51b81526004016108a590613ccd565b6000805462ff00001916905561149e338585856121ca565b50600080805462ff00001916620100001790559392505050565b600054610100900460ff16158080156114d85750600054600160ff909116105b806114f25750303b1580156114f2575060005460ff166001145b6115555760405162461bcd60e51b815260206004820152602e60248201527f496e697469616c697a61626c653a20636f6e747261637420697320616c72656160448201526d191e481a5b9a5d1a585b1a5e995960921b60648201526084016108a5565b6000805460ff191660011790558015611578576000805461ff0019166101001790555b60038054610100600160a81b031916336101000217905561159e898989898989896108f3565b60038054610100600160a81b0319166101006001600160a01b038516021790558015611604576000805461ff0019169055604051600181527f7f26b83ff96e1f2b6a682f133852f6798a09c465da95921460cefb38474024989060200160405180910390a15b505050505050505050565b60035460009061010090046001600160a01b0316331461164257604051635cb56c2b60e01b815260040160405180910390fd5b600480546001600160a01b038481166001600160a01b031983168117909355604080519190921680825260208201939093527fca4f2f25d0898edd99413412fb94012f9e54ec8142f9b093e7720646a95b16a99101610d67565b6000805462010000900460ff166116c55760405162461bcd60e51b81526004016108a590613ccd565b6000805462ff0000191690556116d961117d565b506116e26108e4565b90506000805462ff000019166201000017905590565b6001600160a01b0381166000908152600e6020526040812054819081908190819061172287611f72565b61172a611a05565b93509350935093509193509193565b60035460009061010090046001600160a01b0316331461176c57604051632f7aaee760e01b815260040160405180910390fd5b601180546001600160a01b038481166001600160a01b031983168117909355604080519190921680825260208201939093527fe3f5272426aa3e70e583474d1155b19c7d9a5394147c40191dfaf32b792bc9789101610d67565b600061087482612443565b60006108748261248a565b6004546000906001600160a01b0316331415806117f7575033155b1561181557604051631ba24f2960e21b815260040160405180910390fd5b60038054600480546001600160a01b03808216610100818102610100600160a81b0319871617968790556001600160a01b031990931690935560408051948390048216808652929095041660208401529290917ff9ffabca9c8276e99321725bcb43fb076a6c66a54b7f21c4e8146d8519b417dc910160405180910390a1600454604080516001600160a01b03808516825290921660208301527fca4f2f25d0898edd99413412fb94012f9e54ec8142f9b093e7720646a95b16a9910160405180910390a160009250505090565b60006118ed61117d565b50610c2082611fbc565b60006119048484846124d3565b5060009392505050565b6006546000906001600160a01b03166315f2405361192a611d1b565b600b54600c546040516001600160e01b031960e086901b16815260048101939093526024830191909152604482015260640161141c565b6000805462010000900460ff1661198a5760405162461bcd60e51b81526004016108a590613ccd565b6000805462ff00001916905561199e61117d565b506108cc826125bd565b60005462010000900460ff166119d05760405162461bcd60e51b81526004016108a590613ccd565b6000805462ff0000191690556119e461117d565b506119f0333383612679565b50506000805462ff0000191662010000179055565b600d5460009080611a1857505060075490565b6000611a22611d1b565b90506000600c54600b5483611a379190613d59565b611a419190613d42565b9050600083611a58670de0b6b3a764000084613d71565b611a629190613d90565b95945050505050565b5090565b6005546040516317b9b84b60e31b81523060048201526001600160a01b038581166024830152848116604483015260648201849052600092839291169063bdcdc258906084016020604051808303816000875af1158015611ad4573d6000803e3d6000fd5b505050506040513d601f19601f82011682018060405250810190611af89190613cf1565b90508015611b1c5760405163089d427760e11b8152600481018290526024016108a5565b836001600160a01b0316856001600160a01b03161415611b4f57604051638cd22d1960e01b815260040160405180910390fd5b6000856001600160a01b0316876001600160a01b03161415611b745750600019611b9c565b506001600160a01b038086166000908152600f60209081526040808320938a16835292905220545b6000611ba88583613d42565b6001600160a01b0388166000908152600e602052604081205491925090611bd0908790613d42565b6001600160a01b0388166000908152600e602052604081205491925090611bf8908890613d59565b6001600160a01b03808b166000908152600e6020526040808220869055918b1681522081905590506000198414611c52576001600160a01b03808a166000908152600f60209081526040808320938e168352929052208390555b876001600160a01b0316896001600160a01b0316600080516020613e1c83398151915289604051611c8591815260200190565b60405180910390a35060009998505050505050505050565b60005462010000900460ff16611cc55760405162461bcd60e51b81526004016108a590613ccd565b6000805462ff000019169055611cd961117d565b50611ce5338383612679565b50506000805462ff000019166201000017905550565b600080611d088484612178565b9050611d1381612822565b949350505050565b6012546040516370a0823160e01b81523060048201526000916001600160a01b03169081906370a0823190602401602060405180830381865afa158015611d66573d6000803e3d6000fd5b505050506040513d601f19601f82011682018060405250810190611d8a9190613cf1565b91505090565b6000805462010000900460ff16611db95760405162461bcd60e51b81526004016108a590613ccd565b6000805462ff000019169055611dcd61117d565b50611dd78261283a565b5050600090506000805462ff0000191662010000179055919050565b600354600090819061010090046001600160a01b03163314801590611e2357506011546001600160a01b03163314155b15611e4157604051630f7e5e6d60e41b815260040160405180910390fd5b4260095414611e6357604051630dff50cb60e41b815260040160405180910390fd5b82611e6c611d1b565b1015611e8b57604051633345e99960e01b815260040160405180910390fd5b600c54831115611eae576040516378d2980560e11b815260040160405180910390fd5b82600c54611ebc9190613d42565b600c8190559050611ecd33846128ce565b7f3bad0c59cf2f06e7314077049f48a93578cd16f5ef92329f1dab1420a99c177e600360019054906101000a90046001600160a01b03168483604051610d6793929190613db2565b60005462010000900460ff16611f3d5760405162461bcd60e51b81526004016108a590613ccd565b6000805462ff000019169055611f5161117d565b50611f5e336000836129b8565b506000805462ff0000191662010000179055565b6001600160a01b03811660009081526010602052604081208054611f995750600092915050565b600a548154600091611faa91613d71565b9050816001015481611d139190613d90565b600354600090819061010090046001600160a01b03163314611ff15760405163407fded560e01b815260040160405180910390fd5b426009541461201357604051630be2a5cb60e11b815260040160405180910390fd5b600660009054906101000a90046001600160a01b03169050826001600160a01b0316632191f92a6040518163ffffffff1660e01b8152600401602060405180830381865afa158015612069573d6000803e3d6000fd5b505050506040513d601f19601f8201168201806040525081019061208d9190613d0a565b6120d95760405162461bcd60e51b815260206004820152601c60248201527f6d61726b6572206d6574686f642072657475726e65642066616c73650000000060448201526064016108a5565b600680546001600160a01b0319166001600160a01b0385811691821790925560408051928416835260208301919091527fedffc32e068c7c95dfd4bdfd5c4d939a084d6b11c4199eac8436ed234d72f9269101610d67565b60005462010000900460ff166121595760405162461bcd60e51b81526004016108a590613ccd565b6000805462ff00001916905561216d61117d565b50611f5e3382612c95565b60408051602081019091526000815260405180602001604052806121a0856000015185612f0b565b90529392505050565b6000806121b68585612178565b9050611a626121c482612822565b84612f17565b60055460405163d02f735160e01b81523060048201526001600160a01b0386811660248301528581166044830152848116606483015260848201849052600092169063d02f73519060a4016020604051808303816000875af1158015612234573d6000803e3d6000fd5b505050506040513d601f19601f820116820180604052508101906122589190613cf1565b9050801561227c576040516363e00e3360e11b8152600481018290526024016108a5565b836001600160a01b0316836001600160a01b031614156122af57604051633a94626760e11b815260040160405180910390fd5b60006122d0836040518060200160405280666379da05b60000815250612f23565b905060006122de8285613d42565b9050600060405180602001604052806122f5611a05565b9052905060006123058285611cfb565b9050600081600c546123179190613d59565b600c819055600d5490915061232d908690613d42565b600d556001600160a01b0388166000908152600e6020526040902054612354908890613d42565b6001600160a01b03808a166000908152600e602052604080822093909355908b1681522054612384908590613d59565b6001600160a01b03808b166000818152600e602052604090819020939093559151908a1690600080516020613e1c833981519152906123c69088815260200190565b60405180910390a360405185815230906001600160a01b038a1690600080516020613e1c8339815191529060200160405180910390a37fa91e67c5ea634cd43a12c5a482724b03de01e85ca68702a53d0c2f45cb7c1dc530838360405161242f93929190613db2565b60405180910390a150505050505050505050565b60005462010000900460ff1661246b5760405162461bcd60e51b81526004016108a590613ccd565b6000805462ff00001916905561247f61117d565b50611f5e3382612f46565b60005462010000900460ff166124b25760405162461bcd60e51b81526004016108a590613ccd565b6000805462ff0000191690556124c661117d565b50611f5e338260006129b8565b60005462010000900460ff166124fb5760405162461bcd60e51b81526004016108a590613ccd565b6000805462ff00001916905561250f61117d565b506000816001600160a01b031663a6afed956040518163ffffffff1660e01b81526004016020604051808303816000875af1158015612552573d6000803e3d6000fd5b505050506040513d601f19601f820116820180604052508101906125769190613cf1565b9050801561259a57604051633eea49b760e11b8152600481018290526024016108a5565b6125a6338585856130e5565b50506000805462ff00001916620100001790555050565b60035460009061010090046001600160a01b031633146125f057604051631205b57b60e11b815260040160405180910390fd5b426009541461261257604051637dfca6b760e11b815260040160405180910390fd5b670de0b6b3a764000082111561263b5760405163717220f360e11b815260040160405180910390fd5b600880549083905560408051828152602081018590527faaa68312e2ea9d50e16af5068410ab56e1a1fd06037b1a35664812c30f8214609101610d67565b600554604051631200453160e11b81523060048201526001600160a01b03858116602483015284811660448301526064820184905260009283929116906324008a62906084016020604051808303816000875af11580156126de573d6000803e3d6000fd5b505050506040513d601f19601f820116820180604052508101906127029190613cf1565b9050801561272657604051638c81362d60e01b8152600481018290526024016108a5565b42600954146127485760405163c9021e2f60e01b815260040160405180910390fd5b600061275385611f72565b9050600060001985146127665784612768565b815b90506000612776888361359f565b905060006127848285613d42565b9050600082600b546127969190613d42565b6001600160a01b038a8116600081815260106020908152604091829020878155600a54600190910155600b8590558151938f168452830191909152810185905260608101849052608081018290529091507f1a2a22cb034d26d1854bdc6666a5b91fe25efbbb5dcad3b0355478d6f5c362a19060a00160405180910390a1509098975050505050505050565b8051600090610c2090670de0b6b3a764000090613d90565b60008080804260095414612864576040516338acf79960e01b8152600481018290526024016108a5565b61286e338661359f565b905080600c5461287e9190613d59565b915081600c819055507fa91e67c5ea634cd43a12c5a482724b03de01e85ca68702a53d0c2f45cb7c1dc53382846040516128ba93929190613db2565b60405180910390a160009590945092505050565b60125460405163a9059cbb60e01b81526001600160a01b0384811660048301526024820184905290911690819063a9059cbb90604401600060405180830381600087803b15801561291e57600080fd5b505af1158015612932573d6000803e3d6000fd5b5050505060003d6000811461294e576020811461295857600080fd5b6000199150612964565b60206000803e60005191505b50806129b25760405162461bcd60e51b815260206004820152601960248201527f544f4b454e5f5452414e534645525f4f55545f4641494c45440000000000000060448201526064016108a5565b50505050565b8115806129c3575080155b612a2c5760405162461bcd60e51b815260206004820152603460248201527f6f6e65206f662072656465656d546f6b656e73496e206f722072656465656d416044820152736d6f756e74496e206d757374206265207a65726f60601b60648201526084016108a5565b60006040518060200160405280612a41611a05565b905290506000808415612a6257849150612a5b8386611cfb565b9050612a72565b612a6c8484613776565b91508390505b60055460405163eabe7d9160e01b81526000916001600160a01b03169063eabe7d9190612aa79030908b908890600401613dd3565b6020604051808303816000875af1158015612ac6573d6000803e3d6000fd5b505050506040513d601f19601f82011682018060405250810190612aea9190613cf1565b90508015612b0e5760405163480f424760e01b8152600481018290526024016108a5565b4260095414612b30576040516397b5cfcd60e01b815260040160405180910390fd5b81612b39611d1b565b1015612b58576040516391240a1b60e01b815260040160405180910390fd5b82600d54612b669190613d42565b600d556001600160a01b0387166000908152600e6020526040902054612b8d908490613d42565b6001600160a01b0388166000908152600e6020526040902055612bb087836128ce565b60405183815230906001600160a01b03891690600080516020613e1c8339815191529060200160405180910390a37fe5b754fb1abb7f01b499791d0b820ae3b6af3424ac1c59768edb53f4ec31a929878385604051612c1193929190613db2565b60405180910390a16005546040516351dff98960e01b81523060048201526001600160a01b0389811660248301526044820185905260648201869052909116906351dff98990608401600060405180830381600087803b158015612c7457600080fd5b505af1158015612c88573d6000803e3d6000fd5b5050505050505050505050565b600554604051634ef4c3e160e01b81526000916001600160a01b031690634ef4c3e190612cca90309087908790600401613dd3565b6020604051808303816000875af1158015612ce9573d6000803e3d6000fd5b505050506040513d601f19601f82011682018060405250810190612d0d9190613cf1565b90508015612d31576040516349abd4fd60e01b8152600481018290526024016108a5565b4260095414612d53576040516338d8859760e01b815260040160405180910390fd5b60006040518060200160405280612d68611a05565b905290506000612d78858561359f565b90506000612d868284613776565b9050600d5460001415612dd5576103e8600d81905560008052600e6020527fe710864318d4a32f37d6ce54cb3fadbef648dd12d8dbdf53973564d56b7f881c819055612dd29082613d42565b90505b80600d54612de39190613d59565b600d556001600160a01b0386166000908152600e6020526040902054612e0a908290613d59565b6001600160a01b0387166000908152600e60205260409081902091909155517f4c209b5fc8ad50758f13e2e1088ba56a560dff690a1c6fef26394f4c03821c4f90612e5a90889085908590613db2565b60405180910390a16040518181526001600160a01b038716903090600080516020613e1c8339815191529060200160405180910390a36005546040516341c728b960e01b81523060048201526001600160a01b0388811660248301526044820185905260648201849052909116906341c728b990608401600060405180830381600087803b158015612eeb57600080fd5b505af1158015612eff573d6000803e3d6000fd5b50505050505050505050565b6000610c048284613d71565b6000610c048284613d59565b6000670de0b6b3a7640000612f3c848460000151612f0b565b610c049190613d90565b60055460405163368f515360e21b81526000916001600160a01b03169063da3d454c90612f7b90309087908790600401613dd3565b6020604051808303816000875af1158015612f9a573d6000803e3d6000fd5b505050506040513d601f19601f82011682018060405250810190612fbe9190613cf1565b90508015612fe25760405163918db40f60e01b8152600481018290526024016108a5565b426009541461300457604051630e8d8c6160e21b815260040160405180910390fd5b8161300d611d1b565b101561302c576040516348c2588160e01b815260040160405180910390fd5b600061303784611f72565b905060006130458483613d59565b9050600084600b546130579190613d59565b6001600160a01b0387166000908152601060205260409020838155600a54600190910155600b819055905061308c86866128ce565b604080516001600160a01b038816815260208101879052908101839052606081018290527f13ed6866d4e1ee6da46f845c46d7e54120883d75c5ea9a2dacc1c4ca8984ab809060800160405180910390a1505050505050565b600554604051632fe3f38f60e11b81523060048201526001600160a01b03838116602483015286811660448301528581166064830152608482018590526000921690635fc7e71e9060a4016020604051808303816000875af115801561314f573d6000803e3d6000fd5b505050506040513d601f19601f820116820180604052508101906131739190613cf1565b9050801561319757604051630a14d17960e11b8152600481018290526024016108a5565b42600954146131b9576040516380965b1b60e01b815260040160405180910390fd5b42826001600160a01b0316636c540baf6040518163ffffffff1660e01b8152600401602060405180830381865afa1580156131f8573d6000803e3d6000fd5b505050506040513d601f19601f8201168201806040525081019061321c9190613cf1565b1461323a57604051631046f38d60e31b815260040160405180910390fd5b846001600160a01b0316846001600160a01b0316141561326d57604051631bd1a62160e21b815260040160405180910390fd5b8261328b5760405163d29da7ef60e01b815260040160405180910390fd5b6000198314156132ae57604051635982c5bb60e11b815260040160405180910390fd5b60006132bb868686612679565b60055460405163c488847b60e01b815291925060009182916001600160a01b03169063c488847b906132f590309089908890600401613dd3565b6040805180830381865afa158015613311573d6000803e3d6000fd5b505050506040513d601f19601f820116820180604052508101906133359190613df7565b91509150600082146133a55760405162461bcd60e51b815260206004820152603360248201527f4c49515549444154455f434f4d5054524f4c4c45525f43414c43554c4154455f604482015272105353d5539517d4d152569157d19052531151606a1b60648201526084016108a5565b6040516370a0823160e01b81526001600160a01b0388811660048301528291908716906370a0823190602401602060405180830381865afa1580156133ee573d6000803e3d6000fd5b505050506040513d601f19601f820116820180604052508101906134129190613cf1565b10156134605760405162461bcd60e51b815260206004820152601860248201527f4c49515549444154455f5345495a455f544f4f5f4d554348000000000000000060448201526064016108a5565b6001600160a01b0385163014156134825761347d308989846121ca565b61353c565b60405163b2a02ff160e01b81526000906001600160a01b0387169063b2a02ff1906134b5908c908c908790600401613dd3565b6020604051808303816000875af11580156134d4573d6000803e3d6000fd5b505050506040513d601f19601f820116820180604052508101906134f89190613cf1565b1461353c5760405162461bcd60e51b81526020600482015260146024820152731d1bdad95b881cd95a5e9d5c994819985a5b195960621b60448201526064016108a5565b604080516001600160a01b038a811682528981166020830152818301869052871660608201526080810183905290517f298637f684da70674f26509b10f07ec2fbc77a335ab1e7d6215a4b2484d8bb529181900360a00190a15050505050505050565b6012546040516370a0823160e01b81523060048201526000916001600160a01b0316908190839082906370a0823190602401602060405180830381865afa1580156135ee573d6000803e3d6000fd5b505050506040513d601f19601f820116820180604052508101906136129190613cf1565b6040516323b872dd60e01b81529091506001600160a01b038316906323b872dd9061364590899030908a90600401613dd3565b600060405180830381600087803b15801561365f57600080fd5b505af1158015613673573d6000803e3d6000fd5b5050505060003d6000811461368f576020811461369957600080fd5b60001991506136a5565b60206000803e60005191505b50806136f35760405162461bcd60e51b815260206004820152601860248201527f544f4b454e5f5452414e534645525f494e5f4641494c4544000000000000000060448201526064016108a5565b6040516370a0823160e01b81523060048201526000906001600160a01b038616906370a0823190602401602060405180830381865afa15801561373a573d6000803e3d6000fd5b505050506040513d601f19601f8201168201806040525081019061375e9190613cf1565b905061376a8382613d42565b98975050505050505050565b6000610c0461378d84670de0b6b3a7640000612f0b565b83516000610c048284613d90565b8280546137a790613c92565b90600052602060002090601f0160209004810192826137c9576000855561380f565b82601f106137e257805160ff191683800117855561380f565b8280016001018555821561380f579182015b8281111561380f5782518255916020019190600101906137f4565b50611a6b9291505b80821115611a6b5760008155600101613817565b600060208083528351808285015260005b818110156138585785810183015185820160400152820161383c565b8181111561386a576000604083870101525b50601f01601f1916929092016040019392505050565b6001600160a01b038116811461389557600080fd5b50565b600080604083850312156138ab57600080fd5b82356138b681613880565b946020939093013593505050565b6000602082840312156138d657600080fd5b5035919050565b6000602082840312156138ef57600080fd5b8135610c0481613880565b634e487b7160e01b600052604160045260246000fd5b600082601f83011261392157600080fd5b813567ffffffffffffffff8082111561393c5761393c6138fa565b604051601f8301601f19908116603f01168101908282118183101715613964576139646138fa565b8160405283815286602085880101111561397d57600080fd5b836020870160208301376000602085830101528094505050505092915050565b803560ff811681146139ae57600080fd5b919050565b600080600080600080600060e0888a0312156139ce57600080fd5b87356139d981613880565b965060208801356139e981613880565b955060408801356139f981613880565b945060608801359350608088013567ffffffffffffffff80821115613a1d57600080fd5b613a298b838c01613910565b945060a08a0135915080821115613a3f57600080fd5b50613a4c8a828b01613910565b925050613a5b60c0890161399d565b905092959891949750929550565b600080600060608486031215613a7e57600080fd5b8335613a8981613880565b92506020840135613a9981613880565b929592945050506040919091013590565b60008060008060008060c08789031215613ac357600080fd5b8635613ace81613880565b95506020870135613ade81613880565b945060408701359350606087013567ffffffffffffffff80821115613b0257600080fd5b613b0e8a838b01613910565b94506080890135915080821115613b2457600080fd5b50613b3189828a01613910565b925050613b4060a0880161399d565b90509295509295509295565b600080600080600080600080610100898b031215613b6957600080fd5b8835613b7481613880565b97506020890135613b8481613880565b96506040890135613b9481613880565b955060608901359450608089013567ffffffffffffffff80821115613bb857600080fd5b613bc48c838d01613910565b955060a08b0135915080821115613bda57600080fd5b50613be78b828c01613910565b935050613bf660c08a0161399d565b915060e0890135613c0681613880565b809150509295985092959890939650565b60008060408385031215613c2a57600080fd5b8235613c3581613880565b91506020830135613c4581613880565b809150509250929050565b600080600060608486031215613c6557600080fd5b8335613c7081613880565b9250602084013591506040840135613c8781613880565b809150509250925092565b600181811c90821680613ca657607f821691505b60208210811415613cc757634e487b7160e01b600052602260045260246000fd5b50919050565b6020808252600a90820152691c994b595b9d195c995960b21b604082015260600190565b600060208284031215613d0357600080fd5b5051919050565b600060208284031215613d1c57600080fd5b81518015158114610c0457600080fd5b634e487b7160e01b600052601160045260246000fd5b600082821015613d5457613d54613d2c565b500390565b60008219821115613d6c57613d6c613d2c565b500190565b6000816000190483118215151615613d8b57613d8b613d2c565b500290565b600082613dad57634e487b7160e01b600052601260045260246000fd5b500490565b6001600160a01b039390931683526020830191909152604082015260600190565b6001600160a01b039384168152919092166020820152604081019190915260600190565b60008060408385031215613e0a57600080fd5b50508051602090910151909290915056feddf252ad1be2c89b69c2b068fc378daa952ba7f163c4a11628f55a4df523b3efa26469706673582212203dd9ccd5d5b69241ee712886c09af80df4db4e94f9f3f03aa69af2bc28d4e9bb64736f6c634300080a0033",
  "devdoc": {
    "author": "Compound",
    "kind": "dev",
    "methods": {
      "_acceptAdmin()": {
        "details": "Admin function for pending admin to accept role and update admin",
        "returns": {
          "_0": "uint 0=success, otherwise a failure (see ErrorReporter.sol for details)"
        }
      },
      "_addReserves(uint256)": {
        "params": {
          "addAmount": "The amount fo underlying token to add as reserves"
        },
        "returns": {
          "_0": "uint 0=success, otherwise a failure (see ErrorReporter.sol for details)"
        }
      },
      "_delegateCompLikeTo(address)": {
        "details": "CTokens whose underlying are not CompLike should revert here",
        "params": {
          "compLikeDelegatee": "The address to delegate votes to"
        }
      },
      "_reduceReserves(uint256)": {
        "params": {
          "reduceAmount": "Amount of reduction to reserves"
        },
        "returns": {
          "_0": "uint 0=success, otherwise a failure (see ErrorReporter.sol for details)"
        }
      },
      "_setComptroller(address)": {
        "details": "Admin function to set a new comptroller",
        "returns": {
          "_0": "uint 0=success, otherwise a failure (see ErrorReporter.sol for details)"
        }
      },
      "_setInterestRateModel(address)": {
        "details": "Admin function to accrue interest and update the interest rate model",
        "params": {
          "newInterestRateModel": "the new interest rate model to use"
        },
        "returns": {
          "_0": "uint 0=success, otherwise a failure (see ErrorReporter.sol for details)"
        }
      },
      "_setPendingAdmin(address)": {
        "details": "Admin function to begin change of admin. The newPendingAdmin must call `_acceptAdmin` to finalize the transfer.",
        "params": {
          "newPendingAdmin": "New pending admin."
        },
        "returns": {
          "_0": "uint 0=success, otherwise a failure (see ErrorReporter.sol for details)"
        }
      },
      "_setReserveFactor(uint256)": {
        "details": "Admin function to accrue interest and set a new reserve factor",
        "returns": {
          "_0": "uint 0=success, otherwise a failure (see ErrorReporter.sol for details)"
        }
      },
      "_setReserveGuardian(address)": {
        "params": {
          "newReserveGuardian": "New reserve guardian address"
        },
        "returns": {
          "_0": "uint 0=success, otherwise a failure (see ErrorReporter.sol for details)"
        }
      },
      "accrueInterest()": {
        "details": "This calculates interest accrued from the last checkpointed block   up to the current block and writes new checkpoint to storage."
      },
      "allowance(address,address)": {
        "params": {
          "owner": "The address of the account which owns the tokens to be spent",
          "spender": "The address of the account which may transfer tokens"
        },
        "returns": {
          "_0": "The number of tokens allowed to be spent (-1 means infinite)"
        }
      },
      "approve(address,uint256)": {
        "details": "This will overwrite the approval amount for `spender`  and is subject to issues noted [here](https://eips.ethereum.org/EIPS/eip-20#approve)",
        "params": {
          "amount": "The number of tokens that are approved (uint256.max means infinite)",
          "spender": "The address of the account which may transfer tokens"
        },
        "returns": {
          "_0": "Whether or not the approval succeeded"
        }
      },
      "balanceOf(address)": {
        "params": {
          "owner": "The address of the account to query"
        },
        "returns": {
          "_0": "The number of tokens owned by `owner`"
        }
      },
      "balanceOfUnderlying(address)": {
        "details": "This also accrues interest in a transaction",
        "params": {
          "owner": "The address of the account to query"
        },
        "returns": {
          "_0": "The amount of underlying owned by `owner`"
        }
      },
      "borrow(uint256)": {
        "params": {
          "borrowAmount": "The amount of the underlying asset to borrow"
        },
        "returns": {
          "_0": "uint 0=success, otherwise a failure (see ErrorReporter.sol for details)"
        }
      },
      "borrowBalanceCurrent(address)": {
        "params": {
          "account": "The address whose balance should be calculated after updating borrowIndex"
        },
        "returns": {
          "_0": "The calculated balance"
        }
      },
      "borrowBalanceStored(address)": {
        "params": {
          "account": "The address whose balance should be calculated"
        },
        "returns": {
          "_0": "The calculated balance"
        }
      },
      "borrowRatePerBlock()": {
        "returns": {
          "_0": "The borrow interest rate per block, scaled by 1e18"
        }
      },
      "exchangeRateCurrent()": {
        "returns": {
          "_0": "Calculated exchange rate scaled by 1e18"
        }
      },
      "exchangeRateStored()": {
        "details": "This function does not accrue interest before calculating the exchange rate",
        "returns": {
          "_0": "Calculated exchange rate scaled by 1e18"
        }
      },
      "getAccountSnapshot(address)": {
        "details": "This is used by comptroller to more efficiently perform liquidity checks.",
        "params": {
          "account": "Address of the account to snapshot"
        },
        "returns": {
          "_0": "(possible error, token balance, borrow balance, exchange rate mantissa)"
        }
      },
      "getCash()": {
        "returns": {
          "_0": "The quantity of underlying asset owned by this contract"
        }
      },
      "initialize(address,address,address,uint256,string,string,uint8)": {
        "params": {
          "comptroller_": "The address of the Comptroller",
          "decimals_": "ERC-20 decimal precision of this token",
          "initialExchangeRateMantissa_": "The initial exchange rate, scaled by 1e18",
          "interestRateModel_": "The address of the interest rate model",
          "name_": "ERC-20 name of this token",
          "symbol_": "ERC-20 symbol of this token",
          "underlying_": "The address of the underlying asset"
        }
      },
      "initialize(address,address,uint256,string,string,uint8)": {
        "params": {
          "comptroller_": "The address of the Comptroller",
          "decimals_": "EIP-20 decimal precision of this token",
          "initialExchangeRateMantissa_": "The initial exchange rate, scaled by 1e18",
          "interestRateModel_": "The address of the interest rate model",
          "name_": "EIP-20 name of this token",
          "symbol_": "EIP-20 symbol of this token"
        }
      },
      "liquidateBorrow(address,uint256,address)": {
        "params": {
          "borrower": "The borrower of this cToken to be liquidated",
          "cTokenCollateral": "The market in which to seize collateral from the borrower",
          "repayAmount": "The amount of the underlying borrowed asset to repay"
        },
        "returns": {
          "_0": "uint 0=success, otherwise a failure (see ErrorReporter.sol for details)"
        }
      },
      "mint(uint256)": {
        "details": "Accrues interest whether or not the operation succeeds, unless reverted",
        "params": {
          "mintAmount": "The amount of the underlying asset to supply"
        },
        "returns": {
          "_0": "uint 0=success, otherwise a failure (see ErrorReporter.sol for details)"
        }
      },
      "proxyInitialize(address,address,address,uint256,string,string,uint8,address)": {
        "params": {
          "comptroller_": "The address of the Comptroller",
          "decimals_": "ERC-20 decimal precision of this token",
          "initialExchangeRateMantissa_": "The initial exchange rate, scaled by 1e18",
          "interestRateModel_": "The address of the interest rate model",
          "name_": "ERC-20 name of this token",
          "symbol_": "ERC-20 symbol of this token",
          "underlying_": "The address of the underlying asset"
        }
      },
      "redeem(uint256)": {
        "details": "Accrues interest whether or not the operation succeeds, unless reverted",
        "params": {
          "redeemTokens": "The number of cTokens to redeem into underlying"
        },
        "returns": {
          "_0": "uint 0=success, otherwise a failure (see ErrorReporter.sol for details)"
        }
      },
      "redeemUnderlying(uint256)": {
        "details": "Accrues interest whether or not the operation succeeds, unless reverted",
        "params": {
          "redeemAmount": "The amount of underlying to redeem"
        },
        "returns": {
          "_0": "uint 0=success, otherwise a failure (see ErrorReporter.sol for details)"
        }
      },
      "repayBorrow(uint256)": {
        "params": {
          "repayAmount": "The amount to repay, or -1 for the full outstanding amount"
        },
        "returns": {
          "_0": "uint 0=success, otherwise a failure (see ErrorReporter.sol for details)"
        }
      },
      "repayBorrowBehalf(address,uint256)": {
        "params": {
          "borrower": "the account with the debt being payed off",
          "repayAmount": "The amount to repay, or -1 for the full outstanding amount"
        },
        "returns": {
          "_0": "uint 0=success, otherwise a failure (see ErrorReporter.sol for details)"
        }
      },
      "seize(address,address,uint256)": {
        "details": "Will fail unless called by another cToken during the process of liquidation.  Its absolutely critical to use msg.sender as the borrowed cToken and not a parameter.",
        "params": {
          "borrower": "The account having collateral seized",
          "liquidator": "The account receiving seized collateral",
          "seizeTokens": "The number of cTokens to seize"
        },
        "returns": {
          "_0": "uint 0=success, otherwise a failure (see ErrorReporter.sol for details)"
        }
      },
      "supplyRatePerBlock()": {
        "returns": {
          "_0": "The supply interest rate per block, scaled by 1e18"
        }
      },
      "sweepToken(address)": {
        "params": {
          "token": "The address of the ERC-20 token to sweep"
        }
      },
      "totalBorrowsCurrent()": {
        "returns": {
          "_0": "The total borrows with interest"
        }
      },
      "transfer(address,uint256)": {
        "params": {
          "amount": "The number of tokens to transfer",
          "dst": "The address of the destination account"
        },
        "returns": {
          "_0": "Whether or not the transfer succeeded"
        }
      },
      "transferFrom(address,address,uint256)": {
        "params": {
          "amount": "The number of tokens to transfer",
          "dst": "The address of the destination account",
          "src": "The address of the source account"
        },
        "returns": {
          "_0": "Whether or not the transfer succeeded"
        }
      }
    },
    "title": "Compound's CErc20Immutable Contract",
    "version": 1
  },
  "userdoc": {
    "events": {
      "AccrueInterest(uint256,uint256,uint256,uint256)": {
        "notice": "Event emitted when interest is accrued"
      },
      "Approval(address,address,uint256)": {
        "notice": "EIP20 Approval event"
      },
      "Borrow(address,uint256,uint256,uint256)": {
        "notice": "Event emitted when underlying is borrowed"
      },
      "LiquidateBorrow(address,address,uint256,address,uint256)": {
        "notice": "Event emitted when a borrow is liquidated"
      },
      "Mint(address,uint256,uint256)": {
        "notice": "Event emitted when tokens are minted"
      },
      "NewAdmin(address,address)": {
        "notice": "Event emitted when pendingAdmin is accepted, which means admin is updated"
      },
      "NewComptroller(address,address)": {
        "notice": "Event emitted when comptroller is changed"
      },
      "NewMarketInterestRateModel(address,address)": {
        "notice": "Event emitted when interestRateModel is changed"
      },
      "NewPendingAdmin(address,address)": {
        "notice": "Event emitted when pendingAdmin is changed"
      },
      "NewReserveFactor(uint256,uint256)": {
        "notice": "Event emitted when the reserve factor is changed"
      },
      "NewReserveGuardian(address,address)": {
        "notice": "Event emitted when reserve guardian is changed"
      },
      "Redeem(address,uint256,uint256)": {
        "notice": "Event emitted when tokens are redeemed"
      },
      "RepayBorrow(address,address,uint256,uint256,uint256)": {
        "notice": "Event emitted when a borrow is repaid"
      },
      "ReservesAdded(address,uint256,uint256)": {
        "notice": "Event emitted when the reserves are added"
      },
      "ReservesReduced(address,uint256,uint256)": {
        "notice": "Event emitted when the reserves are reduced"
      },
      "Transfer(address,address,uint256)": {
        "notice": "EIP20 Transfer event"
      }
    },
    "kind": "user",
    "methods": {
      "_acceptAdmin()": {
        "notice": "Accepts transfer of admin rights. msg.sender must be pendingAdmin"
      },
      "_addReserves(uint256)": {
        "notice": "The sender adds to reserves."
      },
      "_delegateCompLikeTo(address)": {
        "notice": "Admin call to delegate the votes of the COMP-like underlying"
      },
      "_reduceReserves(uint256)": {
        "notice": "Accrues interest and reduces reserves by transferring to admin"
      },
      "_setComptroller(address)": {
        "notice": "Sets a new comptroller for the market"
      },
      "_setInterestRateModel(address)": {
        "notice": "accrues interest and updates the interest rate model using _setInterestRateModelFresh"
      },
      "_setPendingAdmin(address)": {
        "notice": "Begins transfer of admin rights. The newPendingAdmin must call `_acceptAdmin` to finalize the transfer."
      },
      "_setReserveFactor(uint256)": {
        "notice": "accrues interest and sets a new reserve factor for the protocol using _setReserveFactorFresh"
      },
      "_setReserveGuardian(address)": {
        "notice": "Admin function to set new reserve guardian"
      },
      "accrualBlockNumber()": {
        "notice": "Block number that interest was last accrued at"
      },
      "accrueInterest()": {
        "notice": "Applies accrued interest to total borrows and reserves"
      },
      "admin()": {
        "notice": "Administrator for this contract"
      },
      "allowance(address,address)": {
        "notice": "Get the current allowance from `owner` for `spender`"
      },
      "approve(address,uint256)": {
        "notice": "Approve `spender` to transfer up to `amount` from `src`"
      },
      "balanceOf(address)": {
        "notice": "Get the token balance of the `owner`"
      },
      "balanceOfUnderlying(address)": {
        "notice": "Get the underlying balance of the `owner`"
      },
      "borrow(uint256)": {
        "notice": "Sender borrows assets from the protocol to their own address"
      },
      "borrowBalanceCurrent(address)": {
        "notice": "Accrue interest to updated borrowIndex and then calculate account's borrow balance using the updated borrowIndex"
      },
      "borrowBalanceStored(address)": {
        "notice": "Return the borrow balance of account based on stored data"
      },
      "borrowIndex()": {
        "notice": "Accumulator of the total earned interest rate since the opening of the market"
      },
      "borrowRatePerBlock()": {
        "notice": "Returns the current per-block borrow interest rate for this cToken"
      },
      "comptroller()": {
        "notice": "Contract which oversees inter-cToken operations"
      },
      "decimals()": {
        "notice": "EIP-20 token decimals for this token"
      },
      "exchangeRateCurrent()": {
        "notice": "Accrue interest then return the up-to-date exchange rate"
      },
      "exchangeRateStored()": {
        "notice": "Calculates the exchange rate from the underlying to the CToken"
      },
      "getAccountSnapshot(address)": {
        "notice": "Get a snapshot of the account's balances, and the cached exchange rate"
      },
      "getCash()": {
        "notice": "Get cash balance of this cToken in the underlying asset"
      },
      "initialize(address,address,address,uint256,string,string,uint8)": {
        "notice": "Initialize the new money market"
      },
      "initialize(address,address,uint256,string,string,uint8)": {
        "notice": "Initialize the money market"
      },
      "interestRateModel()": {
        "notice": "Model which tells what the current interest rate should be"
      },
      "isCToken()": {
        "notice": "Indicator that this is a CToken contract (for inspection)"
      },
      "liquidateBorrow(address,uint256,address)": {
        "notice": "The sender liquidates the borrowers collateral.  The collateral seized is transferred to the liquidator."
      },
      "mint(uint256)": {
        "notice": "Sender supplies assets into the market and receives cTokens in exchange"
      },
      "name()": {
        "notice": "EIP-20 token name for this token"
      },
      "pendingAdmin()": {
        "notice": "Pending administrator for this contract"
      },
      "protocolSeizeShareMantissa()": {
        "notice": "Share of seized collateral that is added to reserves"
      },
      "proxyInitialize(address,address,address,uint256,string,string,uint8,address)": {
        "notice": "Initialize the new money market"
      },
      "redeem(uint256)": {
        "notice": "Sender redeems cTokens in exchange for the underlying asset"
      },
      "redeemUnderlying(uint256)": {
        "notice": "Sender redeems cTokens in exchange for a specified amount of underlying asset"
      },
      "repayBorrow(uint256)": {
        "notice": "Sender repays their own borrow"
      },
      "repayBorrowBehalf(address,uint256)": {
        "notice": "Sender repays a borrow belonging to borrower"
      },
      "reserveFactorMantissa()": {
        "notice": "Fraction of interest currently set aside for reserves"
      },
      "reserveGuardian()": {
        "notice": "The reserve guardian can reduce the reserves of the market"
      },
      "seize(address,address,uint256)": {
        "notice": "Transfers collateral tokens (this market) to the liquidator."
      },
      "supplyRatePerBlock()": {
        "notice": "Returns the current per-block supply interest rate for this cToken"
      },
      "sweepToken(address)": {
        "notice": "A public function to sweep accidental ERC-20 transfers to this contract. Tokens are sent to admin (timelock)"
      },
      "symbol()": {
        "notice": "EIP-20 token symbol for this token"
      },
      "totalBorrows()": {
        "notice": "Total amount of outstanding borrows of the underlying in this market"
      },
      "totalBorrowsCurrent()": {
        "notice": "Returns the current total borrows plus accrued interest"
      },
      "totalReserves()": {
        "notice": "Total amount of reserves of the underlying held in this market"
      },
      "totalSupply()": {
        "notice": "Total number of tokens in circulation"
      },
      "transfer(address,uint256)": {
        "notice": "Transfer `amount` tokens from `msg.sender` to `dst`"
      },
      "transferFrom(address,address,uint256)": {
        "notice": "Transfer `amount` tokens from `src` to `dst`"
      },
      "underlying()": {
        "notice": "Underlying asset for this CToken"
      }
    },
    "notice": "CTokens which wrap an EIP-20 underlying and are immutable",
    "version": 1
  },
  "storageLayout": {
    "storage": [
      {
        "astId": 138,
        "contract": "contracts/CErc20Upgradable.sol:CErc20Upgradable",
        "label": "_initialized",
        "offset": 0,
        "slot": "0",
        "type": "t_uint8"
      },
      {
        "astId": 141,
        "contract": "contracts/CErc20Upgradable.sol:CErc20Upgradable",
        "label": "_initializing",
        "offset": 1,
        "slot": "0",
        "type": "t_bool"
      },
      {
        "astId": 6456,
        "contract": "contracts/CErc20Upgradable.sol:CErc20Upgradable",
        "label": "_notEntered",
        "offset": 2,
        "slot": "0",
        "type": "t_bool"
      },
      {
        "astId": 6459,
        "contract": "contracts/CErc20Upgradable.sol:CErc20Upgradable",
        "label": "name",
        "offset": 0,
        "slot": "1",
        "type": "t_string_storage"
      },
      {
        "astId": 6462,
        "contract": "contracts/CErc20Upgradable.sol:CErc20Upgradable",
        "label": "symbol",
        "offset": 0,
        "slot": "2",
        "type": "t_string_storage"
      },
      {
        "astId": 6465,
        "contract": "contracts/CErc20Upgradable.sol:CErc20Upgradable",
        "label": "decimals",
        "offset": 0,
        "slot": "3",
        "type": "t_uint8"
      },
      {
        "astId": 6474,
        "contract": "contracts/CErc20Upgradable.sol:CErc20Upgradable",
        "label": "admin",
        "offset": 1,
        "slot": "3",
        "type": "t_address_payable"
      },
      {
        "astId": 6477,
        "contract": "contracts/CErc20Upgradable.sol:CErc20Upgradable",
        "label": "pendingAdmin",
        "offset": 0,
        "slot": "4",
        "type": "t_address_payable"
      },
      {
        "astId": 6481,
        "contract": "contracts/CErc20Upgradable.sol:CErc20Upgradable",
        "label": "comptroller",
        "offset": 0,
        "slot": "5",
        "type": "t_contract(ComptrollerInterface)10289"
      },
      {
        "astId": 6485,
        "contract": "contracts/CErc20Upgradable.sol:CErc20Upgradable",
        "label": "interestRateModel",
        "offset": 0,
        "slot": "6",
        "type": "t_contract(InterestRateModel)11425"
      },
      {
        "astId": 6487,
        "contract": "contracts/CErc20Upgradable.sol:CErc20Upgradable",
        "label": "initialExchangeRateMantissa",
        "offset": 0,
        "slot": "7",
        "type": "t_uint256"
      },
      {
        "astId": 6490,
        "contract": "contracts/CErc20Upgradable.sol:CErc20Upgradable",
        "label": "reserveFactorMantissa",
        "offset": 0,
        "slot": "8",
        "type": "t_uint256"
      },
      {
        "astId": 6493,
        "contract": "contracts/CErc20Upgradable.sol:CErc20Upgradable",
        "label": "accrualBlockNumber",
        "offset": 0,
        "slot": "9",
        "type": "t_uint256"
      },
      {
        "astId": 6496,
        "contract": "contracts/CErc20Upgradable.sol:CErc20Upgradable",
        "label": "borrowIndex",
        "offset": 0,
        "slot": "10",
        "type": "t_uint256"
      },
      {
        "astId": 6499,
        "contract": "contracts/CErc20Upgradable.sol:CErc20Upgradable",
        "label": "totalBorrows",
        "offset": 0,
        "slot": "11",
        "type": "t_uint256"
      },
      {
        "astId": 6502,
        "contract": "contracts/CErc20Upgradable.sol:CErc20Upgradable",
        "label": "totalReserves",
        "offset": 0,
        "slot": "12",
        "type": "t_uint256"
      },
      {
        "astId": 6505,
        "contract": "contracts/CErc20Upgradable.sol:CErc20Upgradable",
        "label": "totalSupply",
        "offset": 0,
        "slot": "13",
        "type": "t_uint256"
      },
      {
        "astId": 6509,
        "contract": "contracts/CErc20Upgradable.sol:CErc20Upgradable",
        "label": "accountTokens",
        "offset": 0,
        "slot": "14",
        "type": "t_mapping(t_address,t_uint256)"
      },
      {
        "astId": 6515,
        "contract": "contracts/CErc20Upgradable.sol:CErc20Upgradable",
        "label": "transferAllowances",
        "offset": 0,
        "slot": "15",
        "type": "t_mapping(t_address,t_mapping(t_address,t_uint256))"
      },
      {
        "astId": 6525,
        "contract": "contracts/CErc20Upgradable.sol:CErc20Upgradable",
        "label": "accountBorrows",
        "offset": 0,
        "slot": "16",
        "type": "t_mapping(t_address,t_struct(BorrowSnapshot)6520_storage)"
      },
      {
        "astId": 6532,
        "contract": "contracts/CErc20Upgradable.sol:CErc20Upgradable",
        "label": "reserveGuardian",
        "offset": 0,
        "slot": "17",
        "type": "t_address_payable"
      },
      {
        "astId": 6858,
        "contract": "contracts/CErc20Upgradable.sol:CErc20Upgradable",
        "label": "underlying",
        "offset": 0,
        "slot": "18",
        "type": "t_address"
      }
    ],
    "types": {
      "t_address": {
        "encoding": "inplace",
        "label": "address",
        "numberOfBytes": "20"
      },
      "t_address_payable": {
        "encoding": "inplace",
        "label": "address payable",
        "numberOfBytes": "20"
      },
      "t_bool": {
        "encoding": "inplace",
        "label": "bool",
        "numberOfBytes": "1"
      },
      "t_contract(ComptrollerInterface)10289": {
        "encoding": "inplace",
        "label": "contract ComptrollerInterface",
        "numberOfBytes": "20"
      },
      "t_contract(InterestRateModel)11425": {
        "encoding": "inplace",
        "label": "contract InterestRateModel",
        "numberOfBytes": "20"
      },
      "t_mapping(t_address,t_mapping(t_address,t_uint256))": {
        "encoding": "mapping",
        "key": "t_address",
        "label": "mapping(address => mapping(address => uint256))",
        "numberOfBytes": "32",
        "value": "t_mapping(t_address,t_uint256)"
      },
      "t_mapping(t_address,t_struct(BorrowSnapshot)6520_storage)": {
        "encoding": "mapping",
        "key": "t_address",
        "label": "mapping(address => struct CTokenStorage.BorrowSnapshot)",
        "numberOfBytes": "32",
        "value": "t_struct(BorrowSnapshot)6520_storage"
      },
      "t_mapping(t_address,t_uint256)": {
        "encoding": "mapping",
        "key": "t_address",
        "label": "mapping(address => uint256)",
        "numberOfBytes": "32",
        "value": "t_uint256"
      },
      "t_string_storage": {
        "encoding": "bytes",
        "label": "string",
        "numberOfBytes": "32"
      },
      "t_struct(BorrowSnapshot)6520_storage": {
        "encoding": "inplace",
        "label": "struct CTokenStorage.BorrowSnapshot",
        "members": [
          {
            "astId": 6517,
            "contract": "contracts/CErc20Upgradable.sol:CErc20Upgradable",
            "label": "principal",
            "offset": 0,
            "slot": "0",
            "type": "t_uint256"
          },
          {
            "astId": 6519,
            "contract": "contracts/CErc20Upgradable.sol:CErc20Upgradable",
            "label": "interestIndex",
            "offset": 0,
            "slot": "1",
            "type": "t_uint256"
          }
        ],
        "numberOfBytes": "64"
      },
      "t_uint256": {
        "encoding": "inplace",
        "label": "uint256",
        "numberOfBytes": "32"
      },
      "t_uint8": {
        "encoding": "inplace",
        "label": "uint8",
        "numberOfBytes": "1"
      }
    }
  }
}